exp	commit	accuracy	time	complete	feasible	improved	status	tag	description
E071	601464f	0.757	4.837827846000437	True	yes	yes	discard	I081	Exploit: the pre-registered contingency from E068. Halving the head lr cost 0.35 pp on dev, so test the opposite direction. On the current tip (E067 code as committed: 2/2/3 net, 2x20+2x24+3x28+2.5x32 px with warmup and Lookahead anchored in absolute steps, head output scale 2x, ls 0.4, BN-bias multiplier as in E067; official 0.7544, dev 0.7573, held-out 0.7562 @ 4.85 s), double the head-weight lr in the SGD head group, keep the head scale at 2x and change nothing else. If the lr is a value in the GPU schedule tensor, nothing needs recapturing; otherwise recapture all graphs in build. Log the absolute head:BN-bias lr ratio. Run the official seeds plus dev seeds 3-12; do not touch held-out seeds 13-22. Contingency: if dev rises by 0.15 pp or more, try 3x the head lr next. If dev falls by 0.15 pp or more, the head lr is bracketed at 1x and H1.10.2 closes.
