exp	commit	accuracy	time	complete	feasible	improved	status	tag	description
E042	0990325	0.7524	6.496270195336062	True	no	no	discard	I048	Exploit, a numerically equivalent throughput cut. On the current tip (E038: 2x20+3x24+2x28+4x32 px, 2/3/3 net, Muon at batch 1536 with AOL plus 2 NS steps, conv1 block frozen at 32 px, ls 0.4; 0.7546 @ 6.68 s), replace the head's AdaptiveMaxPool2d(1) with x.flatten(2).amax(2), or an equivalent amax over dims (2,3), in every resolution's forward. Change nothing else. Recapture all 4 CUDA graphs and the eval path in build. Confirm that eval still returns finite [B,100] logits for B in {1, 7, 513, 1024}. In the smoke test, log ms/step per phase and a one-step profiler line for the pooling backward kernel (atomic adaptive_max_pool2d_backward vs the amax backward).
E043	c52afda	0.7556666666666667	6.767745280332747	True	yes	no	discard	I049	Exploit and add margin by fixing a BN-statistics mismatch (D004 C0031/C0035). Lookahead copies the slow weights into the model at the end of training, but the BN running statistics were accumulated under the fast iterates, and the frozen block's stats under the detach regime. At the end of train(), after the final Lookahead sync, reset all BN running stats. Re-estimate them with cumulative averaging (momentum=None) from 6 forward-only batches of 1536 un-augmented, un-flipped 32 px training images (no_grad, fp16, channels_last). Draw the images with the trial-seeded generator, then restore BN momentum. Do the re-estimation pass in a small CUDA graph or compiled function warmed up in build on synthetic data, so its first call costs nothing extra in the timed region. Training data only; the test set is never touched. Change nothing else on E038. Run salt 0 and salt 1.
E044	e17f872	0.7567	7.375050830334658	True	yes	no	discard	I050	Exploit and buy margin through cheap deep capacity, at equal epochs (the test E008 confounded). On E038, widen group 3 from 576 to 768 channels (128/384/768) at every resolution and adjust the head input to match. Keep epochs, resolution schedule, LR schedule, Muon lr/momentum, ls 0.4, freezing and the whitening-bias window fixed. Recapture all 4 graphs in build. Log ms/step per phase. Run salt 0 and salt 1.
E045	b173f21	0.7480333333333333	6.602837004999553	True	no	no	discard	I051	Exploit, removing low-res backward work. On E038, train the whitening-conv bias for only the first ~0.25 epoch (8 steps at batch 1536), as Fable and Hiverge do, instead of the first 5 epochs. After that, detach the whitening output (after its activation) in every phase, including 20 and 24 px. The 20/24 px phases then also skip the first group-1 conv's dgrad and the whitening BN/activation backward. Capture a no-detach 20 px graph for the first 8 steps plus the detached 20/24 px graphs in build, so nothing is captured in the timed region (5 graphs in total). Drop the whitening bias from the optimizer, or zero its lr, after step 8. Change nothing else.
E046	aefd92b	0.7546333333333333	6.679000861666282	True	yes	yes	discard	I052	Calibration (no recipe change), to set the keep rule. Using the existing internal salt / trial-seed plumbing, run the E038 tip recipe on dev seeds 3-12 outside the official command (10 trials, same code), and log per-seed accuracy and time. Nothing is kept from this run. The result replaces the 2-salt guesses with a 10-seed estimate of the recipe's true mean and per-seed std, and tests whether official seeds 0-2 are a favourable draw: salt-1 draws came in lower three times (E027, E034, E039).
E047	356cba2	0.7534666666666666	6.660121027998684	True	yes	yes	discard	I053	Exploit, a kernel-efficiency cut in the most expensive phase. On E038, during the 4 epochs at 32 px, switch the frozen first group-1 block's BatchNorm to eval mode: it uses fixed running stats, gets no batch-stat reductions and no stat updates. Before entering the 32 px phase, re-estimate that one BN's running stats from 2 forward-only 32 px training batches (cumulative average), so its fixed affine matches the 32 px input distribution. Fold it into a per-channel scale/shift fused after the conv if inductor allows. Capture the modified 32 px graph and the tiny re-estimation pass in build. Change nothing else.
E048	76baf37	0.7511666666666666	6.549229322331182	True	no	no	discard	I056	Exploit by stacking two near-misses. On E038 (2x20+3x24+2x28+4x32 px, 2/3/3, Muon with AOL plus 2 NS steps, conv1 block frozen at 32 px, ls 0.4; 6.68 s), make two changes. (1) Re-apply E042's pooling cut: replace the head's AdaptiveMaxPool2d(1) with x.flatten(2).max(dim=2).values at every resolution and in eval. Use the indices-based backward, not amax, because amax crashed in E041. (2) Add E043's end-of-train BN re-estimation with 4 batches instead of 6. After the final Lookahead sync, reset all BN running stats. Re-estimate them with momentum=None from 4 forward-only batches of 1536 un-augmented 32 px training images, drawn with the trial-seeded generator, under no_grad, fp16 and channels_last. Then restore BN momentum. Put the re-estimation pass in a small graph or compiled function warmed up in build on synthetic data. Recapture all 4 train graphs in build. Check that eval gives finite [B,100] logits for B in {1, 7, 513, 1024}. Besides the official run, evaluate the same code on dev seeds 3-12 outside the official command, so the BN-re-estimation gain is measured against E046's 10-seed baseline of 0.7534 with SE about 0.09 pp, not against a single draw.
E049	d88cd86	0.7526666666666667	6.454035505999248	True	no	no	discard	I057	Exploit, removing low-res backward work at a phase boundary, so no new graph is needed. On the current tip (idea A's stack if kept, else E038 plus the pooling cut), train the whitening-conv bias only during the 20 px phase (epochs 1-2, about 64 steps) instead of epochs 1-5. In the 24 px phase, detach the whitening output (after its activation) before group 1, as the 28/32 px graphs already do, and zero the whitening bias lr or drop it from that phase's parameter list. The 24 px graph is recaptured in build with the detach. The 20 px graph is unchanged and the graph count stays 4. This is the 2-epoch window between E045's 8 steps (failed, -0.47 pp) and E029's 3 epochs (neutral), aligned with the 20->24 px boundary. Also evaluate dev seeds 3-12. Log ms/step in the 24 px phase.
E050	0a6bef5	0.7523666666666666	6.429294671332173	True	no	no	discard	I058	Exploit, extending the FreezeOut-style cut. On the current tip (idea A's stack if kept, else E038 plus the pooling cut), also freeze the first group-1 conv block (whitening-output -> 128 conv, pool, BN, GELU) during the 2 epochs at 28 px, exactly as already done at 32 px. In the 28 px graph, detach the block's output before the second group-1 conv. Drop that conv's weight and BN affine params from the 28 px phase's Muon/SGD lists, or zero their lr. BN stays in train mode. Recapture the 28 px graph in build; the graph count is unchanged. conv1 is then trained only in the 5 epochs at 20/24 px. Evaluate dev seeds 3-12 alongside the official run. Log ms/step per phase.
E051	a2ee7ae	0.7532333333333333	6.68824416166414	True	yes	no	discard	I059	Exploit, buying margin through the smallest group-3 capacity step. Before the official run, microbenchmark ms/step per phase on the current recipe (graphed, Muon included) for group-3 widths 576 and 640. Do not reuse E004/E044 deltas: the E044 post-mortem showed that the cost structure has shifted. If 640 costs <=+4% ms/step, then on the current tip (with the pooling cut) widen group 3 from 576 to 640 at every resolution and adjust the head input. Hold epochs, resolutions, LR schedule, Muon lr/momentum, ls, freezing and the bias window fixed. Recapture all graphs in build. Run official seeds plus dev seeds 3-12. If the microbenchmark shows >+5%, log it and do not run.
E052	5651736	0.7335333333333334	6.716738741997688	True	no	no	discard	I054	Explore a margin source inside Muon at no time cost. On E038, replace the 2 fixed quintic NS steps that follow AOL preconditioning with Polar Express per-iteration minimax coefficients for 2 iterations (arXiv 2505.16932), with the lower singular-value bound set to ~1e-3 and the safety factor from the paper. AOL already bounds sigma_max <= 1. Use the same matmul count, the same lr 0.205, momentum 0.655 and per-step renorm. Before running, validate offline on 3 real momentum-gradient matrices captured from a dev training step (not Gaussian; the E035 lesson) that the smallest decile of singular values is lifted higher than with the current coefficients. Recapture all graphs in build. Run salt 0 and salt 1.
E053	1907055	0.7574666666666667	6.683600125999267	True	yes	yes	keep	I055	Explore an output knob that has never been swept and costs nothing. On E038 (ls 0.4), multiply the head's fixed output scale (the airbench 1/9-style logit multiplier, rescaled for 100 classes) by 2x and change nothing else. The scale is a graph constant, so recapture all graphs in build. Run salt 0 and salt 1. Contingency: if the 2-salt mean falls by >=0.15 pp, run 0.5x next. Larger smoothing (ls 0.4) lowers the optimal logit magnitude, so the scale and ls interact.
E054	181bd0a	0.7597666666666666	6.700532497998211	True	yes	no	keep	I060	Explore an SGD-era knob never varied under Muon. Note: with per-step weight renorm, weight decay on the Muon conv group is effectively a no-op, so the live knobs are the SGD-group settings. On E038 (or the current tip), halve the BN-bias lr multiplier from 64x to 32x, and change nothing else. Keep Muon lr/momentum, head lr, wd, the schedule and Lookahead fixed. The multiplier lives in the per-group lr. If it is folded into the GPU schedule tensor, no recapture is needed; otherwise recapture in build. Evaluate dev seeds 3-12 plus official seeds. Contingency: if the dev mean falls by >=0.15 pp, run 128x next.
E055	7d2a86e	0.76	6.456583978331764	True	yes	yes	keep	I061	Exploit: spend E053's margin on the two time cuts already measured as accuracy-neutral on dev seeds. On E053 (E038 + head output scale 2x, ls 0.4; official 0.7575, dev 0.7578 @ 6.68 s), make two changes. (1) The pooling cut: replace the head's AdaptiveMaxPool2d(1) with x.flatten(2).max(dim=2).values at every resolution and in eval. Use the indices-based backward, not amax (amax crashed in E041). (2) E049's 2-epoch whitening-bias window: train the whitening-conv bias only in the 20 px phase, and in the 24 px graph detach the whitening output after its activation and zero the bias lr. Keep the graph count at 4, recapture everything in build, and change nothing else. Check that eval returns finite [B,100] logits for B in {1, 7, 513, 1024}. Run the official seeds plus dev seeds 3-12.
E056	04620ef	0.7567666666666667	6.34172046733147	True	yes	yes	keep	I062	Exploit, the next banked cut, stacked on the current tip (idea A's stack if kept, else E053). Move one 32 px epoch to 28 px, giving 2x20+3x24+3x28+3x32: 11 epochs, the LR triangle and Lookahead over total steps, the same 4 graphs. The 28 px graph keeps conv1 trainable, as now (E050 showed conv1 needs its 28 px updates). Change nothing else. Run the official seeds plus dev seeds 3-12, and compare against the tip's own dev mean.
E057	b99e114	0.7624666666666666	6.358395767335121	True	yes	no	discard	I063	Explore, continuing the only margin source found since E030. On the current tip (A's stack if kept, else E053), raise the head's fixed output scale from 2x to 3x the original airbench-derived value. ls stays 0.4 and nothing else changes. The scale is a graph constant, so recapture all graphs in build. Run the official seeds plus dev seeds 3-12. Contingency: if dev rises >=0.15 pp, try 4x next. If it falls >=0.15 pp, 2x is near the optimum; then test ls 0.3 at 2x scale, since the scale and ls interact.
E058	7ee1a8c	0.7567666666666667	5.982331962331955	True	yes	yes	keep	I064	Exploit, and measure the tail slope in the cheap direction now that margin exists. On the current tip, cut the 32 px phase from 4 to 3.5 epochs (16 fewer steps at batch 1536 with drop_last). Keep the LR triangle and Lookahead over total steps, as in E032, which added the same half-epoch. Change nothing else; no new graphs. Run the official seeds plus dev seeds 3-12. E032's +0.5 epoch at 32 px bought -0.06 pp on one draw, so the tail may be saturated and a trim could be cheap.
E059	c93232d	0.7565333333333334	5.245695041664779	True	yes	yes	keep	I065	Exploit, a work-removal cut in group 2 that has not yet been tried. First microbenchmark ms/step per phase on the current recipe (graphed, Muon included) for group 2 at 3 vs 2 convs. If the 2-conv version saves >=3% ms/step, cut group 2 from 3 convs to 2 (net 2/2/3) at the same width 384, keeping the pooling position, and adjust the Muon batched-NS shape groups. Hold epochs, resolutions, schedule, ls, head scale, freezing and the bias window fixed. Recapture all graphs in build. Run the official seeds plus dev seeds 3-12. If the microbenchmark saves <2%, log it and do not run.
E060	22f9466	0.7565333333333334	5.2521151810021065	True	yes	no	discard	I066	Explore, a diagnostic only, run outside the official command and the timed region, with no recipe change. After training on dev seeds 3-7 (5 trials), compute un-augmented top-1 accuracy and mean loss on a fixed 10k training subset (drawn with a fixed generator) for two configs: the current tip and E038 (head scale 1x). Test accuracy is logged as usual. Nothing is kept. This tells us whether the head-scale gain came from better fit or less over-regularization, and whether the recipe under-fits (margin from steps or capacity) or has a large gap (margin from regularization).
E061	c3db435	0.756	5.2423515553333955	True	yes	yes	keep	I068	Exploit, a time-free margin source and the pre-registered follow-up to E054. On the E059 tip (2/2/3 net, 2x20+3x24+3x28+2.5x32 px, head scale 2x, ls 0.4, BN-bias lr multiplier 32x; official 0.7565, dev 0.7557 @ 5.25 s), halve the BN-bias lr multiplier again, from 32x to 16x, and change nothing else. Muon lr/momentum, head lr, SGD-group wd and momentum, schedule, Lookahead, resolutions, freezing and the bias window all stay fixed. If the multiplier is folded into the GPU schedule tensor, nothing needs recapturing; otherwise recapture all graphs in build. Run the official seeds plus dev seeds 3-12 and compare against E059's own dev mean (0.7557). Contingency: if dev rises >=0.15 pp, try 8x next; if it falls >=0.15 pp, 32x is near the optimum and the BN-bias axis is closed.
E062	7471cd8	0.7503333333333333	4.8244341696651345	True	no	no	discard	I069	Exploit, work removal in group 3, extending E059's finding that one 8x8 group-2 conv cost ~0.73 s for only -0.15 pp. First microbenchmark ms/step per phase on the current recipe (graphed, Muon included) for group 3 at 3 vs 2 convs. If the 2-conv version saves >=4%, cut group 3 from 3 convs to 2 (net 2/2/2, airbench94-style) at width 576, keeping the pooling position and head. Remove the 576x5184 matrix from the batched-NS shape groups; it is the largest Muon matrix. Hold epochs, resolutions, schedule, ls, head scale, BN-bias multiplier, freezing and the bias window fixed. Recapture all graphs in build. Check that eval returns finite [B,100] logits for B in {1, 7, 513, 1024}. Run the official seeds plus dev seeds 3-12. If the microbenchmark saves <3%, log it and do not run. Run this after the BN-bias 16x idea, on whichever base is then the tip.
E063	0692219	0.7533333333333333	5.576227698334454	True	yes	no	discard	I071	Explore whether anchor-fixed low-res steps buy margin, rebased onto the 2/2/3 net, where an epoch is now much cheaper. On the E059 tip, add one 20 px epoch at the start (3x20+3x24+3x28+2.5x32). Fix the LR warmup length and the Lookahead alpha ramp in absolute steps at their E059 values; the decay portion absorbs the extra 32 steps. The whitening bias trains through the whole 20 px phase (3 epochs; E029 found 3-5 epochs neutral), so no new graph is needed. Change nothing else. Run the official seeds plus dev seeds 3-12. Compare against E036's -0.27 pp, where the anchors moved.
E064	0261af0	0.7552	5.233504214333759	True	yes	yes	discard	I072	Explore a time-free Muon schedule knob (D004 C0029/C0030, cyclical momentum). On the E059 tip, turn the Muon momentum from a graph constant into a per-step GPU schedule tensor that runs opposite to the LR triangle: 0.72 at step 0, falling linearly to 0.60 at peak LR, then rising linearly back to 0.72 at the end (mean ≈ the current 0.655). The Nesterov form, lr, SGD groups, Lookahead, resolutions and everything else stay fixed. Recapture all graphs in build. Run the official seeds plus dev seeds 3-12.
E065	0f4f9af	0.7574666666666666	5.2389930073331925	True	yes	yes	keep	I073	Exploit: the pre-registered BN-bias follow-up, which adds margin at no time cost. On the E061 tip (2/2/3 net, 2x20+3x24+3x28+2.5x32 px, head scale 2x, ls 0.4, BN-bias lr multiplier 16x; official 0.7560, dev 0.7586 @ 5.24 s), halve the BN-bias lr multiplier from 16x to 8x. Change nothing else: Muon lr and momentum, head lr, SGD-group wd and momentum, schedule, Lookahead, resolutions, freezing and the whitening-bias window all stay fixed. If the multiplier lives in the GPU schedule tensor, no recapture is needed; otherwise recapture all graphs in build. Log the absolute BN-bias:head lr ratio before and after (the references sit at about 1:10-1:13). Run the official seeds plus dev seeds 3-12 and compare against E061's dev mean of 0.7586. Contingency: if dev rises by 0.15 pp or more, try 4x next. If dev falls by 0.15 pp or more, 16x brackets the optimum and the BN-bias axis is closed.
E066	0f3745e	0.7581	4.956266843997582	True	yes	yes	discard	I074	Exploit: width-based work removal in group 2, the cheapest remaining structural lever now that the depth floors are reached. First microbenchmark ms/step per phase on the E061 recipe (graphed, Muon included) for group 2 at width 384 vs 320, in both of its convs. Widening to 448 cost +13.6% per trial, so a large saving is expected. If 320 saves at least 4% per trial, narrow group 2 from 384 to 320 on the E061 tip: adjust the group-3 entry conv (320→576), the group-2 BN params and the Muon batched-NS shape groups. Hold epochs, resolutions, schedule, ls, head scale, BN-bias multiplier, freezing and the bias window fixed. Recapture all graphs in build. Check that eval returns finite [B,100] logits for B in {1, 7, 513, 1024}. Run the official seeds plus dev seeds 3-12. If the microbenchmark saves under 3%, log it and do not run.
E067	515a931	0.7543666666666666	4.845287099667378	True	yes	yes	keep	I075	Exploit: remove an early low-res epoch, since E036 and E063 show the early phase is saturated. On the E061 tip, drop one 24 px epoch, giving 2x20+2x24+3x28+2.5x32 (32 fewer steps). Fix the LR warmup length and the Lookahead alpha ramp in absolute steps at their E061 values, so the decay portion absorbs the shortfall; this reuses the anchoring code path from E063. The whitening-bias window (20 px phase only) and the conv1 freeze at 32 px are unchanged. Same 4 graphs, nothing new to capture. Run the official seeds plus dev seeds 3-12 and compare against E061's dev mean of 0.7586.
E068	d6c1ddf	0.7547	4.824922271332373	True	yes	yes	discard	I076	Exploit, separating the two knobs that E053 confounded. On the E061 tip, keep the head output scale at 2x and halve the head-weight lr (in the SGD head group), changing nothing else. Under Agarwala et al., the effective head lr scales as lr·β², so the 2x scale also quadrupled the effective head step. Halving the lr tests whether part of E053's +0.44 pp came from temperature and part was a too-large head step. The lr is a per-group value in the schedule tensor, so recapture only if it is a graph constant. Run the official seeds plus dev seeds 3-12. Contingency: if dev falls by 0.15 pp or more, run 2x head lr next. If |Δ| < 0.1 pp, the head lr is not a live knob at this scale; close H1.10.2.
E069	58fb51b	0.7568	4.835299554002025	True	yes	yes	discard	I077	Calibration against the winner's curse, with no recipe change and nothing kept. Run the E061 tip code unchanged on fresh held-out seeds 13-22 (10 trials) outside the official command, using the existing trial-seed plumbing. Log per-seed accuracy and time. Seeds 13-22 then stay out of all selection, and are used only for the final pre-submission check of whichever tip exists at the end. Dev seeds 3-12 have now driven about 6 keep decisions (E053, E054, E055, E056, E058, E061), so the dev mean of the current tip is likely biased upward.
E070	2d9dc5a	0.7558	4.9251122719991445	True	yes	no	discard	I078	Explore whether orthogonalization quality is still below saturation, a margin source the tree has not tested since E035 and E052 showed steep losses below the current budget. On the E061 tip, add a third fixed-coefficient quintic Newton-Schulz step after AOL preconditioning (AOL + 3), keeping lr 0.205, momentum 0.655 and the per-step renorm. Change nothing else. Recapture all graphs in build. Log Muon ms/step per phase. Run the official seeds plus dev seeds 3-12.
