{"exp": "E050", "idea": "I079", "status": "discard", "measured": {"accuracy": 0.7552, "time": 5.206001658336997, "complete": true}, "forecasts": {"W2": {"metrics": {"time": [5.15, 5.28, 5.45], "accuracy": [0.7495, 0.7533, 0.757]}, "verdict": "inconclusive", "round": 57}, "W3": {"metrics": {"time": [5.14, 5.21, 5.32], "accuracy": [0.7495, 0.7528, 0.756]}, "verdict": "refutes", "round": 57}, "W5": {"metrics": {"time": [5.28, 5.33, 5.4], "accuracy": [0.7495, 0.7527, 0.7555]}, "verdict": "inconclusive", "round": 57}, "W6": {"metrics": {"time": [5.15, 5.27, 5.4], "accuracy": [0.75, 0.753, 0.756]}, "verdict": "inconclusive", "round": 57}}, "hits": {"time": {"W2": true, "W3": true, "W5": false, "W6": true}, "accuracy": {"W2": true, "W3": true, "W5": true, "W6": true}}, "counterexample": [], "stats": {"n": 4, "conflict": 0.0, "verdict_entropy": 0.512, "improve_votes": 0, "improve_entropy": 0.0, "harm_votes": 1, "median": [5.15, 5.275, 5.4]}, "consensus_hit": true, "z": -0.552, "agent_hit": true, "audit": false, "description": "Explore diagnostic plus systems change, with identical math. Recent keep and discard decisions are noise-limited: E042, E045, E046 and E048 all landed between their thresholds, and the tip's seeds 0\u20132 mean has read 0.7532 / 0.7525 / 0.7497 / 0.7544 across four builds of the same commit. Before any f"}
{"exp": "E051", "idea": "I080", "status": "discard", "measured": {"accuracy": 0.7446999999999999, "time": 4.908014092667145, "complete": true}, "forecasts": {"W2": {"metrics": {"time": [4.65, 4.85, 5.05], "accuracy": [0.744, 0.75, 0.755]}, "verdict": "inconclusive", "round": 58}, "W3": {"metrics": {"time": [4.62, 4.76, 4.92], "accuracy": [0.738, 0.7455, 0.752]}, "verdict": "refutes", "round": 58}, "W5": {"metrics": {"time": [4.7, 4.82, 4.96], "accuracy": [0.7405, 0.7465, 0.752]}, "verdict": "refutes", "round": 58}, "W6": {"metrics": {"time": [4.8, 4.97, 5.12], "accuracy": [0.742, 0.7495, 0.755]}, "verdict": "inconclusive", "round": 58}}, "hits": {"time": {"W2": true, "W3": true, "W5": true, "W6": true}, "accuracy": {"W2": true, "W3": true, "W5": true, "W6": true}}, "counterexample": [], "stats": {"n": 4, "conflict": 0.0, "verdict_entropy": 0.631, "improve_votes": 0, "improve_entropy": 0.0, "harm_votes": 2, "median": [4.675000000000001, 4.835, 5.005]}, "consensus_hit": true, "z": 0.443, "agent_hit": true, "audit": false, "description": "Explore/exploit: remove the last full-resolution tensor from the stem. E047 measured g1.conv1 (24\u2192128 at 31\u00d731) at about 0.45\u00d7 group-2 efficiency, and the 128-channel 31\u00d731 activation feeding the max-pool is the largest memory-bound tensor in the net. E043/E028 showed the stem's 31\u00d731 work costs far"}
{"exp": "E052", "idea": "I081", "status": "discard", "measured": {"accuracy": 0.7554666666666667, "time": 4.987386771666934, "complete": true}, "forecasts": {"W2": {"metrics": {"time": [5.05, 5.17, 5.3], "accuracy": [0.7495, 0.7528, 0.756]}, "verdict": "inconclusive", "round": 59}, "W3": {"metrics": {"time": [5.06, 5.15, 5.24], "accuracy": [0.7485, 0.7525, 0.7565]}, "verdict": "inconclusive", "round": 59}, "W5": {"metrics": {"time": [4.98, 5.07, 5.16], "accuracy": [0.7485, 0.752, 0.7555]}, "verdict": "inconclusive", "round": 59}, "W6": {"metrics": {"time": [5.1, 5.19, 5.3], "accuracy": [0.7495, 0.7528, 0.756]}, "verdict": "inconclusive", "round": 59}}, "hits": {"time": {"W2": false, "W3": false, "W5": true, "W6": false}, "accuracy": {"W2": true, "W3": true, "W5": true, "W6": true}}, "counterexample": [], "stats": {"n": 4, "conflict": 0.0, "verdict_entropy": 0.0, "improve_votes": 0, "improve_entropy": 0.0, "harm_votes": 0, "median": [5.055, 5.16, 5.27]}, "consensus_hit": false, "z": -1.606, "agent_hit": true, "audit": false, "description": "Exploit, combining two near-misses. Conditional: run only after I075 reports. Base: I075's recipe (group-2 freeze plus a +0.25 epoch top-up) if its 20-seed mean is within 0.03 pp of same-build E036 or above it; otherwise E036. Add E048's loss-based selection exactly as committed in 4ffd290: per-samp"}
{"exp": "E053", "idea": "I083", "status": "discard", "measured": {"accuracy": 0.7561666666666667, "time": 5.07470796033158, "complete": true}, "forecasts": {"W2": {"metrics": {"time": [5, 5.1, 5.22], "accuracy": [0.7495, 0.7525, 0.7555]}, "verdict": "inconclusive", "round": 60}, "W3": {"metrics": {"time": [5, 5.08, 5.17], "accuracy": [0.7482, 0.7523, 0.7563]}, "verdict": "inconclusive", "round": 60}, "W5": {"metrics": {"time": [5.04, 5.09, 5.14], "accuracy": [0.7488, 0.7522, 0.7556]}, "verdict": "inconclusive", "round": 60}, "W6": {"metrics": {"time": [5.04, 5.12, 5.2], "accuracy": [0.7495, 0.7525, 0.7555]}, "verdict": "inconclusive", "round": 60}}, "hits": {"time": {"W2": true, "W3": true, "W5": true, "W6": true}, "accuracy": {"W2": false, "W3": true, "W5": false, "W6": false}}, "counterexample": [], "stats": {"n": 4, "conflict": 0.0, "verdict_entropy": 0.0, "improve_votes": 0, "improve_entropy": 0.0, "harm_votes": 0, "median": [5.02, 5.095, 5.1850000000000005]}, "consensus_hit": true, "z": -0.246, "agent_hit": true, "audit": false, "description": "Keep I082 as queued: the group-2 freeze dose test. Base: the E049 tip (237 steps; group-2 LR annealed 75%\u21920 at 90%; last 10% group-2-frozen). Move the group-2 freeze start from 90% to 85% of steps, with the group-2 LR annealed from 70% (the 32 px switch) to 0 by 85%. The frozen-group-2 32 px variant"}
{"exp": "E054", "idea": "I084", "status": "discard", "measured": {"accuracy": 0.7498666666666667, "time": 4.98940229100117, "complete": true}, "forecasts": {"W2": {"metrics": {"time": [4.98, 5.08, 5.18], "accuracy": [0.7485, 0.7523, 0.7555]}, "verdict": "inconclusive", "round": 62}, "W3": {"metrics": {"time": [4.86, 4.94, 5.03], "accuracy": [0.7482, 0.7522, 0.7562]}, "verdict": "inconclusive", "round": 62}, "W5": {"metrics": {"time": [4.93, 5, 5.08], "accuracy": [0.7495, 0.7532, 0.7565]}, "verdict": "inconclusive", "round": 62}, "W6": {"metrics": {"time": [4.98, 5.08, 5.18], "accuracy": [0.749, 0.7525, 0.7558]}, "verdict": "inconclusive", "round": 62}}, "hits": {"time": {"W2": true, "W3": true, "W5": true, "W6": true}, "accuracy": {"W2": true, "W3": true, "W5": true, "W6": true}}, "counterexample": [], "stats": {"n": 4, "conflict": 0.0, "verdict_entropy": 0.0, "improve_votes": 1, "improve_entropy": 0.811, "harm_votes": 0, "median": [4.955, 5.04, 5.13]}, "consensus_hit": true, "z": -0.578, "agent_hit": true, "audit": false, "description": "Explore, proposing a new H2.6 child: the stem needs a steady adaptation signal, not a gradient on every step. Intermittent stem backward in the 28 px phase, which is the most expensive phase (about 71 steps \u00d7 ~26 ms \u2248 1.8 s). On the E049 tip, on every second step of the 28 px phase (40\u201370% of steps)"}
{"exp": "E055", "idea": "I085", "status": "discard", "measured": {"accuracy": 0.7519, "time": 5.128265508993839, "complete": true}, "forecasts": {"W2": {"metrics": {"time": [5.07, 5.14, 5.21], "accuracy": [0.7485, 0.7522, 0.7555]}, "verdict": "inconclusive", "round": 62}, "W3": {"metrics": {"time": [5.04, 5.11, 5.18], "accuracy": [0.748, 0.7524, 0.7565]}, "verdict": "inconclusive", "round": 62}, "W5": {"metrics": {"time": [5.08, 5.13, 5.18], "accuracy": [0.7495, 0.753, 0.7565]}, "verdict": "inconclusive", "round": 62}, "W6": {"metrics": {"time": [5.08, 5.14, 5.2], "accuracy": [0.748, 0.7518, 0.7552]}, "verdict": "inconclusive", "round": 62}}, "hits": {"time": {"W2": true, "W3": true, "W5": true, "W6": true}, "accuracy": {"W2": true, "W3": true, "W5": true, "W6": true}}, "counterexample": [], "stats": {"n": 4, "conflict": 0.0, "verdict_entropy": 0.0, "improve_votes": 1, "improve_entropy": 0.811, "harm_votes": 0, "median": [5.075, 5.135, 5.1899999999999995]}, "consensus_hit": true, "z": -0.117, "agent_hit": true, "audit": false, "description": "Decisive test of E037's mechanism: a 32 px adaptation cliff, or a linear freeze dose? On the E049 tip, move only the group-1 freeze start from 75% to 71% of steps, just after the 28\u219232 px switch at 70% (about step 168 of 237). Group 1 then sees about 2 steps at 32 px before its LR reaches 0. Anneal "}
{"exp": "E056", "idea": "I086", "status": "discard", "measured": {"accuracy": 0.752, "time": 4.952750553997855, "complete": true}, "forecasts": {"W2": {"metrics": {"time": [5, 5.12, 5.22], "accuracy": [0.7495, 0.7525, 0.756]}, "verdict": "inconclusive", "round": 63}, "W3": {"metrics": {"time": [4.98, 5.1, 5.22], "accuracy": [0.7472, 0.7515, 0.7558]}, "verdict": "refutes", "round": 63}, "W5": {"metrics": {"time": [5.03, 5.1, 5.2], "accuracy": [0.7485, 0.7518, 0.755]}, "verdict": "refutes", "round": 63}, "W6": {"metrics": {"time": [5.05, 5.14, 5.22], "accuracy": [0.7495, 0.7525, 0.7555]}, "verdict": "inconclusive", "round": 63}}, "hits": {"time": {"W2": false, "W3": false, "W5": false, "W6": false}, "accuracy": {"W2": true, "W3": true, "W5": true, "W6": true}}, "counterexample": ["time"], "stats": {"n": 4, "conflict": 0.0, "verdict_entropy": 0.631, "improve_votes": 0, "improve_entropy": 0.0, "harm_votes": 0, "median": [5.015000000000001, 5.109999999999999, 5.22]}, "consensus_hit": false, "z": -1.534, "agent_hit": true, "audit": false, "description": "Sharpened replacement for I078, gated on the committee's shared crux (do ReLU's saved bytes reach 3%?). Step 1 is offline, with no repo change. On the E049 tip code with synthetic channels_last batch-2000 data, compile the 32 px whitening-detached, group-1-frozen and group-1+2-frozen steps and the 2"}
{"exp": "E057", "idea": "I088", "status": "discard", "measured": {"accuracy": 0.7536333333333334, "time": 5.222976842997014, "complete": true}, "forecasts": {"W2": {"metrics": {"time": [5.14, 5.21, 5.29], "accuracy": [0.7505, 0.7525, 0.7548]}, "verdict": "supports", "round": 65}, "W3": {"metrics": {"time": [5.13, 5.2, 5.28], "accuracy": [0.7505, 0.7538, 0.757]}, "verdict": "supports", "round": 65}, "W5": {"metrics": {"time": [5.17, 5.2, 5.24], "accuracy": [0.7505, 0.7538, 0.757]}, "verdict": "refutes", "round": 65}, "W6": {"metrics": {"time": [5.12, 5.2, 5.28], "accuracy": [0.7505, 0.7528, 0.7552]}, "verdict": "supports", "round": 65}}, "hits": {"time": {"W2": true, "W3": true, "W5": true, "W6": true}, "accuracy": {"W2": true, "W3": true, "W5": true, "W6": true}}, "counterexample": [], "stats": {"n": 4, "conflict": 0.0, "verdict_entropy": 0.512, "improve_votes": 0, "improve_entropy": 0.0, "harm_votes": 0, "median": [5.135, 5.2, 5.28]}, "consensus_hit": true, "z": 0.317, "agent_hit": true, "audit": false, "description": "Diagnostic with no recipe change. It feeds the frozen keep gate (H4.6) and also settles H4.4.3. Build the E049 tip (commit 3df6233) three times, each in a fresh process with its own private TORCHINDUCTOR_CACHE_DIR. Run each build through the harness code path on fresh seeds 33\u201352 (benchmark.run --se"}
{"exp": "E058", "idea": "I089", "status": "discard", "measured": {"accuracy": 0.7521666666666667, "time": 4.999844338002731, "complete": true}, "forecasts": {"W2": {"metrics": {"time": [4.95, 5.04, 5.18], "accuracy": [0.7495, 0.7535, 0.7568]}, "verdict": "inconclusive", "round": 67}, "W3": {"metrics": {"time": [4.95, 5.05, 5.23], "accuracy": [0.7505, 0.7538, 0.757]}, "verdict": "inconclusive", "round": 67}, "W5": {"metrics": {"time": [4.96, 5.01, 5.1], "accuracy": [0.7495, 0.7535, 0.7568]}, "verdict": "supports", "round": 67}, "W6": {"metrics": {"time": [4.93, 5.03, 5.15], "accuracy": [0.75, 0.7528, 0.7558]}, "verdict": "inconclusive", "round": 67}}, "hits": {"time": {"W2": true, "W3": true, "W5": true, "W6": true}, "accuracy": {"W2": true, "W3": true, "W5": true, "W6": true}}, "counterexample": [], "stats": {"n": 4, "conflict": 0.0, "verdict_entropy": 0.512, "improve_votes": 3, "improve_entropy": 0.811, "harm_votes": 0, "median": [4.95, 5.035, 5.165]}, "consensus_hit": true, "z": -0.327, "agent_hit": true, "audit": false, "description": "Exploit plus a gate test. It may re-keep a faster recipe that has already been measured. Before reading any number, freeze the keep gate. Let \u03bc\u0302 be a candidate's 20-seed mean on seeds 33\u201352. Let \u03c3_tot = sqrt(SE20\u00b2 + SD_seed\u00b2/40 + \u03c3_build\u00b2 + 0.05\u00b2), with \u03c3_build taken from the H4.5.1 idea and 0.05 pp"}
{"exp": "E059", "idea": "I090", "status": "discard", "measured": {"accuracy": 0.7542666666666666, "time": 5.193452021335058, "complete": true}, "forecasts": {"W2": {"metrics": {"time": [5, 5.09, 5.2], "accuracy": [0.7505, 0.7535, 0.7565]}, "verdict": "inconclusive", "round": 68}, "W3": {"metrics": {"time": [5.01, 5.08, 5.16], "accuracy": [0.7488, 0.7525, 0.756]}, "verdict": "inconclusive", "round": 68}, "W5": {"metrics": {"time": [5.03, 5.08, 5.13], "accuracy": [0.7505, 0.7533, 0.756]}, "verdict": "inconclusive", "round": 68}, "W6": {"metrics": {"time": [5.03, 5.1, 5.18], "accuracy": [0.751, 0.7535, 0.756]}, "verdict": "inconclusive", "round": 68}}, "hits": {"time": {"W2": true, "W3": false, "W5": false, "W6": false}, "accuracy": {"W2": true, "W3": true, "W5": true, "W6": true}}, "counterexample": [], "stats": {"n": 4, "conflict": 0.0, "verdict_entropy": 0.0, "improve_votes": 3, "improve_entropy": 0.811, "harm_votes": 0, "median": [5.02, 5.085, 5.17]}, "consensus_hit": false, "z": 1.446, "agent_hit": true, "audit": false, "description": "Re-measure the post-freeze epoch dial in the time-favourable direction, with no new code. E049 minus 0.25 true epoch is exactly E046 (commit 8a2452a: same group-2 freeze at 231 steps, all schedules as fractions). In the same session as the H4.5.1 builds, build E046 once and run it on seeds 33\u201352 and"}
{"exp": "E060", "idea": "I093", "status": "keep", "measured": {"accuracy": 0.7533, "time": 5.177854930007015, "complete": true}, "forecasts": {"W2": {"metrics": {"time": [5.1, 5.17, 5.26], "accuracy": [0.7505, 0.7533, 0.7565]}, "verdict": "inconclusive", "round": 68}, "W3": {"metrics": {"time": [5.09, 5.16, 5.24], "accuracy": [0.7492, 0.753, 0.7566]}, "verdict": "inconclusive", "round": 68}, "W5": {"metrics": {"time": [5.12, 5.17, 5.23], "accuracy": [0.7495, 0.7527, 0.7558]}, "verdict": "inconclusive", "round": 68}, "W6": {"metrics": {"time": [5.1, 5.18, 5.26], "accuracy": [0.7505, 0.7532, 0.756]}, "verdict": "inconclusive", "round": 68}}, "hits": {"time": {"W2": true, "W3": true, "W5": true, "W6": true}, "accuracy": {"W2": true, "W3": true, "W5": true, "W6": true}}, "counterexample": [], "stats": {"n": 4, "conflict": 0.0, "verdict_entropy": 0.0, "improve_votes": 3, "improve_entropy": 0.811, "harm_votes": 0, "median": [5.1, 5.17, 5.25]}, "consensus_hit": true, "z": 0.105, "agent_hit": true, "audit": false, "description": "Exploit, a near-free truncation. On the E049 tip, move the whitening-bias detach from 20% to 6% of steps (about step 14 of 237, inside the 20 px phase), with the whitening-bias LR annealed to 0 by 6% instead of 20%. The whitening-detached variants already exist at every resolution, so there are no n"}
{"exp": "E061", "idea": "I095", "status": "keep", "measured": {"accuracy": 0.7534, "time": 5.023500388672498, "complete": true}, "forecasts": {"W2": {"metrics": {"time": [4.95, 5.06, 5.16], "accuracy": [0.7495, 0.752, 0.755]}, "verdict": "refutes", "round": 71}, "W3": {"metrics": {"time": [4.94, 4.99, 5.06], "accuracy": [0.7475, 0.7515, 0.7555]}, "verdict": "inconclusive", "round": 71}, "W5": {"metrics": {"time": [5.08, 5.135, 5.19], "accuracy": [0.7475, 0.751, 0.7545]}, "verdict": "inconclusive", "round": 71}, "W6": {"metrics": {"time": [5.04, 5.11, 5.18], "accuracy": [0.7495, 0.7522, 0.7552]}, "verdict": "refutes", "round": 71}}, "hits": {"time": {"W2": true, "W3": true, "W5": false, "W6": false}, "accuracy": {"W2": true, "W3": true, "W5": true, "W6": true}}, "counterexample": [], "stats": {"n": 4, "conflict": 0.167, "verdict_entropy": 0.631, "improve_votes": 0, "improve_entropy": 0.0, "harm_votes": 0, "median": [4.995, 5.085, 5.17]}, "consensus_hit": true, "z": -0.703, "agent_hit": true, "audit": false, "description": "Exploit: re-test a near-miss that was discarded on biased seeds, now priced at the new dial. E041 (remove 12 early 20 px steps) read \u22120.20 pp on seeds 3\u201312 right after those seeds selected E036, and that was already about the new 0.77 s/pp dial. On the E049 tip, remove only 12 steps from the 20 px p"}
{"exp": "E062", "idea": "I096", "status": "discard", "measured": {"accuracy": 0.7237, "time": 4.743637117329247, "complete": true}, "forecasts": {"W2": {"metrics": {"time": [4.9, 5, 5.12], "accuracy": [0.742, 0.7495, 0.7545]}, "verdict": "refutes", "round": 72}, "W3": {"metrics": {"time": [4.76, 4.86, 4.97], "accuracy": [0.742, 0.7485, 0.7545]}, "verdict": "supports", "round": 72}, "W5": {"metrics": {"time": [4.76, 4.85, 4.96], "accuracy": [0.7435, 0.749, 0.7535]}, "verdict": "supports", "round": 72}, "W6": {"metrics": {"time": [4.88, 4.97, 5.08], "accuracy": [0.747, 0.7505, 0.7545]}, "verdict": "refutes", "round": 72}}, "hits": {"time": {"W2": false, "W3": false, "W5": false, "W6": false}, "accuracy": {"W2": false, "W3": false, "W5": false, "W6": false}}, "counterexample": ["time", "accuracy"], "stats": {"n": 4, "conflict": 0.0, "verdict_entropy": 0.631, "improve_votes": 0, "improve_entropy": 0.0, "harm_votes": 0, "median": [4.82, 4.915, 5.025]}, "consensus_hit": false, "z": -1.672, "agent_hit": true, "audit": false, "description": "Explore, the largest untested optimizer axis. It is now cheap to judge because the break-even loss is about 0.25 pp at the 0.77 s/pp dial. On the E049 tip, replace Muon on every conv filter group (group 1, group 2 and group 3) with Nesterov SGD. Use momentum 0.85, airbench's value, as in E005's comm"}
{"exp": "E064", "idea": "I099", "status": "discard", "measured": {"accuracy": 0.7512333333333333, "time": 4.838014391328518, "complete": true}, "forecasts": {"W2": {"metrics": {"time": [4.78, 4.88, 4.98], "accuracy": [0.7485, 0.7518, 0.7548]}, "verdict": "inconclusive", "round": 74}, "W3": {"metrics": {"time": [4.79, 4.85, 4.91], "accuracy": [0.747, 0.7515, 0.756]}, "verdict": "inconclusive", "round": 74}, "W5": {"metrics": {"time": [4.8, 4.88, 4.96], "accuracy": [0.7475, 0.7515, 0.755]}, "verdict": "inconclusive", "round": 74}, "W6": {"metrics": {"time": [4.82, 4.9, 4.99], "accuracy": [0.749, 0.7522, 0.7552]}, "verdict": "inconclusive", "round": 74}}, "hits": {"time": {"W2": true, "W3": true, "W5": true, "W6": true}, "accuracy": {"W2": true, "W3": true, "W5": true, "W6": true}}, "counterexample": [], "stats": {"n": 4, "conflict": 0.0, "verdict_entropy": 0.0, "improve_votes": 0, "improve_entropy": 0.0, "harm_votes": 0, "median": [4.795, 4.88, 4.970000000000001]}, "consensus_hit": true, "z": -0.48, "agent_hit": false, "audit": false, "description": "Exploit: the second step of the early-trim dose curve. E061 removed 12 steps from the 20 px phase for \u22123.0% time at \u22120.02 pp on 40 fresh draws. On the E061 tip (225 steps; 20/24/28/32 px at about 59/24/71/71 steps), remove 12 more steps from the 20 px phase only (225 \u2192 213; 20 px about 47 steps). Th"}
{"exp": "E065", "idea": "I104", "status": "discard", "measured": {"accuracy": 0.7560666666666667, "time": 5.028791770998699, "complete": true}, "forecasts": {"W2": {"metrics": {"time": [4.96, 5.03, 5.1], "accuracy": [0.7495, 0.7535, 0.757]}, "verdict": "inconclusive", "round": 76}, "W3": {"metrics": {"time": [4.96, 5.04, 5.12], "accuracy": [0.7485, 0.7525, 0.7565]}, "verdict": "inconclusive", "round": 76}, "W5": {"metrics": {"time": [4.96, 5.03, 5.1], "accuracy": [0.7495, 0.7532, 0.7565]}, "verdict": "inconclusive", "round": 76}, "W6": {"metrics": {"time": [4.95, 5.02, 5.1], "accuracy": [0.7505, 0.7535, 0.7562]}, "verdict": "inconclusive", "round": 76}}, "hits": {"time": {"W2": true, "W3": true, "W5": true, "W6": true}, "accuracy": {"W2": true, "W3": true, "W5": true, "W6": true}}, "counterexample": [], "stats": {"n": 4, "conflict": 0.0, "verdict_entropy": 0.0, "improve_votes": 1, "improve_entropy": 0.811, "harm_votes": 0, "median": [4.96, 5.03, 5.1]}, "consensus_hit": true, "z": -0.017, "agent_hit": true, "audit": false, "description": "Exploit: a time-neutral test that separates the two parts of the freeze-dose cost. On the E061 tip (225 steps), change only the end point of the group-1 LR anneal (conv filters on Muon; BN params on SGD): it moves from 75% to 80% of steps, so group 1's LR decays more slowly over the whole run. The g"}
