{"exp": "E035", "idea": "I053", "status": "keep", "measured": {"accuracy": 0.7548333333333334, "time": 5.445709792669125, "complete": true}, "forecasts": {"W1": {"metrics": {"time": [5.78, 5.83, 5.89], "accuracy": [0.7543, 0.7547, 0.7551]}, "verdict": "supports", "round": 35}, "W2": {"metrics": {"time": [5.33, 5.42, 5.5], "accuracy": [0.7525, 0.7539, 0.7553]}, "verdict": "supports", "round": 38}, "W3": {"metrics": {"time": [5.38, 5.44, 5.52], "accuracy": [0.7533, 0.7539, 0.7545]}, "verdict": "inconclusive", "round": 38}, "W5": {"metrics": {"time": [5.4, 5.44, 5.49], "accuracy": [0.7535, 0.7539, 0.7543]}, "verdict": "inconclusive", "round": 38}, "W6": {"metrics": {"time": [5.3, 5.4, 5.5], "accuracy": [0.7505, 0.7539, 0.757]}, "verdict": "supports", "round": 38}}, "hits": {"time": {"W1": false, "W2": true, "W3": true, "W5": true, "W6": true}, "accuracy": {"W1": true, "W2": true, "W3": false, "W5": false, "W6": true}}, "counterexample": [], "stats": {"n": 5, "conflict": 0.4, "verdict_entropy": 0.613, "improve_votes": 4, "improve_entropy": 0.722, "harm_votes": 1, "median": [5.38, 5.44, 5.5]}, "consensus_hit": true, "z": 0.095, "agent_hit": true, "audit": false, "description": "Exploit and crux test (W5: does a math-identical change keep the tip's per-seed outcomes?). Base: the current tip (E027, or the H2.6.2 successor if kept). Change only systems work in prepare, keeping every number bit-identical. (1) Move the training images to the GPU as uint8 and do the float conver"}
{"exp": "E036", "idea": "I054", "status": "keep", "measured": {"accuracy": 0.7532333333333333, "time": 5.31434218333258, "complete": true}, "forecasts": {"W1": {"metrics": {"time": [5.7, 5.79, 5.87], "accuracy": [0.7505, 0.754, 0.7575]}, "verdict": "refutes", "round": 35}, "W2": {"metrics": {"time": [5.2, 5.36, 5.5], "accuracy": [0.7505, 0.7535, 0.7565]}, "verdict": "inconclusive", "round": 39}, "W3": {"metrics": {"time": [5.3, 5.37, 5.45], "accuracy": [0.7495, 0.7535, 0.7575]}, "verdict": "inconclusive", "round": 39}, "W5": {"metrics": {"time": [5.3, 5.37, 5.45], "accuracy": [0.7505, 0.7535, 0.7565]}, "verdict": "inconclusive", "round": 39}, "W6": {"metrics": {"time": [5.3, 5.4, 5.5], "accuracy": [0.751, 0.7535, 0.756]}, "verdict": "inconclusive", "round": 39}}, "hits": {"time": {"W1": false, "W2": true, "W3": true, "W5": true, "W6": true}, "accuracy": {"W1": true, "W2": true, "W3": true, "W5": true, "W6": true}}, "counterexample": [], "stats": {"n": 5, "conflict": 0.4, "verdict_entropy": 0.455, "improve_votes": 4, "improve_entropy": 0.722, "harm_votes": 1, "median": [5.3, 5.37, 5.5]}, "consensus_hit": true, "z": -0.557, "agent_hit": true, "audit": false, "description": "Exploit. First read the code. If the whitening bias already stops training before 25% of steps, close H2.6.3 without a run. Otherwise, on the H2.6.2 successor (or E027 if it is not kept), stop the whitening bias's gradient after 20% of steps (Hiverge; airbench96 trains it for 3/45 epochs). Use a thi"}
{"exp": "E037", "idea": "I055", "status": "discard", "measured": {"accuracy": 0.7494, "time": 5.068743683332286, "complete": true}, "forecasts": {"W1": {"metrics": {"time": [5, 5.13, 5.27], "accuracy": [0.7475, 0.7518, 0.7555]}, "verdict": "inconclusive", "round": 35}, "W2": {"metrics": {"time": [5.05, 5.19, 5.32], "accuracy": [0.7495, 0.7525, 0.7555]}, "verdict": "inconclusive", "round": 40}, "W3": {"metrics": {"time": [5, 5.11, 5.22], "accuracy": [0.7475, 0.7515, 0.7555]}, "verdict": "inconclusive", "round": 40}, "W5": {"metrics": {"time": [4.95, 5.05, 5.16], "accuracy": [0.7475, 0.7512, 0.7548]}, "verdict": "inconclusive", "round": 40}, "W6": {"metrics": {"time": [5.12, 5.22, 5.32], "accuracy": [0.7495, 0.7523, 0.7552]}, "verdict": "refutes", "round": 40}}, "hits": {"time": {"W1": true, "W2": true, "W3": true, "W5": true, "W6": false}, "accuracy": {"W1": true, "W2": false, "W3": true, "W5": true, "W6": false}}, "counterexample": [], "stats": {"n": 5, "conflict": 0.0, "verdict_entropy": 0.455, "improve_votes": 0, "improve_entropy": 0.0, "harm_votes": 0, "median": [5, 5.13, 5.27]}, "consensus_hit": true, "z": -0.454, "agent_hit": true, "audit": false, "description": "Exploit, the freeze dose. Run only once the H2.6.2 successor is kept, and on it. Move the group-1 and whitening-bias freeze start from 75% to 60% of steps. The group-1 LR is annealed to 0 by 60%. Everything else is unchanged, including the step count, resolution phases and LR/Lookahead schedules. Th"}
{"exp": "E038", "idea": "I056", "status": "discard", "measured": {"accuracy": 0.7525000000000001, "time": 5.333879142664955, "complete": true}, "forecasts": {"W1": {"metrics": {"time": [5.84, 5.88, 5.92], "accuracy": [0.7543, 0.7547, 0.7551]}, "verdict": "refutes", "round": 35}, "W2": {"metrics": {"time": [5.25, 5.31, 5.4], "accuracy": [0.7495, 0.7525, 0.7555]}, "verdict": "inconclusive", "round": 40}, "W3": {"metrics": {"time": [5.26, 5.31, 5.37], "accuracy": [0.7525, 0.7532, 0.754]}, "verdict": "inconclusive", "round": 40}, "W5": {"metrics": {"time": [5.27, 5.315, 5.36], "accuracy": [0.7528, 0.7532, 0.7536]}, "verdict": "inconclusive", "round": 40}, "W6": {"metrics": {"time": [5.27, 5.32, 5.4], "accuracy": [0.7505, 0.7528, 0.7552]}, "verdict": "inconclusive", "round": 40}}, "hits": {"time": {"W1": false, "W2": true, "W3": true, "W5": true, "W6": true}, "accuracy": {"W1": false, "W2": true, "W3": true, "W5": false, "W6": true}}, "counterexample": [], "stats": {"n": 5, "conflict": 0.4, "verdict_entropy": 0.455, "improve_votes": 1, "improve_entropy": 0.722, "harm_votes": 1, "median": [5.27, 5.315, 5.4]}, "consensus_hit": true, "z": 0.29, "agent_hit": true, "audit": false, "description": "Validation diagnostic, with no recipe change. Run it immediately after a candidate tip is kept (the H2.6.2 successor, or whatever is the tip once H2.6.3/H3.2.1 are stacked). Seeds 3\u201312 have driven about 10 keep decisions and carry a winner's curse. Run the committed recipe offline on fresh seeds 13\u2013"}
{"exp": "E039", "idea": "I057", "status": "discard", "measured": {"accuracy": 0.7512333333333333, "time": 5.282147257334145, "complete": true}, "forecasts": {"W1": {"metrics": {"time": [5.22, 5.32, 5.43], "accuracy": [0.748, 0.7525, 0.756]}, "verdict": "refutes", "round": 35}, "W2": {"metrics": {"time": [5.1, 5.24, 5.36], "accuracy": [0.7495, 0.7525, 0.756]}, "verdict": "inconclusive", "round": 42}, "W3": {"metrics": {"time": [5.2, 5.28, 5.36], "accuracy": [0.7485, 0.7522, 0.756]}, "verdict": "refutes", "round": 42}, "W5": {"metrics": {"time": [5.24, 5.29, 5.34], "accuracy": [0.7505, 0.7525, 0.7548]}, "verdict": "refutes", "round": 42}, "W6": {"metrics": {"time": [5.12, 5.23, 5.34], "accuracy": [0.7495, 0.7525, 0.7552]}, "verdict": "inconclusive", "round": 42}}, "hits": {"time": {"W1": true, "W2": true, "W3": true, "W5": true, "W6": true}, "accuracy": {"W1": true, "W2": true, "W3": true, "W5": true, "W6": true}}, "counterexample": [], "stats": {"n": 5, "conflict": 0.0, "verdict_entropy": 0.613, "improve_votes": 0, "improve_entropy": 0.0, "harm_votes": 0, "median": [5.2, 5.28, 5.36]}, "consensus_hit": true, "z": 0.027, "agent_hit": true, "audit": false, "description": "Explore, the next memory-bound lever on the frozen stem. On the H2.6.2 successor (or the freeze recipe in fcacfc6), at the freeze point: run one no-grad train-mode forward of group 1 over the current batch to set its BN running stats. Use the existing buffers if their values are already the frozen-p"}
{"exp": "E040", "idea": "I060", "status": "discard", "measured": {"accuracy": 0.7526333333333334, "time": 5.197897818000153, "complete": true}, "forecasts": {"W2": {"metrics": {"time": [5.15, 5.24, 5.32], "accuracy": [0.7495, 0.7527, 0.7557]}, "verdict": "inconclusive", "round": 43}, "W3": {"metrics": {"time": [5.14, 5.2, 5.26], "accuracy": [0.7485, 0.7524, 0.7565]}, "verdict": "inconclusive", "round": 43}, "W5": {"metrics": {"time": [5.13, 5.2, 5.27], "accuracy": [0.7493, 0.7522, 0.7555]}, "verdict": "inconclusive", "round": 43}, "W6": {"metrics": {"time": [5.18, 5.25, 5.32], "accuracy": [0.7495, 0.7524, 0.7552]}, "verdict": "inconclusive", "round": 43}}, "hits": {"time": {"W2": true, "W3": true, "W5": true, "W6": true}, "accuracy": {"W2": true, "W3": true, "W5": true, "W6": true}}, "counterexample": [], "stats": {"n": 4, "conflict": 0.0, "verdict_entropy": 0.0, "improve_votes": 0, "improve_entropy": 0.0, "harm_votes": 0, "median": [5.145, 5.220000000000001, 5.295]}, "consensus_hit": true, "z": -0.295, "agent_hit": true, "audit": false, "description": "Exploit: finish the early-resolution dial. The tip is E036 (9.25 true epochs, about 231 steps at batch 2000; 20/24/28/32 px at 30/10/30/30%; whitening bias detached after 20%; group-1 freeze at 75%). Change only the resolution split, from 30/10/30/30 to 40/0/30/30: the 24 px phase (about 23 steps) n"}
{"exp": "E041", "idea": "I061", "status": "discard", "measured": {"accuracy": 0.7513, "time": 5.148561150665046, "complete": true}, "forecasts": {"W2": {"metrics": {"time": [5.1, 5.19, 5.28], "accuracy": [0.749, 0.752, 0.755]}, "verdict": "inconclusive", "round": 45}, "W3": {"metrics": {"time": [5.08, 5.14, 5.2], "accuracy": [0.7485, 0.752, 0.7555]}, "verdict": "inconclusive", "round": 45}, "W5": {"metrics": {"time": [5.13, 5.18, 5.23], "accuracy": [0.7495, 0.752, 0.7545]}, "verdict": "refutes", "round": 45}, "W6": {"metrics": {"time": [5.17, 5.22, 5.28], "accuracy": [0.7495, 0.7522, 0.7548]}, "verdict": "inconclusive", "round": 45}}, "hits": {"time": {"W2": true, "W3": true, "W5": true, "W6": false}, "accuracy": {"W2": true, "W3": true, "W5": true, "W6": true}}, "counterexample": [], "stats": {"n": 4, "conflict": 0.0, "verdict_entropy": 0.512, "improve_votes": 0, "improve_entropy": 0.0, "harm_votes": 0, "median": [5.115, 5.1850000000000005, 5.255000000000001]}, "consensus_hit": true, "z": -0.521, "agent_hit": true, "audit": false, "description": "Exploit: non-uniform trim. Run it on the I-40/0/30/30 successor if kept, otherwise on the E036 tip. Remove only 12 steps from the 20 px phase (231 \u2192 219 total steps). The 28 px and 32 px phases keep their exact absolute step counts. The whitening-bias detach stays at the same absolute step (about 46"}
{"exp": "E042", "idea": "I062", "status": "discard", "measured": {"accuracy": 0.7549333333333333, "time": 5.266676663668477, "complete": true}, "forecasts": {"W2": {"metrics": {"time": [5.12, 5.2, 5.29], "accuracy": [0.749, 0.752, 0.755]}, "verdict": "inconclusive", "round": 46}, "W3": {"metrics": {"time": [5.16, 5.24, 5.31], "accuracy": [0.748, 0.7518, 0.7555]}, "verdict": "inconclusive", "round": 46}, "W5": {"metrics": {"time": [5.25, 5.28, 5.31], "accuracy": [0.7495, 0.7518, 0.754]}, "verdict": "refutes", "round": 46}, "W6": {"metrics": {"time": [5.17, 5.24, 5.3], "accuracy": [0.7495, 0.7518, 0.7545]}, "verdict": "refutes", "round": 46}}, "hits": {"time": {"W2": true, "W3": true, "W5": true, "W6": true}, "accuracy": {"W2": true, "W3": true, "W5": false, "W6": false}}, "counterexample": [], "stats": {"n": 4, "conflict": 0.0, "verdict_entropy": 0.631, "improve_votes": 0, "improve_entropy": 0.0, "harm_votes": 0, "median": [5.165, 5.24, 5.305]}, "consensus_hit": true, "z": 0.381, "agent_hit": true, "audit": false, "description": "Explore/exploit: staggered FreezeOut, which separates where E037's cliff came from. First read group 1's structure in the code. If, as in airbench, the pool follows group 1's first conv, that conv (24\u2192128 on 31\u00d731 maps) and the pool are the only full-resolution work left once the whitening is detach"}
{"exp": "E043", "idea": "I058", "status": "discard", "measured": {"accuracy": 0.7496666666666667, "time": 5.294019336669105, "complete": true}, "forecasts": {"W1": {"metrics": {"time": [5.84, 5.88, 5.92], "accuracy": [0.7543, 0.7547, 0.7551]}, "verdict": "supports", "round": 35}, "W2": {"metrics": {"time": [5.3, 5.314, 5.33], "accuracy": [0.7532, 0.7532, 0.7532]}, "verdict": "inconclusive", "round": 46}, "W3": {"metrics": {"time": [5.26, 5.32, 5.38], "accuracy": [0.7524, 0.7532, 0.754]}, "verdict": "supports", "round": 46}, "W5": {"metrics": {"time": [5.29, 5.315, 5.34], "accuracy": [0.751, 0.7528, 0.7548]}, "verdict": "supports", "round": 46}, "W6": {"metrics": {"time": [5.28, 5.314, 5.35], "accuracy": [0.7532, 0.75323, 0.7533]}, "verdict": "supports", "round": 46}}, "hits": {"time": {"W1": false, "W2": false, "W3": true, "W5": true, "W6": true}, "accuracy": {"W1": false, "W2": false, "W3": false, "W5": false, "W6": false}}, "counterexample": ["accuracy"], "stats": {"n": 5, "conflict": 0.4, "verdict_entropy": 0.455, "improve_votes": 2, "improve_entropy": 0.971, "harm_votes": 1, "median": [5.29, 5.315, 5.35]}, "consensus_hit": true, "z": -0.699, "agent_hit": true, "audit": false, "description": "Explore diagnostic, with no recipe change. It sets the value of the remaining stem levers (H2.6.4/H2.6.5/H2.6.3) and the PCIe-transfer caveat in H4.3. Offline, run torch.profiler on the tip's compiled 32 px full step and truncated step, and on the 24 px step, with batch 2000 and synthetic channels_l"}
{"exp": "E044", "idea": "I067", "status": "discard", "measured": {"accuracy": 0.7518666666666667, "time": 5.342197174000224, "complete": true}, "forecasts": {"W2": {"metrics": {"time": [5.28, 5.36, 5.5], "accuracy": [0.7495, 0.7535, 0.7575]}, "verdict": "inconclusive", "round": 49}, "W3": {"metrics": {"time": [5.3, 5.36, 5.43], "accuracy": [0.7485, 0.7522, 0.756]}, "verdict": "inconclusive", "round": 49}, "W5": {"metrics": {"time": [5.31, 5.35, 5.4], "accuracy": [0.7495, 0.7528, 0.756]}, "verdict": "inconclusive", "round": 49}, "W6": {"metrics": {"time": [5.28, 5.36, 5.46], "accuracy": [0.7495, 0.7535, 0.757]}, "verdict": "inconclusive", "round": 49}}, "hits": {"time": {"W2": true, "W3": true, "W5": true, "W6": true}, "accuracy": {"W2": true, "W3": true, "W5": true, "W6": true}}, "counterexample": [], "stats": {"n": 4, "conflict": 0.0, "verdict_entropy": 0.0, "improve_votes": 0, "improve_entropy": 0.0, "harm_votes": 0, "median": [5.29, 5.36, 5.445]}, "consensus_hit": true, "z": -0.23, "agent_hit": true, "audit": false, "description": "Exploit: a booster that leaves the training trajectory unchanged. It replaces I064 with a paired design that has no trajectory noise. On the E036 tip, at the end of train() and after the final Lookahead copy (which lerps BN running_mean/var from different fast weights and never recomputes them): res"}
{"exp": "E045", "idea": "I068", "status": "discard", "measured": {"accuracy": 0.752, "time": 5.514287654659711, "complete": true}, "forecasts": {"W2": {"metrics": {"time": [5.3, 5.45, 5.65], "accuracy": [0.7495, 0.7535, 0.7575]}, "verdict": "inconclusive", "round": 50}, "W3": {"metrics": {"time": [5.45, 5.56, 5.68], "accuracy": [0.7485, 0.7528, 0.757]}, "verdict": "inconclusive", "round": 50}, "W5": {"metrics": {"time": [5.42, 5.56, 5.72], "accuracy": [0.7495, 0.7535, 0.757]}, "verdict": "inconclusive", "round": 50}, "W6": {"metrics": {"time": [5.3, 5.42, 5.62], "accuracy": [0.7495, 0.7535, 0.7575]}, "verdict": "inconclusive", "round": 50}}, "hits": {"time": {"W2": true, "W3": true, "W5": true, "W6": true}, "accuracy": {"W2": true, "W3": true, "W5": true, "W6": true}}, "counterexample": [], "stats": {"n": 4, "conflict": 0.0, "verdict_entropy": 0.0, "improve_votes": 0, "improve_entropy": 0.0, "harm_votes": 2, "median": [5.359999999999999, 5.505, 5.665]}, "consensus_hit": true, "z": 0.061, "agent_hit": true, "audit": true, "description": "Explore/booster, the step-count crux (W3, W5). E041 found that removing early 20 px steps cost as much as a uniform trim. That suggests early accuracy is carried by optimizer steps, not by pixels. On the E036 tip, use batch 1000 instead of 2000 only during the 20 px phase (the first 30% of data pass"}
{"exp": "E046", "idea": "I070", "status": "discard", "measured": {"accuracy": 0.7539666666666667, "time": 5.0786617846655036, "complete": true}, "forecasts": {"W2": {"metrics": {"time": [5.2, 5.27, 5.34], "accuracy": [0.749, 0.752, 0.7552]}, "verdict": "inconclusive", "round": 51}, "W3": {"metrics": {"time": [5.08, 5.17, 5.26], "accuracy": [0.7475, 0.7515, 0.7555]}, "verdict": "inconclusive", "round": 51}, "W5": {"metrics": {"time": [5.08, 5.15, 5.23], "accuracy": [0.7468, 0.7505, 0.7538]}, "verdict": "refutes", "round": 51}, "W6": {"metrics": {"time": [5.1, 5.2, 5.3], "accuracy": [0.7485, 0.7515, 0.7545]}, "verdict": "inconclusive", "round": 51}}, "hits": {"time": {"W2": false, "W3": false, "W5": false, "W6": false}, "accuracy": {"W2": true, "W3": true, "W5": false, "W6": true}}, "counterexample": ["time"], "stats": {"n": 4, "conflict": 0.0, "verdict_entropy": 0.512, "improve_votes": 0, "improve_entropy": 0.0, "harm_votes": 0, "median": [5.09, 5.1850000000000005, 5.279999999999999]}, "consensus_hit": false, "z": -1.119, "agent_hit": true, "audit": false, "description": "Exploit, staggered FreezeOut cascade. This is the only remaining backward-truncation lever that targets the largest block, group 2 (~51% of conv MACs). On the E036 tip, put the group-2 conv filters (Muon) and group-2 BN params (SGD) in their own param groups. Their LR follows the global schedule unt"}
{"exp": "E047", "idea": "I071", "status": "discard", "measured": {"accuracy": 0.7544, "time": 5.343233577664553, "complete": true}, "forecasts": {"W2": {"metrics": {"time": [5.27, 5.31, 5.36], "accuracy": [0.75, 0.753, 0.7555]}, "verdict": "inconclusive", "round": 51}, "W3": {"metrics": {"time": [5.26, 5.31, 5.37], "accuracy": [0.749, 0.7522, 0.7555]}, "verdict": "refutes", "round": 51}, "W5": {"metrics": {"time": [5.29, 5.32, 5.36], "accuracy": [0.7493, 0.7522, 0.7552]}, "verdict": "refutes", "round": 51}, "W6": {"metrics": {"time": [5.28, 5.31, 5.35], "accuracy": [0.7495, 0.7532, 0.757]}, "verdict": "supports", "round": 51}}, "hits": {"time": {"W2": true, "W3": true, "W5": true, "W6": true}, "accuracy": {"W2": true, "W3": true, "W5": true, "W6": true}}, "counterexample": [], "stats": {"n": 4, "conflict": 0.0, "verdict_entropy": 0.946, "improve_votes": 2, "improve_entropy": 1.0, "harm_votes": 0, "median": [5.275, 5.31, 5.36]}, "consensus_hit": true, "z": 0.782, "agent_hit": true, "audit": false, "description": "Explore diagnostic, with no recipe change. It replaces I058 and adds the overhead accounting from W5's crux. Offline, on the E036 tip with synthetic channels_last data at batch 2000: (1) torch.profiler traces of the compiled 32 px full step, the whitening-detached step, the frozen step and the 20/24"}
{"exp": "E048", "idea": "I072", "status": "discard", "measured": {"accuracy": 0.7518, "time": 4.981051848337908, "complete": true}, "forecasts": {"W2": {"metrics": {"time": [5, 5.1, 5.22], "accuracy": [0.7485, 0.7515, 0.7545]}, "verdict": "inconclusive", "round": 52}, "W3": {"metrics": {"time": [4.97, 5.06, 5.16], "accuracy": [0.7478, 0.7515, 0.7552]}, "verdict": "inconclusive", "round": 52}, "W5": {"metrics": {"time": [4.97, 5.05, 5.14], "accuracy": [0.748, 0.7512, 0.7545]}, "verdict": "inconclusive", "round": 52}, "W6": {"metrics": {"time": [5.1, 5.19, 5.28], "accuracy": [0.7485, 0.7512, 0.754]}, "verdict": "inconclusive", "round": 52}}, "hits": {"time": {"W2": false, "W3": true, "W5": true, "W6": false}, "accuracy": {"W2": true, "W3": true, "W5": true, "W6": true}}, "counterexample": [], "stats": {"n": 4, "conflict": 0.0, "verdict_entropy": 0.0, "improve_votes": 0, "improve_entropy": 0.0, "harm_votes": 0, "median": [4.984999999999999, 5.08, 5.1899999999999995]}, "consensus_hit": false, "z": -0.965, "agent_hit": true, "audit": false, "description": "Exploit, a milder dose of the E031 near-miss. E031's top-90% selection cost \u22120.27 pp for \u22120.63 s (~2.3 s/pp, nominally better than the dial but within noise). On the E036 tip, return per-sample losses from the compiled step (reduction='none', then mean for backward) and scatter them into a GPU buffe"}
{"exp": "E049", "idea": "I075", "status": "keep", "measured": {"accuracy": 0.7535333333333334, "time": 5.1979249523283215, "complete": true}, "forecasts": {"W2": {"metrics": {"time": [5.08, 5.19, 5.32], "accuracy": [0.7505, 0.7535, 0.7565]}, "verdict": "inconclusive", "round": 54}, "W3": {"metrics": {"time": [5.12, 5.2, 5.28], "accuracy": [0.7495, 0.7535, 0.7575]}, "verdict": "inconclusive", "round": 54}, "W5": {"metrics": {"time": [5.15, 5.2, 5.25], "accuracy": [0.7505, 0.7537, 0.757]}, "verdict": "inconclusive", "round": 54}, "W6": {"metrics": {"time": [5.08, 5.19, 5.32], "accuracy": [0.7505, 0.7535, 0.7565]}, "verdict": "supports", "round": 54}}, "hits": {"time": {"W2": true, "W3": true, "W5": true, "W6": true}, "accuracy": {"W2": true, "W3": true, "W5": true, "W6": true}}, "counterexample": [], "stats": {"n": 4, "conflict": 0.0, "verdict_entropy": 0.512, "improve_votes": 4, "improve_entropy": 0.0, "harm_votes": 0, "median": [5.1, 5.195, 5.300000000000001]}, "consensus_hit": true, "z": 0.029, "agent_hit": true, "audit": false, "description": "Exploit, the decisive test of the E046 crux (W2/W3/W5/W6). On the E036 tip, apply E046's group-2 freeze exactly as committed in 8a2452a. Group-2 filters and BN params get their own groups, with LR annealed from 75% to 0 at 90% of steps. For the last 10% of steps, group 2's output is detached before "}
