{"exp": "E001", "idea": "I001", "status": "keep", "measured": {"accuracy": 0.7429666666666667, "time": 9.431919813000908, "complete": true}, "forecasts": {"W1": {"metrics": {"time": [8.5, 11, 14.5], "accuracy": [0.7, 0.745, 0.765]}, "verdict": "refutes", "round": 2}, "W2": {"metrics": {"time": [7, 11, 18], "accuracy": [0.7, 0.745, 0.77]}, "verdict": "inconclusive", "round": 2}, "W3": {"metrics": {"time": [8, 10.8, 14.5], "accuracy": [0.65, 0.746, 0.765]}, "verdict": "refutes", "round": 2}, "W4": {"metrics": {"time": [6, 9.5, 15], "accuracy": [0.69, 0.738, 0.765]}, "verdict": "refutes", "round": 2}}, "hits": {"time": {"W1": true, "W2": true, "W3": true, "W4": true}, "accuracy": {"W1": true, "W2": true, "W3": true, "W4": true}}, "counterexample": [], "stats": {"n": 4, "conflict": 0.0, "verdict_entropy": 0.512, "improve_votes": 4, "improve_entropy": 0.0, "harm_votes": 0, "median": [7.5, 10.9, 14.75]}, "consensus_hit": true, "z": -0.405, "agent_hit": true, "audit": false, "description": "Replace the template recipe in submissions/arena/ with an airbench96-style port. Architecture: a frozen 2x2 patch-whitening first conv, with whitening computed in prepare from training patches; Dirac init; 3 residual groups of 3 convs at widths 128/384/576; BatchNorm-GELU. Optimizer: Nesterov SGD, l"}
{"exp": "E002", "idea": "I002", "status": "keep", "measured": {"accuracy": 0.7495333333333334, "time": 10.545667999336729, "complete": true}, "forecasts": {"W1": {"metrics": {"time": [9.5, 12.2, 15.5], "accuracy": [0.735, 0.752, 0.765]}, "verdict": "inconclusive", "round": 2}, "W2": {"metrics": {"time": [8, 11.5, 19], "accuracy": [0.7, 0.752, 0.775]}, "verdict": "supports", "round": 2}, "W3": {"metrics": {"time": [9, 11.8, 15.5], "accuracy": [0.7, 0.753, 0.768]}, "verdict": "inconclusive", "round": 2}, "W4": {"metrics": {"time": [6, 10, 16], "accuracy": [0.7, 0.745, 0.77]}, "verdict": "inconclusive", "round": 2}}, "hits": {"time": {"W1": true, "W2": true, "W3": true, "W4": true}, "accuracy": {"W1": true, "W2": true, "W3": true, "W4": true}}, "counterexample": [], "stats": {"n": 4, "conflict": 0.0, "verdict_entropy": 0.512, "improve_votes": 4, "improve_entropy": 0.0, "harm_votes": 0, "median": [8.5, 11.65, 15.75]}, "consensus_hit": true, "z": -0.305, "agent_hit": true, "audit": false, "description": "On the E-port recipe, change only the epoch count: 9 \u2192 8.5 if the port clears 0.753 with at least 0.3 pp margin, otherwise 9 \u2192 10. Everything else stays identical, so this measures the local accuracy-vs-time slope that sets how far epochs can be cut."}
{"exp": "E003", "idea": "I003", "status": "discard", "measured": {"accuracy": 0.7486333333333334, "time": 12.067211381334346, "complete": true}, "forecasts": {"W1": {"metrics": {"time": [7.2, 7.9, 8.9], "accuracy": [0.739, 0.743, 0.747]}, "verdict": "supports", "round": 3}, "W2": {"metrics": {"time": [7.2, 8.5, 10.2], "accuracy": [0.739, 0.7425, 0.747]}, "verdict": "supports", "round": 3}, "W3": {"metrics": {"time": [7.7, 8.4, 9.3], "accuracy": [0.739, 0.743, 0.747]}, "verdict": "supports", "round": 3}, "W4": {"metrics": {"time": [7.6, 8.7, 9.8], "accuracy": [0.739, 0.7425, 0.746]}, "verdict": "supports", "round": 3}}, "hits": {"time": {"W1": false, "W2": false, "W3": false, "W4": false}, "accuracy": {"W1": false, "W2": false, "W3": false, "W4": false}}, "counterexample": ["time", "accuracy"], "stats": {"n": 4, "conflict": 0.0, "verdict_entropy": 0.0, "improve_votes": 0, "improve_entropy": 0.0, "harm_votes": 4, "median": [7.4, 8.45, 9.55]}, "consensus_hit": false, "z": 3.365, "agent_hit": false, "audit": false, "description": "On the port, compile the model's forward+backward with torch.compile (mode='max-autotune-no-cudagraphs') in build. Compile and warm up on synthetic inputs for the train batch shape and the ragged last-batch shape, and in eval mode for B in {1, 7, 512, 1024} (mark the batch dimension dynamic for eval"}
{"exp": "E005", "idea": "I004", "status": "keep", "measured": {"accuracy": 0.7583000000000001, "time": 9.097539043003053, "complete": true}, "forecasts": {"W1": {"metrics": {"time": [9.2, 9.7, 11], "accuracy": [0.739, 0.7465, 0.755]}, "verdict": "inconclusive", "round": 5}, "W2": {"metrics": {"time": [9.3, 9.8, 10.9], "accuracy": [0.739, 0.745, 0.753]}, "verdict": "inconclusive", "round": 5}, "W3": {"metrics": {"time": [9.2, 9.8, 11.3], "accuracy": [0.739, 0.7455, 0.7535]}, "verdict": "inconclusive", "round": 5}, "W4": {"metrics": {"time": [10.2, 10.8, 11.5], "accuracy": [0.746, 0.7505, 0.756]}, "verdict": "inconclusive", "round": 5}}, "hits": {"time": {"W1": false, "W2": false, "W3": false, "W4": false}, "accuracy": {"W1": false, "W2": false, "W3": false, "W4": false}}, "counterexample": ["time", "accuracy"], "stats": {"n": 4, "conflict": 0.0, "verdict_entropy": 0.0, "improve_votes": 1, "improve_entropy": 0.811, "harm_votes": 0, "median": [9.25, 9.8, 11.15]}, "consensus_hit": false, "z": -0.739, "agent_hit": true, "audit": false, "description": "On the port at 9 epochs, add Lookahead/EMA of weights in the airbench96_faster style: update every 5 steps, alpha ramping as in the reference, final weights set to the EMA copy. All EMA state is created and reset in prepare. The forward pass is unchanged."}
{"exp": "E006", "idea": "I007", "status": "keep", "measured": {"accuracy": 0.7649, "time": 9.44608330266783, "complete": true}, "forecasts": {"W1": {"metrics": {"time": [9, 10.3, 12.5], "accuracy": [0.71, 0.739, 0.755]}, "verdict": "refutes", "round": 5}, "W2": {"metrics": {"time": [8.5, 10.5, 14], "accuracy": [0.7, 0.735, 0.752]}, "verdict": "refutes", "round": 5}, "W3": {"metrics": {"time": [9, 10.9, 13.5], "accuracy": [0.68, 0.735, 0.755]}, "verdict": "refutes", "round": 5}, "W4": {"metrics": {"time": [8.5, 10.5, 13], "accuracy": [0.69, 0.735, 0.76]}, "verdict": "refutes", "round": 4}}, "hits": {"time": {"W1": true, "W2": true, "W3": true, "W4": true}, "accuracy": {"W1": false, "W2": false, "W3": false, "W4": false}}, "counterexample": ["accuracy"], "stats": {"n": 4, "conflict": 0.0, "verdict_entropy": 0.0, "improve_votes": 0, "improve_entropy": 0.0, "harm_votes": 1, "median": [8.75, 10.5, 13.25]}, "consensus_hit": true, "z": -0.468, "agent_hit": true, "audit": false, "description": "Explore. On the port backbone, switch the conv filters to Muon: Newton-Schulz-orthogonalized Nesterov momentum, lr about 0.24, momentum 0.6. Keep SGD for BatchNorm params, whitening bias and the head. Batch size 2000 with the same epoch count. Newton-Schulz runs in bf16 with a foreach-style batched "}
{"exp": "E007", "idea": "I008", "status": "keep", "measured": {"accuracy": 0.7590333333333333, "time": 7.328381033667635, "complete": true}, "forecasts": {"W1": {"metrics": {"time": [7.2, 8.2, 9.8], "accuracy": [0.745, 0.7525, 0.758]}, "verdict": "refutes", "round": 6}, "W2": {"metrics": {"time": [7.3, 8.1, 9.6], "accuracy": [0.738, 0.7505, 0.76]}, "verdict": "refutes", "round": 6}, "W3": {"metrics": {"time": [7.2, 8, 9.9], "accuracy": [0.742, 0.751, 0.758]}, "verdict": "refutes", "round": 6}, "W4": {"metrics": {"time": [7.4, 8.4, 9.6], "accuracy": [0.742, 0.7505, 0.7585]}, "verdict": "refutes", "round": 6}}, "hits": {"time": {"W1": true, "W2": true, "W3": true, "W4": false}, "accuracy": {"W1": false, "W2": true, "W3": false, "W4": false}}, "counterexample": [], "stats": {"n": 4, "conflict": 0.0, "verdict_entropy": 0.0, "improve_votes": 0, "improve_entropy": 0.0, "harm_votes": 0, "median": [7.25, 8.149999999999999, 9.7]}, "consensus_hit": true, "z": -0.671, "agent_hit": false, "audit": false, "description": "Explore. On the port, apply progressive resizing: the first about 40% of epochs at 24 px, the next 30% at 28 px, the rest at 32 px (random-resized-crop on the GPU via F.interpolate). Warm up every resolution in build on synthetic data. Epoch count unchanged."}
{"exp": "E008", "idea": "I009", "status": "keep", "measured": {"accuracy": 0.7572333333333333, "time": 6.977379820668527, "complete": true}, "forecasts": {"W1": {"metrics": {"time": [6.3, 6.95, 7.25], "accuracy": [0.75, 0.7555, 0.7595]}, "verdict": "inconclusive", "round": 8}, "W2": {"metrics": {"time": [6.7, 7, 7.4], "accuracy": [0.7525, 0.7565, 0.7605]}, "verdict": "supports", "round": 8}, "W3": {"metrics": {"time": [6.1, 6.55, 7.1], "accuracy": [0.746, 0.7525, 0.758]}, "verdict": "inconclusive", "round": 8}, "W4": {"metrics": {"time": [6.8, 7, 7.25], "accuracy": [0.7515, 0.7555, 0.7585]}, "verdict": "supports", "round": 8}}, "hits": {"time": {"W1": true, "W2": true, "W3": true, "W4": true}, "accuracy": {"W1": true, "W2": true, "W3": true, "W4": true}}, "counterexample": [], "stats": {"n": 4, "conflict": 0.0, "verdict_entropy": 0.631, "improve_votes": 3, "improve_entropy": 0.811, "harm_votes": 0, "median": [6.5, 6.975, 7.25]}, "consensus_hit": true, "z": 0.006, "agent_hit": true, "audit": false, "description": "Exploit. On the E007 recipe (Muon + Lookahead/EMA + progressive resizing 24\u219228\u219232 px, 9 epochs), change only the epoch count from 9 to 8.5. Keep the resolution split as fractions of total steps (about 40/30/30%) and stretch the LR and EMA schedules to the new step count. Warm up every resolution in "}
{"exp": "E009", "idea": "I010", "status": "discard", "measured": {"accuracy": 0.7564333333333333, "time": 6.993527450666686, "complete": true}, "forecasts": {"W1": {"metrics": {"time": [7.15, 7.33, 7.55], "accuracy": [0.7565, 0.7598, 0.7635]}, "verdict": "refutes", "round": 8}, "W2": {"metrics": {"time": [6.9, 7.3, 7.8], "accuracy": [0.7565, 0.7625, 0.768]}, "verdict": "supports", "round": 8}, "W3": {"metrics": {"time": [7.15, 7.33, 7.55], "accuracy": [0.756, 0.7605, 0.765]}, "verdict": "refutes", "round": 8}, "W4": {"metrics": {"time": [7.15, 7.33, 7.55], "accuracy": [0.7565, 0.7605, 0.7645]}, "verdict": "inconclusive", "round": 8}}, "hits": {"time": {"W1": false, "W2": true, "W3": false, "W4": false}, "accuracy": {"W1": false, "W2": false, "W3": true, "W4": false}}, "counterexample": [], "stats": {"n": 4, "conflict": 0.0, "verdict_entropy": 0.946, "improve_votes": 0, "improve_entropy": 0.0, "harm_votes": 3, "median": [7.15, 7.33, 7.55]}, "consensus_hit": false, "z": -1.682, "agent_hit": true, "audit": false, "description": "Exploit. On the E007 recipe at 9 epochs, change only the end of the LR schedule: decay linearly to exactly 0 instead of 0.07 of peak, for both the Muon group and the SGD groups (BN, whitening bias, head). The warm-up, peak and Lookahead/EMA schedule stay unchanged. This tests whether EMA and a lower"}
{"exp": "E010", "idea": "I012", "status": "keep", "measured": {"accuracy": 0.7547666666666667, "time": 6.639434386001085, "complete": true}, "forecasts": {"W1": {"metrics": {"time": [6.55, 6.78, 7], "accuracy": [0.751, 0.755, 0.759]}, "verdict": "refutes", "round": 9}, "W2": {"metrics": {"time": [6.6, 7, 7.3], "accuracy": [0.7535, 0.7575, 0.7615]}, "verdict": "inconclusive", "round": 9}, "W3": {"metrics": {"time": [6.55, 6.74, 6.95], "accuracy": [0.751, 0.7552, 0.759]}, "verdict": "inconclusive", "round": 9}, "W4": {"metrics": {"time": [6.7, 7, 7.35], "accuracy": [0.753, 0.7575, 0.7615]}, "verdict": "inconclusive", "round": 9}}, "hits": {"time": {"W1": true, "W2": true, "W3": true, "W4": false}, "accuracy": {"W1": true, "W2": true, "W3": true, "W4": true}}, "counterexample": [], "stats": {"n": 4, "conflict": 0.0, "verdict_entropy": 0.512, "improve_votes": 2, "improve_entropy": 1.0, "harm_votes": 0, "median": [6.574999999999999, 6.890000000000001, 7.15]}, "consensus_hit": true, "z": -0.872, "agent_hit": true, "audit": false, "description": "Exploit. On the E007 recipe, narrow only the last residual group from 576 to 512 channels (the airbench96_faster width). Keep everything else the same, including the Muon lr, epochs and resizing schedule. Re-warm-up all compiled shapes in build."}
{"exp": "E011", "idea": "I011", "status": "discard", "measured": {"accuracy": 0.7451, "time": 5.703121792665722, "complete": true}, "forecasts": {"W1": {"metrics": {"time": [5.75, 6.1, 6.5], "accuracy": [0.7465, 0.7525, 0.757]}, "verdict": "inconclusive", "round": 10}, "W2": {"metrics": {"time": [5.9, 6.5, 7.1], "accuracy": [0.748, 0.7545, 0.7595]}, "verdict": "inconclusive", "round": 10}, "W3": {"metrics": {"time": [5.95, 6.3, 6.75], "accuracy": [0.7465, 0.7515, 0.756]}, "verdict": "refutes", "round": 10}, "W4": {"metrics": {"time": [5.9, 6.6, 7.3], "accuracy": [0.746, 0.7535, 0.7595]}, "verdict": "inconclusive", "round": 10}}, "hits": {"time": {"W1": false, "W2": false, "W3": false, "W4": false}, "accuracy": {"W1": false, "W2": false, "W3": false, "W4": false}}, "counterexample": ["time", "accuracy"], "stats": {"n": 4, "conflict": 0.0, "verdict_entropy": 0.512, "improve_votes": 2, "improve_entropy": 1.0, "harm_votes": 0, "median": [5.9, 6.4, 6.925]}, "consensus_hit": false, "z": -1.36, "agent_hit": false, "audit": false, "description": "Exploit, building on E007's finding that time scales with pixel count. On the E007 recipe at 9 epochs, use a more aggressive resolution schedule: the first 30% of steps at 20 px, then 30% at 24 px, 20% at 28 px, and the last 20% at 32 px. Each resolution is compiled and warmed up in build with chann"}
{"exp": "E012", "idea": "I016", "status": "discard", "measured": {"accuracy": 0.7547666666666667, "time": 6.646141453333257, "complete": true}, "forecasts": {"W1": {"metrics": {"time": [6.5, 6.65, 6.85], "accuracy": [0.7525, 0.7547, 0.7565]}, "verdict": "supports", "round": 12}, "W2": {"metrics": {"time": [6.5, 6.64, 6.85], "accuracy": [0.7515, 0.7545, 0.7575]}, "verdict": "inconclusive", "round": 12}, "W3": {"metrics": {"time": [6.5, 6.65, 6.85], "accuracy": [0.7525, 0.7548, 0.757]}, "verdict": "inconclusive", "round": 12}, "W4": {"metrics": {"time": [6.5, 6.65, 6.85], "accuracy": [0.7505, 0.7535, 0.7565]}, "verdict": "supports", "round": 12}}, "hits": {"time": {"W1": true, "W2": true, "W3": true, "W4": true}, "accuracy": {"W1": true, "W2": true, "W3": true, "W4": true}}, "counterexample": [], "stats": {"n": 4, "conflict": 0.0, "verdict_entropy": 0.631, "improve_votes": 0, "improve_entropy": 0.0, "harm_votes": 0, "median": [6.5, 6.65, 6.85]}, "consensus_hit": true, "z": -0.022, "agent_hit": true, "audit": false, "description": "Diagnostic that sharpens I013 for the current tip; it makes no recipe change. Run the E010 recipe exactly as committed (Muon, Lookahead/EMA, 24\u219228\u219232 px, 9 epochs, last group 512) offline on held-out seeds 3-12 through the same harness code path. Record per-seed accuracy, the 10-seed mean, the std a"}
{"exp": "E013", "idea": "I017", "status": "discard", "measured": {"accuracy": 0.7551333333333333, "time": 6.629994306999531, "complete": true}, "forecasts": {"W1": {"metrics": {"time": [6.5, 6.65, 6.85], "accuracy": [0.749, 0.7538, 0.758]}, "verdict": "inconclusive", "round": 13}, "W2": {"metrics": {"time": [6.4, 6.65, 6.9], "accuracy": [0.752, 0.7565, 0.761]}, "verdict": "supports", "round": 13}, "W3": {"metrics": {"time": [6.5, 6.64, 6.8], "accuracy": [0.75, 0.7545, 0.759]}, "verdict": "refutes", "round": 13}, "W4": {"metrics": {"time": [6.5, 6.65, 6.85], "accuracy": [0.751, 0.755, 0.759]}, "verdict": "inconclusive", "round": 12}, "W5": {"metrics": {"time": [6.45, 6.64, 6.85], "accuracy": [0.749, 0.7535, 0.757]}, "verdict": "refutes", "round": 13}}, "hits": {"time": {"W1": true, "W2": true, "W3": true, "W4": true, "W5": true}, "accuracy": {"W1": true, "W2": true, "W3": true, "W4": true, "W5": true}}, "counterexample": [], "stats": {"n": 5, "conflict": 0.0, "verdict_entropy": 0.96, "improve_votes": 0, "improve_entropy": 0.0, "harm_votes": 0, "median": [6.5, 6.65, 6.85]}, "consensus_hit": true, "z": -0.114, "agent_hit": true, "audit": false, "description": "Exploit, as a near-free accuracy lever (W1 and W3 crux). On the E010 recipe, change only the label smoothing from 0.3 to 0.2 (the airbench96_faster value) in the training loss. Epochs, resizing, Muon/SGD settings and Lookahead/EMA stay the same, and so do the compiled shapes. Since the loss changes "}
{"exp": "E014", "idea": "I018", "status": "discard", "measured": {"accuracy": 0.7557333333333334, "time": 6.63116790066609, "complete": true}, "forecasts": {"W1": {"metrics": {"time": [6.5, 6.65, 6.85], "accuracy": [0.7485, 0.7542, 0.7595]}, "verdict": "inconclusive", "round": 13}, "W2": {"metrics": {"time": [6.4, 6.65, 6.9], "accuracy": [0.75, 0.7555, 0.7615]}, "verdict": "inconclusive", "round": 13}, "W3": {"metrics": {"time": [6.5, 6.65, 6.8], "accuracy": [0.748, 0.7543, 0.759]}, "verdict": "refutes", "round": 13}, "W4": {"metrics": {"time": [6.5, 6.65, 6.85], "accuracy": [0.749, 0.7545, 0.7595]}, "verdict": "inconclusive", "round": 12}, "W5": {"metrics": {"time": [6.45, 6.64, 6.85], "accuracy": [0.75, 0.7545, 0.758]}, "verdict": "inconclusive", "round": 13}}, "hits": {"time": {"W1": true, "W2": true, "W3": true, "W4": true, "W5": true}, "accuracy": {"W1": true, "W2": true, "W3": true, "W4": true, "W5": true}}, "counterexample": [], "stats": {"n": 5, "conflict": 0.0, "verdict_entropy": 0.455, "improve_votes": 0, "improve_entropy": 0.0, "harm_votes": 0, "median": [6.5, 6.65, 6.85]}, "consensus_hit": true, "z": -0.108, "agent_hit": true, "audit": false, "description": "Exploit. On the E010 recipe, change only the Muon learning rate for the conv filters from 0.24 to 0.36 (\u00d71.5). The SGD groups (BN, whitening bias, head), momentum 0.6, batch size 2000, schedule shape, epochs and Lookahead/EMA stay the same. The 0.24 value comes from CIFAR-10 airbench94_muon, and E00"}
{"exp": "E015", "idea": "I014", "status": "keep", "measured": {"accuracy": 0.7574333333333333, "time": 6.577778801666379, "complete": true}, "forecasts": {"W1": {"metrics": {"time": [6.2, 6.56, 7.6], "accuracy": [0.7505, 0.7548, 0.7585]}, "verdict": "refutes", "round": 16}, "W2": {"metrics": {"time": [5.9, 6.5, 7.3], "accuracy": [0.7515, 0.7548, 0.758]}, "verdict": "inconclusive", "round": 16}, "W3": {"metrics": {"time": [6.1, 6.42, 7.2], "accuracy": [0.751, 0.7548, 0.758]}, "verdict": "inconclusive", "round": 16}, "W4": {"metrics": {"time": [6, 6.5, 7.2], "accuracy": [0.752, 0.7545, 0.757]}, "verdict": "inconclusive", "round": 11}, "W5": {"metrics": {"time": [6.25, 6.5, 6.9], "accuracy": [0.751, 0.7545, 0.758]}, "verdict": "inconclusive", "round": 16}}, "hits": {"time": {"W1": true, "W2": true, "W3": true, "W4": true, "W5": true}, "accuracy": {"W1": true, "W2": true, "W3": true, "W4": false, "W5": true}}, "counterexample": [], "stats": {"n": 5, "conflict": 0.0, "verdict_entropy": 0.455, "improve_votes": 5, "improve_entropy": 0.0, "harm_votes": 0, "median": [6.1, 6.5, 7.2]}, "consensus_hit": true, "z": 0.141, "agent_hit": true, "audit": false, "description": "Explore. On the E007 recipe, capture the train step (forward, backward, Muon Newton-Schulz plus SGD update, and the EMA update on steps where it applies) in CUDA graphs. Use torch.compile mode='max-autotune' (cudagraphs on) or a manual torch.cuda.graph per resolution with static input buffers that t"}
{"exp": "E016", "idea": "I019", "status": "keep", "measured": {"accuracy": 0.7607333333333334, "time": 6.579923757000263, "complete": true}, "forecasts": {"W1": {"metrics": {"time": [6.55, 6.64, 6.75], "accuracy": [0.7505, 0.7546, 0.7585]}, "verdict": "refutes", "round": 16}, "W2": {"metrics": {"time": [6.57, 6.64, 6.72], "accuracy": [0.7515, 0.755, 0.7585]}, "verdict": "inconclusive", "round": 16}, "W3": {"metrics": {"time": [6.55, 6.64, 6.75], "accuracy": [0.751, 0.7547, 0.758]}, "verdict": "refutes", "round": 16}, "W4": {"metrics": {"time": [6.5, 6.65, 6.85], "accuracy": [0.75, 0.7545, 0.7585]}, "verdict": "inconclusive", "round": 12}, "W5": {"metrics": {"time": [6.55, 6.64, 6.75], "accuracy": [0.75, 0.7545, 0.758]}, "verdict": "refutes", "round": 16}}, "hits": {"time": {"W1": true, "W2": true, "W3": true, "W4": true, "W5": true}, "accuracy": {"W1": false, "W2": false, "W3": false, "W4": false, "W5": false}}, "counterexample": ["accuracy"], "stats": {"n": 5, "conflict": 0.0, "verdict_entropy": 0.613, "improve_votes": 0, "improve_entropy": 0.0, "harm_votes": 0, "median": [6.55, 6.64, 6.75]}, "consensus_hit": true, "z": -0.601, "agent_hit": true, "audit": false, "description": "Exploit, as the second point of the coarse grid. On the E010 recipe, halve only the weight decay for all parameter groups (Muon conv filters and SGD groups), keeping the same decoupled or coupled form the code uses now. Everything else stays identical. Short runs with EMA may need less regularizatio"}
{"exp": "E017", "idea": "I021", "status": "keep", "measured": {"accuracy": 0.7537333333333334, "time": 6.54794617266695, "complete": true}, "forecasts": {"W1": {"metrics": {"time": [6.3, 6.48, 6.75], "accuracy": [0.7535, 0.7565, 0.7595]}, "verdict": "refutes", "round": 17}, "W2": {"metrics": {"time": [6.35, 6.52, 6.65], "accuracy": [0.7535, 0.7572, 0.7605]}, "verdict": "refutes", "round": 17}, "W3": {"metrics": {"time": [6.25, 6.5, 6.75], "accuracy": [0.752, 0.7562, 0.76]}, "verdict": "refutes", "round": 17}, "W4": {"metrics": {"time": [6.3, 6.55, 6.8], "accuracy": [0.7505, 0.7548, 0.7585]}, "verdict": "inconclusive", "round": 12}, "W5": {"metrics": {"time": [6.25, 6.47, 6.65], "accuracy": [0.752, 0.7562, 0.76]}, "verdict": "inconclusive", "round": 17}}, "hits": {"time": {"W1": true, "W2": true, "W3": true, "W4": true, "W5": true}, "accuracy": {"W1": true, "W2": true, "W3": true, "W4": true, "W5": true}}, "counterexample": [], "stats": {"n": 5, "conflict": 0.0, "verdict_entropy": 0.613, "improve_votes": 5, "improve_entropy": 0.0, "harm_votes": 0, "median": [6.3, 6.5, 6.75]}, "consensus_hit": true, "z": 0.213, "agent_hit": true, "audit": false, "description": "Explore, settling the W2/W4 crux about launch versus compute. Run torch._dynamo.explain and a short torch.profiler trace offline on the E010 train step on synthetic data: GPU augmentation, forward/backward, Muon+SGD step, Lookahead/EMA update and LR schedule. If there are graph breaks or host syncs "}
