{"exp": "E018", "idea": "I023", "status": "discard", "measured": {"accuracy": 0.7502, "time": 5.993199579002976, "complete": true}, "forecasts": {"W1": {"metrics": {"time": [6, 6.2, 6.38], "accuracy": [0.7505, 0.7567, 0.761]}, "verdict": "supports", "round": 19}, "W2": {"metrics": {"time": [6.6, 6.9, 7.2], "accuracy": [0.7585, 0.7625, 0.766]}, "verdict": "inconclusive", "round": 19}, "W3": {"metrics": {"time": [6, 6.22, 6.42], "accuracy": [0.752, 0.7575, 0.762]}, "verdict": "supports", "round": 19}, "W5": {"metrics": {"time": [6, 6.2, 6.42], "accuracy": [0.751, 0.7565, 0.761]}, "verdict": "supports", "round": 19}}, "hits": {"time": {"W1": false, "W2": false, "W3": false, "W5": false}, "accuracy": {"W1": false, "W2": false, "W3": false, "W5": false}}, "counterexample": ["time", "accuracy"], "stats": {"n": 4, "conflict": 0.5, "verdict_entropy": 0.512, "improve_votes": 3, "improve_entropy": 0.811, "harm_votes": 1, "median": [6.0, 6.21, 6.42]}, "consensus_hit": false, "z": -1.032, "agent_hit": true, "audit": false, "description": "Exploit. Tests a proposed new child of H2.3: accuracy is set mainly in the final 32 px phase, so the 28 px middle phase can be dropped cheaply. On the E015 recipe (Muon, Lookahead/EMA, CUDA graphs, 9 epochs, last group 512), change only the resolution schedule from 24/28/32 px at 40/30/30% of steps "}
{"exp": "E019", "idea": "I030", "status": "discard", "measured": {"accuracy": 0.7540666666666667, "time": 6.5404667533342336, "complete": true}, "forecasts": {"W1": {"metrics": {"time": [6.5, 6.56, 6.65], "accuracy": [0.753, 0.7545, 0.761]}, "verdict": "refutes", "round": 21}, "W2": {"metrics": {"time": [6.48, 6.55, 6.65], "accuracy": [0.7525, 0.7545, 0.757]}, "verdict": "refutes", "round": 21}, "W3": {"metrics": {"time": [6.48, 6.56, 6.66], "accuracy": [0.751, 0.7555, 0.76]}, "verdict": "refutes", "round": 21}, "W5": {"metrics": {"time": [6.48, 6.55, 6.65], "accuracy": [0.752, 0.7537, 0.758]}, "verdict": "refutes", "round": 21}}, "hits": {"time": {"W1": true, "W2": true, "W3": true, "W5": true}, "accuracy": {"W1": true, "W2": true, "W3": true, "W5": true}}, "counterexample": [], "stats": {"n": 4, "conflict": 0.0, "verdict_entropy": 0.0, "improve_votes": 0, "improve_entropy": 0.0, "harm_votes": 0, "median": [6.48, 6.555, 6.65]}, "consensus_hit": true, "z": -0.171, "agent_hit": true, "audit": false, "description": "Diagnostic, making no recipe change. It replaces I025, which pointed at E015, and answers the main crux of W1, W2, W3 and W5: is E016's 0.7607 real margin or a reshuffle? (1) Run the committed E016 recipe offline on held-out seeds 3-12 through the harness code path (benchmark.run --seed 3 --n 10). R"}
{"exp": "E020", "idea": "I031", "status": "discard", "measured": {"accuracy": 0.7527666666666667, "time": 5.861187173000265, "complete": true}, "forecasts": {"W1": {"metrics": {"time": [5.7, 5.88, 6.05], "accuracy": [0.7455, 0.7505, 0.7545]}, "verdict": "inconclusive", "round": 22}, "W2": {"metrics": {"time": [6.15, 6.25, 6.38], "accuracy": [0.7475, 0.7525, 0.757]}, "verdict": "refutes", "round": 22}, "W3": {"metrics": {"time": [5.75, 5.95, 6.15], "accuracy": [0.744, 0.7495, 0.754]}, "verdict": "refutes", "round": 22}, "W5": {"metrics": {"time": [5.75, 5.92, 6.1], "accuracy": [0.7465, 0.7515, 0.756]}, "verdict": "inconclusive", "round": 22}}, "hits": {"time": {"W1": true, "W2": false, "W3": true, "W5": true}, "accuracy": {"W1": true, "W2": true, "W3": true, "W5": true}}, "counterexample": [], "stats": {"n": 4, "conflict": 0.333, "verdict_entropy": 0.631, "improve_votes": 0, "improve_entropy": 0.0, "harm_votes": 0, "median": [5.75, 5.9350000000000005, 6.125]}, "consensus_hit": true, "z": -0.394, "agent_hit": true, "audit": false, "description": "Exploit: spend the margin on the epoch dial. On the current tip, cut 1.0 true epoch uniformly. That is E016, about 9.5 \u2192 8.5 true epochs (verify the step count in code first; H4.2.3). If the 24/32 swap idea was kept first, cut only 0.5 true epoch from it instead. Resolution phases stay fixed fractio"}
{"exp": "E021", "idea": "I032", "status": "discard", "measured": {"accuracy": 0.7529666666666667, "time": 6.035123381334415, "complete": true}, "forecasts": {"W1": {"metrics": {"time": [5.5, 5.75, 6.1], "accuracy": [0.7435, 0.7485, 0.7535]}, "verdict": "refutes", "round": 23}, "W2": {"metrics": {"time": [6.1, 6.25, 6.4], "accuracy": [0.7455, 0.7505, 0.755]}, "verdict": "refutes", "round": 23}, "W3": {"metrics": {"time": [5.85, 6.08, 6.3], "accuracy": [0.745, 0.7505, 0.755]}, "verdict": "refutes", "round": 23}, "W5": {"metrics": {"time": [5.7, 5.93, 6.2], "accuracy": [0.746, 0.7508, 0.756]}, "verdict": "refutes", "round": 23}}, "hits": {"time": {"W1": true, "W2": false, "W3": true, "W5": true}, "accuracy": {"W1": true, "W2": true, "W3": true, "W5": true}}, "counterexample": [], "stats": {"n": 4, "conflict": 0.0, "verdict_entropy": 0.0, "improve_votes": 0, "improve_entropy": 0.0, "harm_votes": 0, "median": [5.775, 6.005, 6.25]}, "consensus_hit": true, "z": 0.127, "agent_hit": true, "audit": false, "description": "Explore/exploit on the biggest FLOP block. This replaces I028, rebased on E016. Group 2 (128\u2192384 at 15\u00d715, then two 384\u2192384 convs at 7\u00d77) is about 51% of conv MACs, and its width also feeds group 3's first conv. On the E016 recipe, narrow only group 2 from 384 to 320 channels (a multiple of 64, so t"}
{"exp": "E022", "idea": "I033", "status": "discard", "measured": {"accuracy": 0.7545333333333334, "time": 6.5475437376687, "complete": true}, "forecasts": {"W1": {"metrics": {"time": [6.48, 6.55, 6.65], "accuracy": [0.751, 0.755, 0.759]}, "verdict": "refutes", "round": 24}, "W2": {"metrics": {"time": [6.49, 6.55, 6.62], "accuracy": [0.7505, 0.7545, 0.7585]}, "verdict": "inconclusive", "round": 24}, "W3": {"metrics": {"time": [6.45, 6.55, 6.66], "accuracy": [0.7505, 0.7548, 0.759]}, "verdict": "refutes", "round": 24}, "W5": {"metrics": {"time": [6.45, 6.55, 6.65], "accuracy": [0.7505, 0.7555, 0.76]}, "verdict": "refutes", "round": 24}}, "hits": {"time": {"W1": true, "W2": true, "W3": true, "W5": true}, "accuracy": {"W1": true, "W2": true, "W3": true, "W5": true}}, "counterexample": [], "stats": {"n": 4, "conflict": 0.0, "verdict_entropy": 0.512, "improve_votes": 0, "improve_entropy": 0.0, "harm_votes": 0, "median": [6.465, 6.55, 6.65]}, "consensus_hit": true, "z": -0.027, "agent_hit": true, "audit": false, "description": "Exploit, as a time-neutral accuracy booster that would fund the trims. E016's post-mortem points to the BN-bias wd (bias lr = 64 \u00d7 lr) as the active part. On the E016 recipe, cut weight decay to \u00d70.25 of the original on the SGD groups only (BN biases, whitening bias, head), leaving the Muon conv-fil"}
{"exp": "E023", "idea": "I036", "status": "keep", "measured": {"accuracy": 0.7538, "time": 6.198454349333285, "complete": true}, "forecasts": {"W1": {"metrics": {"time": [6.1, 6.21, 6.32], "accuracy": [0.7495, 0.7535, 0.7568]}, "verdict": "inconclusive", "round": 26}, "W2": {"metrics": {"time": [6.1, 6.22, 6.4], "accuracy": [0.7495, 0.7525, 0.756]}, "verdict": "inconclusive", "round": 26}, "W3": {"metrics": {"time": [6.1, 6.22, 6.35], "accuracy": [0.7495, 0.7531, 0.7565]}, "verdict": "inconclusive", "round": 26}, "W5": {"metrics": {"time": [6.08, 6.22, 6.38], "accuracy": [0.749, 0.754, 0.7585]}, "verdict": "inconclusive", "round": 26}}, "hits": {"time": {"W1": true, "W2": true, "W3": true, "W5": true}, "accuracy": {"W1": true, "W2": true, "W3": true, "W5": true}}, "counterexample": [], "stats": {"n": 4, "conflict": 0.0, "verdict_entropy": 0.0, "improve_votes": 3, "improve_entropy": 0.811, "harm_votes": 0, "median": [6.1, 6.22, 6.365]}, "consensus_hit": true, "z": -0.163, "agent_hit": true, "audit": false, "description": "Exploit: test the untested \u22120.5 point of the epoch dial. Apply it to the current tip: E017, or I033's recipe if I033 is kept. Cut 0.5 true epoch uniformly, for example about 9.5 \u2192 9.0 true epochs; read the exact step count from the code first (H4.2.3). Resolution phases stay fixed fractions of total"}
{"exp": "E024", "idea": "I037", "status": "discard", "measured": {"accuracy": 0.7510333333333333, "time": 6.0724223483315045, "complete": true}, "forecasts": {"W1": {"metrics": {"time": [6.22, 6.33, 6.48], "accuracy": [0.7485, 0.7522, 0.756]}, "verdict": "inconclusive", "round": 27}, "W2": {"metrics": {"time": [6.35, 6.45, 6.55], "accuracy": [0.7505, 0.7535, 0.757]}, "verdict": "inconclusive", "round": 27}, "W3": {"metrics": {"time": [6.15, 6.3, 6.45], "accuracy": [0.749, 0.7528, 0.7568]}, "verdict": "inconclusive", "round": 27}, "W5": {"metrics": {"time": [6.2, 6.36, 6.52], "accuracy": [0.7505, 0.755, 0.759]}, "verdict": "supports", "round": 27}}, "hits": {"time": {"W1": false, "W2": false, "W3": false, "W5": false}, "accuracy": {"W1": true, "W2": true, "W3": true, "W5": true}}, "counterexample": ["time"], "stats": {"n": 4, "conflict": 0.0, "verdict_entropy": 0.512, "improve_votes": 0, "improve_entropy": 0.0, "harm_votes": 3, "median": [6.21, 6.345000000000001, 6.5]}, "consensus_hit": false, "z": -1.88, "agent_hit": false, "audit": false, "description": "Explore W5's crux (proposed H2.3 child): the accuracy cost of the low-res phases depends on the final feature-map regime (3\u00d73 vs 2\u00d72 after group 3), not on pixel count. Feature-map sizes: 32\u219231/15/7/3, 28\u219227/13/6/3, 26\u219225/12/6/3, 24\u219223/11/5/2. E018 replaced the 28 px phase (3\u00d73 regime) with 24 px (2"}
{"exp": "E025", "idea": "I038", "status": "discard", "measured": {"accuracy": 0.7556666666666667, "time": 6.201652335997399, "complete": true}, "forecasts": {"W1": {"metrics": {"time": [6.48, 6.55, 6.65], "accuracy": [0.7505, 0.7543, 0.758]}, "verdict": "refutes", "round": 27}, "W2": {"metrics": {"time": [6.5, 6.55, 6.62], "accuracy": [0.7505, 0.7545, 0.758]}, "verdict": "inconclusive", "round": 27}, "W3": {"metrics": {"time": [6.45, 6.55, 6.65], "accuracy": [0.75, 0.754, 0.758]}, "verdict": "refutes", "round": 27}, "W5": {"metrics": {"time": [6.47, 6.55, 6.65], "accuracy": [0.7495, 0.7545, 0.7585]}, "verdict": "refutes", "round": 27}}, "hits": {"time": {"W1": false, "W2": false, "W3": false, "W5": false}, "accuracy": {"W1": true, "W2": true, "W3": true, "W5": true}}, "counterexample": ["time"], "stats": {"n": 4, "conflict": 0.0, "verdict_entropy": 0.512, "improve_votes": 0, "improve_entropy": 0.0, "harm_votes": 4, "median": [6.475, 6.55, 6.65]}, "consensus_hit": false, "z": -3.981, "agent_hit": true, "audit": false, "description": "Exploit, as a time-neutral accuracy booster to fund trims (W1 crux: does a stronger or longer EMA add 0.3 pp?). E005 showed end-of-run averaging is worth about 1 pp on CIFAR-100, and E009 showed a lower final LR adds nothing on top of it, so averaging strength is the untuned part. On the E017 recipe"}
{"exp": "E026", "idea": "I035", "status": "keep", "measured": {"accuracy": 0.754, "time": 6.01723682666731, "complete": true}, "forecasts": {"W1": {"metrics": {"time": [6.2, 6.34, 6.47], "accuracy": [0.7475, 0.7515, 0.7552]}, "verdict": "refutes", "round": 27}, "W2": {"metrics": {"time": [6.2, 6.35, 6.5], "accuracy": [0.7495, 0.7525, 0.756]}, "verdict": "inconclusive", "round": 27}, "W3": {"metrics": {"time": [6.12, 6.3, 6.45], "accuracy": [0.7485, 0.7525, 0.7565]}, "verdict": "inconclusive", "round": 27}, "W5": {"metrics": {"time": [6.25, 6.38, 6.5], "accuracy": [0.7495, 0.7545, 0.7585]}, "verdict": "refutes", "round": 27}}, "hits": {"time": {"W1": false, "W2": false, "W3": false, "W5": false}, "accuracy": {"W1": true, "W2": true, "W3": true, "W5": true}}, "counterexample": ["time"], "stats": {"n": 4, "conflict": 0.0, "verdict_entropy": 0.631, "improve_votes": 0, "improve_entropy": 0.0, "harm_votes": 3, "median": [6.2, 6.345, 6.484999999999999]}, "consensus_hit": false, "z": -2.3, "agent_hit": true, "audit": false, "description": "Explore. This is the single-factor version of E011, separating its two confounded changes. On the E016 recipe, change only the first phase: the first 15% of steps run at 20 px, followed by 24 px for 25%, 28 px for 30% and 32 px for 30%. The 32 px tail keeps its exact step count and position, and the"}
{"exp": "E027", "idea": "I042", "status": "keep", "measured": {"accuracy": 0.7547, "time": 5.878078434667259, "complete": true}, "forecasts": {"W1": {"metrics": {"time": [5.95, 6.04, 6.13], "accuracy": [0.7495, 0.753, 0.7565]}, "verdict": "inconclusive", "round": 29}, "W2": {"metrics": {"time": [5.85, 5.98, 6.1], "accuracy": [0.7495, 0.7525, 0.7555]}, "verdict": "inconclusive", "round": 29}, "W3": {"metrics": {"time": [5.92, 6.03, 6.13], "accuracy": [0.749, 0.7531, 0.757]}, "verdict": "inconclusive", "round": 29}, "W5": {"metrics": {"time": [5.95, 6.05, 6.14], "accuracy": [0.749, 0.7527, 0.7565]}, "verdict": "inconclusive", "round": 29}}, "hits": {"time": {"W1": false, "W2": true, "W3": false, "W5": false}, "accuracy": {"W1": true, "W2": true, "W3": true, "W5": true}}, "counterexample": [], "stats": {"n": 4, "conflict": 0.0, "verdict_entropy": 0.0, "improve_votes": 0, "improve_entropy": 0.0, "harm_votes": 0, "median": [5.9350000000000005, 6.035, 6.13]}, "consensus_hit": false, "z": -1.609, "agent_hit": true, "audit": false, "description": "Exploit: spend the margin on the epoch dial, with a branch that depends on I038, which is still running. Base: the current tip E023 (9.0 true epochs), or I038's recipe if I038 is kept. Branch (a): if I038 is kept with a held-out seeds 3\u201312 gain of at least 0.15 pp, cut 0.5 true epoch to 8.5 true epo"}
{"exp": "E028", "idea": "I043", "status": "discard", "measured": {"accuracy": 0.7516666666666667, "time": 5.358429700664904, "complete": true}, "forecasts": {"W1": {"metrics": {"time": [5.6, 5.79, 5.98], "accuracy": [0.7465, 0.7512, 0.7555]}, "verdict": "refutes", "round": 30}, "W2": {"metrics": {"time": [5.6, 5.8, 6], "accuracy": [0.7485, 0.752, 0.7555]}, "verdict": "inconclusive", "round": 30}, "W3": {"metrics": {"time": [5.6, 5.76, 5.92], "accuracy": [0.7475, 0.7518, 0.756]}, "verdict": "refutes", "round": 30}, "W5": {"metrics": {"time": [5.6, 5.76, 5.92], "accuracy": [0.746, 0.7503, 0.7545]}, "verdict": "refutes", "round": 30}}, "hits": {"time": {"W1": false, "W2": false, "W3": false, "W5": false}, "accuracy": {"W1": true, "W2": true, "W3": true, "W5": true}}, "counterexample": ["time"], "stats": {"n": 4, "conflict": 0.0, "verdict_entropy": 0.512, "improve_votes": 0, "improve_entropy": 0.0, "harm_votes": 0, "median": [5.6, 5.775, 5.95]}, "consensus_hit": false, "z": -2.38, "agent_hit": true, "audit": false, "description": "Explore/exploit: a FreezeOut-style backward truncation, a mechanism not yet tried in this loop. On the E023 tip, put group-1 conv filters (Muon) and the whitening bias plus group-1 BN params (SGD) in their own param groups. Their LR schedule follows the global triangle up to its peak, then decays li"}
{"exp": "E030", "idea": "I048", "status": "discard", "measured": {"accuracy": 0.7492333333333333, "time": 5.857556962667634, "complete": true}, "forecasts": {"W1": {"metrics": {"time": [5.78, 5.86, 5.95], "accuracy": [0.751, 0.7542, 0.7572]}, "verdict": "refutes", "round": 32}, "W2": {"metrics": {"time": [5.78, 5.87, 5.97], "accuracy": [0.7505, 0.7543, 0.758]}, "verdict": "inconclusive", "round": 32}, "W3": {"metrics": {"time": [5.78, 5.86, 5.95], "accuracy": [0.751, 0.7545, 0.758]}, "verdict": "refutes", "round": 32}, "W5": {"metrics": {"time": [5.8, 5.86, 5.93], "accuracy": [0.7515, 0.7543, 0.757]}, "verdict": "refutes", "round": 32}}, "hits": {"time": {"W1": true, "W2": true, "W3": true, "W5": true}, "accuracy": {"W1": false, "W2": false, "W3": false, "W5": false}}, "counterexample": ["accuracy"], "stats": {"n": 4, "conflict": 0.0, "verdict_entropy": 0.512, "improve_votes": 4, "improve_entropy": 0.0, "harm_votes": 0, "median": [5.78, 5.86, 5.95]}, "consensus_hit": true, "z": -0.029, "agent_hit": true, "audit": false, "description": "Exploit, a time-neutral averaging booster in the direction opposite to E025 (which pulled harder and hurt by 0.27 pp held-out). D003 (C0024/C0025) points to the reset interval as the untuned Lookahead knob. On the E027 tip, change only the Lookahead update interval from every 5 to every 10 steps. Re"}
{"exp": "E031", "idea": "I044", "status": "discard", "measured": {"accuracy": 0.7490333333333333, "time": 5.249974399999094, "complete": true}, "forecasts": {"W1": {"metrics": {"time": [5.45, 5.66, 5.88], "accuracy": [0.743, 0.7505, 0.7555]}, "verdict": "refutes", "round": 34}, "W2": {"metrics": {"time": [5.55, 5.8, 6.05], "accuracy": [0.746, 0.7505, 0.755]}, "verdict": "refutes", "round": 34}, "W3": {"metrics": {"time": [5.45, 5.68, 5.9], "accuracy": [0.746, 0.7505, 0.7545]}, "verdict": "refutes", "round": 34}, "W5": {"metrics": {"time": [5.3, 5.46, 5.62], "accuracy": [0.7465, 0.7505, 0.7545]}, "verdict": "refutes", "round": 34}}, "hits": {"time": {"W1": false, "W2": false, "W3": false, "W5": false}, "accuracy": {"W1": true, "W2": true, "W3": true, "W5": true}}, "counterexample": ["time"], "stats": {"n": 4, "conflict": 0.0, "verdict_entropy": 0.0, "improve_votes": 0, "improve_entropy": 0.0, "harm_votes": 0, "median": [5.45, 5.67, 5.890000000000001]}, "consensus_hit": false, "z": -1.909, "agent_hit": true, "audit": false, "description": "Explore: proposes a new H2.4 child. Drop easy examples using free per-sample losses from the main net, with no proxy. The committee vetoed I041 for the proxy's cost; this version adds no extra forward passes. On the E023 tip, change the compiled train step to return the per-sample loss (reduction='n"}
{"exp": "E032", "idea": "I049", "status": "discard", "measured": {"accuracy": 0.7483, "time": 5.872904692664936, "complete": true}, "forecasts": {"W1": {"metrics": {"time": [5.83, 5.88, 5.95], "accuracy": [0.7495, 0.7535, 0.7575]}, "verdict": "inconclusive", "round": 34}, "W2": {"metrics": {"time": [5.78, 5.87, 5.97], "accuracy": [0.7495, 0.7545, 0.759]}, "verdict": "inconclusive", "round": 34}, "W3": {"metrics": {"time": [5.82, 5.88, 5.95], "accuracy": [0.7495, 0.7535, 0.757]}, "verdict": "refutes", "round": 34}, "W5": {"metrics": {"time": [5.84, 5.885, 5.94], "accuracy": [0.749, 0.7525, 0.756]}, "verdict": "refutes", "round": 34}}, "hits": {"time": {"W1": true, "W2": true, "W3": true, "W5": true}, "accuracy": {"W1": false, "W2": false, "W3": false, "W5": false}}, "counterexample": ["accuracy"], "stats": {"n": 4, "conflict": 0.0, "verdict_entropy": 0.631, "improve_votes": 1, "improve_entropy": 0.811, "harm_votes": 0, "median": [5.825, 5.88, 5.95]}, "consensus_hit": true, "z": -0.114, "agent_hit": true, "audit": false, "description": "Exploit, a time-neutral booster that targets the end-point, where averaging forms (E005 showed the late phase is worth about 1 pp). On the E027 tip, keep label smoothing at 0.3 for the first 85% of steps and set it to 0 for the final 15%, which lies entirely inside the 32 px phase. Pass LS as a GPU "}
{"exp": "E033", "idea": "I050", "status": "keep", "measured": {"accuracy": 0.7536333333333334, "time": 5.691157987666277, "complete": true}, "forecasts": {"W1": {"metrics": {"time": [5.6, 5.71, 5.82], "accuracy": [0.748, 0.7525, 0.757]}, "verdict": "inconclusive", "round": 34}, "W2": {"metrics": {"time": [5.6, 5.72, 5.85], "accuracy": [0.7465, 0.7515, 0.756]}, "verdict": "inconclusive", "round": 34}, "W3": {"metrics": {"time": [5.6, 5.71, 5.82], "accuracy": [0.748, 0.752, 0.756]}, "verdict": "inconclusive", "round": 34}, "W5": {"metrics": {"time": [5.64, 5.71, 5.78], "accuracy": [0.7485, 0.7522, 0.756]}, "verdict": "inconclusive", "round": 34}}, "hits": {"time": {"W1": true, "W2": true, "W3": true, "W5": true}, "accuracy": {"W1": true, "W2": true, "W3": true, "W5": true}}, "counterexample": [], "stats": {"n": 4, "conflict": 0.0, "verdict_entropy": 0.0, "improve_votes": 0, "improve_entropy": 0.0, "harm_votes": 0, "median": [5.6, 5.71, 5.82]}, "consensus_hit": true, "z": -0.171, "agent_hit": true, "audit": false, "description": "Exploit and crux test (W1/W5: is early low resolution close to free?). Run it on the E027 tip, or on the tip plus any booster above that was kept with at least +0.15 pp held-out. Change only the resolution split from 20/24/28/32 px at 15/25/30/30% of steps to 30/10/30/30%. The 28 px and 32 px phases"}
{"exp": "E034", "idea": "I052", "status": "keep", "measured": {"accuracy": 0.7539, "time": 5.480649318664898, "complete": true}, "forecasts": {"W1": {"metrics": {"time": [5.22, 5.37, 5.52], "accuracy": [0.7495, 0.7537, 0.7575]}, "verdict": "inconclusive", "round": 35}, "W2": {"metrics": {"time": [5.35, 5.62, 5.9], "accuracy": [0.7475, 0.7525, 0.7565]}, "verdict": "inconclusive", "round": 36}, "W3": {"metrics": {"time": [5.45, 5.62, 5.8], "accuracy": [0.75, 0.7543, 0.758]}, "verdict": "inconclusive", "round": 36}, "W5": {"metrics": {"time": [5.15, 5.33, 5.52], "accuracy": [0.7502, 0.7545, 0.7588]}, "verdict": "supports", "round": 36}, "W6": {"metrics": {"time": [5.5, 5.72, 5.95], "accuracy": [0.75, 0.7535, 0.7575]}, "verdict": "inconclusive", "round": 36}}, "hits": {"time": {"W1": true, "W2": true, "W3": true, "W5": true, "W6": false}, "accuracy": {"W1": true, "W2": true, "W3": true, "W5": true, "W6": true}}, "counterexample": [], "stats": {"n": 5, "conflict": 0.0, "verdict_entropy": 0.455, "improve_votes": 3, "improve_entropy": 0.971, "harm_votes": 0, "median": [5.35, 5.62, 5.8]}, "consensus_hit": true, "z": -0.619, "agent_hit": true, "audit": false, "description": "Exploit: stack the free lever (the freeze) with the cheapest accuracy booster (epochs). Start from the E027 tip and apply E028's freeze exactly as committed in fcacfc6. Group-1 conv filters, the whitening bias and group-1 BN params get their own param groups. Their LR follows the global triangle to "}
