commit	val_bpb	memory_gb	status	description
23f06a8	1.079941	44.0	keep	baseline (mean of 4 runs)
766cc81	1.105616	60.4	discard	increase depth 8 -> 9 (dim 512 -> 640)
fcb16fa	1.084168	33.9	discard	thinner model: dim 512 -> 384 (aspect 64 -> 48)
4754fe1	1.023988	43.8	keep	halve batch size 2^19 -> 2^18 for more optimizer updates [re-run 1.023988]
e7baeb5	1.021636	22.1	keep	halve batch size again 2^18 -> 2^17 (dev batch 128 -> 64) [re-run 1.021636]
631fd07	1.033115	11.3	discard	halve batch size again 2^17 -> 2^16 (dev batch 64 -> 32)
0683f65	1.021540	22.1	discard	compute training CE in bf16 (skip fp32 logits upcast) for a same-size speedup
0f69d22	1.024686	22.1	discard	shorten LR warmdown 0.5 -> 0.35
a70048e	1.019860	22.1	keep	lengthen LR warmdown 0.5 -> 0.7 [re-run 1.019860]
ad24b4e	1.023629	22.1	discard	cosine LR warmdown instead of linear
bb7a77e	1.019515	22.1	discard	lengthen LR warmdown 0.7 -> 0.9
86bee16	1.024979	22.1	discard	raise Muon matrix LR 0.04 -> 0.06
9f5cf40	1.017604	22.1	keep	lower Muon matrix LR 0.04 -> 0.03 [re-run 1.017604]
632a11f	1.017059	22.1	discard	lower Muon matrix LR 0.03 -> 0.025 [re-run 1.017397]
d6560d8	1.018862	22.1	discard	raise AdamW embedding LR 0.6 -> 0.8
beb255f	1.017885	22.1	discard	lower AdamW embedding LR 0.6 -> 0.45
5a793e0	1.017268	24.7	discard	depth 8 -> 9 with width held at 512 (decouple depth from aspect ratio)
3536249	1.016954	22.1	keep	add full-attention layers: window pattern SSSL -> SSLL [re-run 1.016954]
6b3fac4	1.017628	22.1	discard	all layers full attention: window pattern SSLL -> L
ebcb8ba	1.028538	30.4	discard	depth 8 -> 9 with SSLL pattern (combining near-miss depth increase with winning window pattern)
92dcc93	1.016132	24.7	discard	depth 8 -> 9 with width held at 512 (explicit MODEL_DIM) and SSLL pattern [re-run 1.016601]
26019b4	1.026737	22.2	discard	halve head dimension 128 -> 64 (8 heads instead of 4)
5332936	1.013711	24.2	keep	compile model with max-autotune GEMM tuning (no cudagraphs) [re-run 1.013711]
90ef4ba	1.013799	22.1	discard	lengthen LR warmdown 0.7 -> 0.8
dcad79f	1.013858	22.1	discard	enable CUDA graphs via compile mode=max-autotune (drop expandable_segments)
daf92a3	1.016364	21.1	discard	reduce MLP expansion 4x -> 3x for cheaper steps / more updates
ac17ad2	1.015665	22.7	discard	value embeddings on all layers (was alternating) for more free capacity
8df8d1e	1.013025	24.7	keep	depth 8 -> 9 at explicit width 512 with max-autotune (retry near-miss depth increase) [re-run 1.013025; corrected after harness timing bug]
02e9f98	1.020961	20.9	discard	GQA: 4 -> 2 KV heads for cheaper K/V projections and attention
314ce49	1.015072	27.1	discard	depth 9 -> 10 at explicit width 512 with max-autotune (continue winning depth line)
42bffcb	1.013157	24.7	discard	raise AdamW unembedding (lm_head) LR 0.004 -> 0.008
9344c45	1.012767	24.7	discard	prefetch dataloader batches in background thread (overlap CPU packing with GPU)
68fce13	1.016521	24.7	discard	add short LR warmup 0 -> 0.05 of time budget
e97d2ca	1.016319	25.3	discard	value embeddings on all layers (retry near-miss on top of autotune depth-9 best)
3913584	1.010161	25.4	keep	shorten sliding window 1024 -> 512 for cheaper S-layer attention (more updates) [re-run 1.010161]
7b7d253	1.007697	25.4	keep	shorten sliding window 512 -> 256 for cheaper S-layer attention (more updates) [re-run 1.007697]
77f3a0c	1.007476	25.4	discard	shorten sliding window 256 -> 128 for cheaper S-layer attention (more updates)
00cf8ee	1.008101	24.7	discard	introduce medium window 1024 for L layers (SSMM), last layer stays full
b22170e	1.008806	24.7	discard	raise steady-state Muon momentum 0.95 -> 0.97
43294fa	1.008368	24.7	discard	lower steady-state Muon momentum 0.95 -> 0.90
9a09d91	1.008868	24.7	discard	floor LR warmdown at 10% of initial (FINAL_LR_FRAC 0.0 -> 0.1)
