exp	commit	accuracy	time	complete	feasible	improved	status	tag	description
E000	746b6f0	0.012166666666666668	0.10612926533455418	True	no	yes	keep		baseline: unchanged template
E001	f742aba	0.7586666666666667	23.376650280333706	True	yes	yes	keep		airbench-style 256/768/1024 12ep bf16 compile warmup
E002	428e157	0.7543	15.587563833668051	True	yes	yes	keep		7.5 epochs bs512
E003	8b822a2	0.7522333333333333	15.369133692664036	True	no	no	discard		global max via max(dim)
E004	182e69d	0.7544333333333333	13.538110653666081	True	yes	yes	keep		lr_end 0, 6.5 epochs
E005	4a3301a	0.7527666666666667	11.822575568667768	True	no	no	discard		progressive resize 20px x4 of 8 epochs
E006	2adbd19	0.754	12.43366753566564	True	yes	yes	keep		progressive resize 18px x5 of 9 epochs
E007	7f0ef42	0.7562333333333333	12.290751129997565	True	yes	yes	keep		cudnn.benchmark on (+res_schedule refactor)
E008	62bf482	0.7546333333333334	11.42428152433422	True	yes	yes	keep		fused SGD + max_pool2d global + eval warmup
