n	attempt_id	group	k	policy	insights_in_context	screen_val_bpb	confirm_val_bpb	best_before	decision	reward	best_after	num_steps	flags	t_end_utc	hours	agent_min	desc
1	g0000-a1	0	1	v0	0	1.105616		1.079941	discard	0.0	1.079941	332		2026-10-03T16:20:40Z	0.12	7.14	increase depth 8 -> 9 (dim 512 -> 640)
2	g0000-a2	0	2	v0	1	1.084168		1.079941	discard	0.0	1.079941	680		2026-10-03T16:28:41Z	0.25	6.94	thinner model: dim 512 -> 384 (aspect 64 -> 48)
3	g0000-a3	0	3	v0	2	1.024294	1.023988	1.079941	keep	1.0	1.023988	994		2026-10-03T16:42:30Z	0.48	7.06	halve batch size 2^19 -> 2^18 for more optimizer updates
4	g0000-a4	0	4	v0	2	1.021725	1.021636	1.023988	keep	1.0	1.021636	1926		2026-10-03T16:54:19Z	0.68	6.15	halve batch size again 2^18 -> 2^17 (dev batch 128 -> 64)
5	g0000-a5	0	5	v0	2	1.033115		1.021636	discard	0.0	1.021636	3633		2026-10-03T17:00:33Z	0.78	6.23	halve batch size again 2^17 -> 2^16 (dev batch 64 -> 32)
6	g0000-a6	0	6	v0	3	1.021540		1.021636	discard	0.0	1.021636	1925		2026-10-03T17:11:10Z	0.96	9.42	compute training CE in bf16 (skip fp32 logits upcast) for a same-size speedup
7	g0000-a7	0	7	v0	4	1.024686		1.021636	discard	0.0	1.021636	1926		2026-10-03T17:18:13Z	1.08	5.86	shorten LR warmdown 0.5 -> 0.35
8	g0000-a8	0	8	v0	5	1.019535	1.019860	1.021636	keep	1.0	1.019860	1925		2026-10-03T17:30:54Z	1.29	5.96	lengthen LR warmdown 0.5 -> 0.7
9	g0001-a1	1	1	v0	0	1.023629		1.019860	discard	0.0	1.019860	1925		2026-10-03T17:37:21Z	1.40	6.44	cosine LR warmdown instead of linear
10	g0001-a2	1	2	v1	1	1.019515		1.019860	discard	0.0	1.019860	1926		2026-10-03T17:44:18Z	1.51	5.89	lengthen LR warmdown 0.7 -> 0.9
11	g0001-a3	1	3	v1	2	1.024979		1.019860	discard	0.0	1.019860	1926		2026-10-03T17:52:09Z	1.64	6.34	raise Muon matrix LR 0.04 -> 0.06
12	g0001-a4	1	4	v1	3	1.017791	1.017604	1.019860	keep	1.0	1.017604	1925		2026-10-03T18:05:20Z	1.86	6.00	lower Muon matrix LR 0.04 -> 0.03
13	g0001-a5	1	5	v1	3	1.017059	1.017397	1.017604	discard	0.0	1.017604	1925		2026-10-03T18:17:10Z	2.06	6.17	lower Muon matrix LR 0.03 -> 0.025
14	g0001-a6	1	6	v1	4	1.018862		1.017604	discard	0.0	1.017604	1925		2026-10-03T18:27:55Z	2.24	9.23	raise AdamW embedding LR 0.6 -> 0.8
15	g0001-a7	1	7	v1	5	1.017885		1.017604	discard	0.0	1.017604	1925		2026-10-03T18:36:16Z	2.38	6.75	lower AdamW embedding LR 0.6 -> 0.45
16	g0001-a8	1	8	v1	6	1.017268		1.017604	discard	0.0	1.017604	1728		2026-10-03T18:49:14Z	2.59	11.41	depth 8 -> 9 with width held at 512 (decouple depth from aspect ratio)
17	g0002-a1	2	1	v1	0	1.016863	1.016954	1.017604	keep	1.0	1.016954	1945		2026-10-03T19:04:20Z	2.85	7.84	add full-attention layers: window pattern SSSL -> SSLL
18	g0002-a2	2	2	v2	0	1.017628		1.016954	discard	0.0	1.016954	1987		2026-10-03T19:11:00Z	2.96	6.67	all layers full attention: window pattern SSLL -> L
19	g0002-a3	2	3	v2	1	1.028538		1.016954	discard	0.0	1.016954	1253		2026-10-03T19:19:30Z	3.10	6.99	depth 8 -> 9 with SSLL pattern (combining near-miss depth increase with winning window pattern)
20	g0002-a4	2	4	v2	2	1.016132	1.016601	1.016954	discard	0.0	1.016954	1743		2026-10-03T19:33:46Z	3.34	6.99	depth 8 -> 9 with width held at 512 (explicit MODEL_DIM) and SSLL pattern
21	g0002-a5	2	5	v2	3	1.026737		1.016954	discard	0.0	1.016954	1884		2026-10-03T19:48:21Z	3.58	13.03	halve head dimension 128 -> 64 (8 heads instead of 4)
22	g0002-a6	2	6	v2	4	1.013986	1.013711	1.016954	keep	1.0	1.013711	2063		2026-10-03T20:07:33Z	3.90	10.27	compile model with max-autotune GEMM tuning (no cudagraphs)
23	g0002-a7	2	7	v2	4	1.013799		1.013711	discard	0.0	1.013711	2063		2026-10-03T20:14:52Z	4.02	7.32	lengthen LR warmdown 0.7 -> 0.8
24	g0002-a8	2	8	v2	5	1.013858		1.013711	discard	0.0	1.013711	2067		2026-10-03T20:25:26Z	4.20	9.00	enable CUDA graphs via compile mode=max-autotune (drop expandable_segments)
25	g0003-a1	3	1	v2	0	1.016364		1.013711	discard	0.0	1.013711	2254		2026-10-03T20:37:02Z	4.39	10.03	reduce MLP expansion 4x -> 3x for cheaper steps / more updates
26	g0003-a2	3	2	v3	1	1.015665		1.013711	discard	0.0	1.013711	2019		2026-10-03T20:50:48Z	4.62	9.39	value embeddings on all layers (was alternating) for more free capacity
27	g0003-a3	3	3	v3	2	1.012096	1.013025	1.013711	keep	1.0	1.013025	1846		2026-10-03T21:09:06Z	4.93	8.65	depth 8 -> 9 at explicit width 512 with max-autotune (retry near-miss depth increase)
28	g0003-a4	3	4	v3	3	1.020961		1.013711	discard	0.0	1.013711	2147		2026-10-03T21:19:25Z	5.10	8.77	GQA: 4 -> 2 KV heads for cheaper K/V projections and attention
29	g0003-a5	3	5	v3	3	1.015072		1.013025	discard	0.0	1.013025	1681		2026-10-03T21:30:18Z	5.28	8.50	depth 9 -> 10 at explicit width 512 with max-autotune (continue winning depth line)
30	g0003-a6	3	6	v3	4	1.013157		1.013025	discard	0.0	1.013025	1847		2026-10-03T21:38:31Z	5.42	6.72	raise AdamW unembedding (lm_head) LR 0.004 -> 0.008
31	g0003-a7	3	7	v3	5	1.012767		1.013025	discard	0.0	1.013025	1847		2026-10-03T21:51:46Z	5.64	11.70	prefetch dataloader batches in background thread (overlap CPU packing with GPU)
32	g0003-a8	3	8	v3	6	1.016521		1.013025	discard	0.0	1.013025	1847		2026-10-03T22:01:43Z	5.80	8.26	add short LR warmup 0 -> 0.05 of time budget
33	g0004-a1	4	1	v3	0	1.016319		1.013025	discard	0.0	1.013025	1815		2026-10-03T22:14:19Z	6.01	11.08	value embeddings on all layers (retry near-miss on top of autotune depth-9 best)
34	g0004-a2	4	2	v4	1	1.011202	1.010161	1.013025	keep	1.0	1.010161	1904		2026-10-03T22:31:34Z	6.30	8.28	shorten sliding window 1024 -> 512 for cheaper S-layer attention (more updates)
35	g0004-a3	4	3	v4	1	1.007600	1.007697	1.010161	keep	1.0	1.007697	1948		2026-10-03T22:46:11Z	6.54	7.11	shorten sliding window 512 -> 256 for cheaper S-layer attention (more updates)
36	g0004-a4	4	4	v4	0	1.007476		1.007697	discard	0.0	1.007697	1966		2026-10-03T22:54:39Z	6.69	8.47	shorten sliding window 256 -> 128 for cheaper S-layer attention (more updates)
37	g0004-a5	4	5	v4	2	1.008101		1.007697	discard	0.0	1.007697	1925		2026-10-03T23:06:37Z	6.88	10.36	introduce medium window 1024 for L layers (SSMM), last layer stays full
38	g0004-a6	4	6	v4	3	1.008806		1.007697	discard	0.0	1.007697	1945		2026-10-03T23:20:08Z	7.11	11.95	raise steady-state Muon momentum 0.95 -> 0.97
39	g0004-a7	4	7	v4	4	1.008368		1.007697	discard	0.0	1.007697	1944		2026-10-03T23:28:21Z	7.25	6.68	lower steady-state Muon momentum 0.95 -> 0.90
40	g0004-a8	4	8	v4	5	1.008868		1.007697	discard	0.0	1.007697	1945		2026-10-03T23:38:08Z	7.41	8.66	floor LR warmdown at 10% of initial (FINAL_LR_FRAC 0.0 -> 0.1)
