exp	commit	accuracy	time	complete	feasible	improved	status	tag	description
E000	746b6f0	0.012166666666666668	0.10612926533455418	True	no	yes	keep		baseline: unchanged template
E001	f742aba	0.7586666666666667	23.376650280333706	True	yes	yes	keep		airbench-style 256/768/1024 12ep bf16 compile warmup
E002	428e157	0.7543	15.587563833668051	True	yes	yes	keep		7.5 epochs bs512
E003	8b822a2	0.7522333333333333	15.369133692664036	True	no	no	discard		global max via max(dim)
E004	182e69d	0.7544333333333333	13.538110653666081	True	yes	yes	keep		lr_end 0, 6.5 epochs
E005	4a3301a	0.7527666666666667	11.822575568667768	True	no	no	discard		progressive resize 20px x4 of 8 epochs
E006	2adbd19	0.754	12.43366753566564	True	yes	yes	keep		progressive resize 18px x5 of 9 epochs
E007	7f0ef42	0.7562333333333333	12.290751129997565	True	yes	yes	keep		cudnn.benchmark on (+res_schedule refactor)
E008	62bf482	0.7546333333333334	11.42428152433422	True	yes	yes	keep		fused SGD + max_pool2d global + eval warmup
E009	56b4bb7	0.7585666666666667	10.586642352000732	True	yes	yes	keep		logit scale 0.25, 8.5 epochs (5 at 18px)
E010	db4c9ca	0.7562666666666666	9.565882335669206	True	yes	yes	keep		bias_scaler 16, 8 epochs (5 at 18px)
E011	2249dd7	0.7574666666666666	9.574593517664956	True	yes	no	keep		fp16 + schedule refactor, drop lookahead
E012	2857257	0.7569	8.946300167333296	True	yes	yes	keep		alt flip, 7.75 epochs, faster prepare
E013	7bf2d16	0.7529666666666667	8.447846354666884	True	no	no	discard		depth-3 residual groups, widths 256/512/768
E014	5640534	0.7570333333333333	8.832610057332204	True	yes	yes	keep		depth-3 256/512/768, 8 epochs
E015	7636433	0.7549666666666667	7.782479894332937	True	yes	yes	keep		depth (2,3,3), scale 0.2
E016	261e4fc	0.7571	7.566315332670153	True	yes	yes	keep		128/512/768 depth3, 8.5 epochs
E017	c0143cf	0.7623	7.114730950001103	True	yes	yes	keep		128/384/768 depth3, 9 epochs
E018	4e88018	0.7530333333333333	6.809297419332627	True	yes	yes	keep		128/384/768 depth3, 8.5 epochs
E019	e25bb1f	0.7569333333333333	6.886229082665523	True	yes	no	discard		low-res stage 20px (5 epochs), 8.5 total
E020	c5cdae4	0.7526666666666666	6.715852145328729	True	no	no	discard		low-res 20px x5, 8.25 epochs
E021	5b49398	0.7542	5.978089376997862	True	yes	yes	keep		compile reduce-overhead (CUDA graphs)
E022	19ac084	0.7506	5.166125745337922	True	no	no	discard		64/256/768, 10.5 epochs
E023	afd8750	0.7552333333333333	5.480106600666962	True	yes	yes	keep		64/256/768, 11 epochs
E024	7a7fe98	0.7552333333333333	5.416398985000948	True	yes	yes	keep		full-path warmup in build (no first-trial re-recording)
E025	db72832	0.7544	5.300116333334397	True	yes	yes	keep		compile max-autotune
E026	338b7e4	0.7531	5.1417900973319774	True	yes	yes	keep		res schedule 18x4, 24x2, 32x5
E027	37e2d4f	0.7564666666666666	4.978633339332494	True	yes	yes	keep		SiLU instead of GELU
E028	a4f016e	0.7527333333333334	4.621263105999485	True	no	no	discard		batch 768, lr 14
E029	5e9a2db	0.7545666666666667	4.781344346668145	True	yes	yes	keep		batch 768, lr 14, 11.25 epochs
E030	f55a3f5	0.7568333333333334	4.647650137669795	True	yes	yes	keep		fp16 weights (airbench-style)
E031	c76a630	0.7528	4.489662843334372	True	no	no	discard		11 epochs
