exp	commit	accuracy	time	complete	feasible	improved	status	tag	description
E035	30d7a69	0.7548333333333334	5.445709792669125	True	yes	yes	keep	I053	Exploit and crux test (W5: does a math-identical change keep the tip's per-seed outcomes?). Base: the current tip (E027, or the H2.6.2 successor if kept). Change only systems work in prepare, keeping every number bit-identical. (1) Move the training images to the GPU as uint8 and do the float conversion, normalization and channels_last/fp16 cast on the GPU, in the same op order and dtype the CPU path uses now. (2) In build, run prepare's GPU kernels once on synthetic uint8 tensors of the real shape: the whitening patch extraction and eigendecomposition, the normalization and the allocations. This removes trial 0's 0.21 s first-call cost. The whitening is still computed from the same images as now; do not subsample. Before launching, check offline with torch.equal that the normalized train tensor and the whitening weights equal the current ones. If they don't, adjust the op order until they do, or abandon. Record per-trial prepare time.
E036	60645dd	0.7532333333333333	5.31434218333258	True	yes	yes	keep	I054	Exploit. First read the code. If the whitening bias already stops training before 25% of steps, close H2.6.3 without a run. Otherwise, on the H2.6.2 successor (or E027 if it is not kept), stop the whitening bias's gradient after 20% of steps (Hiverge; airbench96 trains it for 3/45 epochs). Use a third compiled step variant in which the whitening output is detached, so no input-grad of group 1's first conv and no whitening backward on the 31×31 maps. Group 1 still trains normally until the freeze. Anneal the whitening-bias LR to 0 by 20% of steps. Capture the new variant at every resolution it runs at (20/24/28/32 px) in build, with error_on_recompile on. Judge on held-out seeds 3–12 as well as seeds 0–2.
E037	6293350	0.7494	5.068743683332286	True	no	no	discard	I055	Exploit, the freeze dose. Run only once the H2.6.2 successor is kept, and on it. Move the group-1 and whitening-bias freeze start from 75% to 60% of steps. The group-1 LR is annealed to 0 by 60%. Everything else is unchanged, including the step count, resolution phases and LR/Lookahead schedules. The truncated step now also runs during the last 10% of the 28 px phase (60–70%), so capture a truncated 28 px variant in build, with error_on_recompile on. Judge on held-out seeds 3–12 as well as seeds 0–2. Keep if held-out ≥ 0.7545 and seeds 0–2 ≥ 0.753, or if the held-out loss is ≤ 0.1 pp and a follow-up epoch top-up is planned.
E038	60645dd	0.7525000000000001	5.333879142664955	True	no	no	discard	I056	Validation diagnostic, with no recipe change. Run it immediately after a candidate tip is kept (the H2.6.2 successor, or whatever is the tip once H2.6.3/H3.2.1 are stacked). Seeds 3–12 have driven about 10 keep decisions and carry a winner's curse. Run the committed recipe offline on fresh seeds 13–22 through the harness (benchmark.run --seed 13 --n 10). Record per-seed accuracy, mean and std, and the pooled 20-seed mean with its SE. Do not edit submissions/arena/.
E039	62638a9	0.7512333333333333	5.282147257334145	True	no	no	discard	I057	Explore, the next memory-bound lever on the frozen stem. On the H2.6.2 successor (or the freeze recipe in fcacfc6), at the freeze point: run one no-grad train-mode forward of group 1 over the current batch to set its BN running stats. Use the existing buffers if their values are already the frozen-phase stats. Then, for the frozen phase, put group-1 BN in eval mode and fold scale and shift into the conv weights and biases (done inside timed train, once). The truncated step then runs group 1 as conv+bias+GELU under no_grad, with no BN statistics reductions on the 31×31 maps. Lookahead still averages the unfolded params. Keep the unfolded copies so the final weights and BN buffers stay consistent: either fold only in the compiled frozen forward, or unfold before the final copy. Eval uses the standard model. Capture the new truncated variant in build, with error_on_recompile on. Judge on held-out seeds 3–12 as well as seeds 0–2.
E040	7fff74d	0.7526333333333334	5.197897818000153	True	no	no	discard	I060	Exploit: finish the early-resolution dial. The tip is E036 (9.25 true epochs, about 231 steps at batch 2000; 20/24/28/32 px at 30/10/30/30%; whitening bias detached after 20%; group-1 freeze at 75%). Change only the resolution split, from 30/10/30/30 to 40/0/30/30: the 24 px phase (about 23 steps) now runs at 20 px. The 28 px and 32 px phases keep their exact step counts and positions. The LR, Lookahead, whitening-detach and freeze schedules stay unchanged. The 20 px graphs (full and whitening-detached variants) are already captured in build. The 24 px graphs can be dropped from build. error_on_recompile stays on. Judge on held-out seeds 3–12 as well as seeds 0–2, and discount held-out by about 0.1 pp for the winner's curse (E038). Keep if seeds 0–2 ≥ 0.753 and held-out ≥ 0.7545.
E041	6a9c6b7	0.7513	5.148561150665046	True	no	no	discard	I061	Exploit: non-uniform trim. Run it on the I-40/0/30/30 successor if kept, otherwise on the E036 tip. Remove only 12 steps from the 20 px phase (231 → 219 total steps). The 28 px and 32 px phases keep their exact absolute step counts. The whitening-bias detach stays at the same absolute step (about 46). The group-1 freeze still covers the same last ~58 steps. The LR triangle and the Lookahead ramp are stretched to the new total as fractions, as in E023/E027. No new shapes, so no recapture is needed; error_on_recompile stays on. Run held-out seeds 3–12 in the same session. Keep if seeds 0–2 ≥ 0.753 and held-out ≥ 0.7545.
E042	33a2693	0.7549333333333333	5.266676663668477	True	yes	yes	discard	I062	Explore/exploit: staggered FreezeOut, which separates where E037's cliff came from. First read group 1's structure in the code. If, as in airbench, the pool follows group 1's first conv, that conv (24→128 on 31×31 maps) and the pool are the only full-resolution work left once the whitening is detached. On the E036 tip, put only group 1's first conv in its own Muon param group. Its LR follows the global triangle to its peak, then is annealed to 0 by 60% of steps. From 60% on, detach that conv's output (before the pool), so there is no conv1 wgrad and no pool/BN backward on the 31×31 maps. The rest of group 1 keeps E036's annealed freeze at 75%. Capture the conv1-detached variants at 28 px and 32 px in build, with error_on_recompile on. Lookahead still averages every param. Judge on held-out seeds 3–12 as well as seeds 0–2. If the code shows the pool is not right after conv1, freeze whichever layers run at 31×31 instead, and record which ones.
E043	60645dd	0.7496666666666667	5.294019336669105	True	no	no	discard	I058	Explore diagnostic, with no recipe change. It sets the value of the remaining stem levers (H2.6.4/H2.6.5/H2.6.3) and the PCIe-transfer caveat in H4.3. Offline, run torch.profiler on the tip's compiled 32 px full step and truncated step, and on the 24 px step, with batch 2000 and synthetic channels_last data. Record GPU time by kernel class (conv GEMM fwd/dgrad/wgrad, BN, GELU, pool, elementwise, Muon NS, Lookahead) and by layer group (whitening, group 1, 2, 3, head). Also record achieved conv TFLOP/s per group. Write the table to the notebook and label each kept lever as compute-bound or bandwidth-bound. Do not edit submissions/arena/.
E044	401eef9	0.7518666666666667	5.342197174000224	True	no	no	discard	I067	Exploit: a booster that leaves the training trajectory unchanged. It replaces I064 with a paired design that has no trajectory noise. On the E036 tip, at the end of train() and after the final Lookahead copy (which lerps BN running_mean/var from different fast weights and never recomputes them): reset every BN layer's running stats, set momentum=None (cumulative average), run a no-grad train-mode forward at 32 px over K batches of 2000 training images with the usual crop and flip, then restore momentum. Capture this forward-only graph in build on synthetic channels_last tensors, with error_on_recompile on. Eval stays a plain forward pass. Judge it with an offline instrumented copy on unselected seeds 13–32. In each trial, evaluate the averaged model once before recalibration and once after, so the two numbers share the exact same trained weights and the difference has no trajectory or rebuild noise. Do the same for K=1 and K=3. Commit the better K, then run ar.py to get time and the seeds 0–2 check. The submission evaluates only once.
E045	3372553	0.752	5.514287654659711	True	no	no	discard	I068	Explore/booster, the step-count crux (W3, W5). E041 found that removing early 20 px steps cost as much as a uniform trim. That suggests early accuracy is carried by optimizer steps, not by pixels. On the E036 tip, use batch 1000 instead of 2000 only during the 20 px phase (the first 30% of data passes, so about 69 steps become about 138). Same data and same pixels; only the step count and per-step overhead change. Key the LR triangle, the whitening-bias detach (20%) and the resolution switch to data progress (samples seen), so they land at the same data point. In this phase, scale the SGD-group lr linearly (×0.5) and keep the Muon lr per step unchanged. Lookahead stays every 5 steps; alpha is near 0 this early. From 24 px on, batch 2000 is unchanged, so the 24/28/32 phases, freeze and Lookahead tail are identical. Capture batch-1000 graphs at 20 px, both the full and whitening-detached variants, in build with channels_last tensors, with error_on_recompile on. Judge on seeds 13–32 against E036 on the same seeds (reuse E038's 13–22 and run E036 once on 23–32; the C/D/selection ideas share this baseline), plus seeds 0–2.
E046	8a2452a	0.7539666666666667	5.0786617846655036	True	yes	yes	discard	I070	Exploit, staggered FreezeOut cascade. This is the only remaining backward-truncation lever that targets the largest block, group 2 (~51% of conv MACs). On the E036 tip, put the group-2 conv filters (Muon) and group-2 BN params (SGD) in their own param groups. Their LR follows the global schedule until 75%, then decays linearly to 0 by 90% of steps; E028's annealed freeze is what kept group 1 neutral. For the last 10% of steps (about 23 steps, 32 px, group 1 already frozen), detach group 2's output before group 3 and use a new compiled 32 px step with no group-1/2 backward and no update for those params. Group-2 BN stays in train mode, and Lookahead still averages every param. Capture the new variant in build with channels_last tensors, with error_on_recompile on. Judge on seeds 13–32 against E036 on the same seeds, plus seeds 0–2.
E047	60645dd	0.7544	5.343233577664553	True	yes	no	discard	I071	Explore diagnostic, with no recipe change. It replaces I058 and adds the overhead accounting from W5's crux. Offline, on the E036 tip with synthetic channels_last data at batch 2000: (1) torch.profiler traces of the compiled 32 px full step, the whitening-detached step, the frozen step and the 20/24 px steps. Record GPU time by kernel class (conv fwd/dgrad/wgrad, BN, GELU, pool, elementwise, Muon NS, Lookahead) and by layer, plus achieved TFLOP/s per conv. Explicitly compare group-1 conv1 (Cin=24, 31×31) against the group-2 convs. (2) One trace of a whole timed train() for seed 13 on real data. Record GPU idle fraction, per-epoch augmentation/interpolate/permute time, and time outside the step graphs. Write the table to the notebook, and label each kept lever as compute-bound or bandwidth-bound (H4.3). Do not edit submissions/arena/.
E048	4ffd290	0.7518	4.981051848337908	True	no	no	discard	I072	Exploit, a milder dose of the E031 near-miss. E031's top-90% selection cost −0.27 pp for −0.63 s (~2.3 s/pp, nominally better than the dial but within noise). On the E036 tip, return per-sample losses from the compiled step (reduction='none', then mean for backward) and scatter them into a GPU buffer indexed by sample id, created and reset in prepare. From epoch 2 on, each epoch's shuffle uses only the 95% of samples with the highest loss in the previous pass (topk on the GPU), with batch 2000 and the ragged batch dropped. Total steps fall from about 231 to about 220. The resolution phases, LR triangle, Lookahead, whitening detach and freeze stay as fractions of the new step count. Warm up the modified step variants in build, with error_on_recompile on. Judge on seeds 13–32 against E036 on the same seeds, plus seeds 0–2.
E049	3df6233	0.7535333333333334	5.1979249523283215	True	yes	yes	keep	I075	Exploit, the decisive test of the E046 crux (W2/W3/W5/W6). On the E036 tip, apply E046's group-2 freeze exactly as committed in 8a2452a. Group-2 filters and BN params get their own groups, with LR annealed from 75% to 0 at 90% of steps. For the last 10% of steps, group 2's output is detached before group 3, using the truncated 32 px variant. Group-2 BN stays in train mode and Lookahead averages every param. On top of that, add 0.25 true epoch (231 → 237 steps, all schedules kept as fractions). Capture the variants in build, with error_on_recompile on. Judge in the same build session as I074, against the same-build E036 baseline and the I074 arm on seeds 13–32, plus seeds 0–2. Decision: if time is at least 2% below E036 and the 20-seed mean is within 0.03 pp of E036 or above it, the cascade-plus-top-up dominates E036 and becomes the base for further margin buying. If it trails the I074 arm by more than 0.15 pp, the group-2 freeze is no better than the dial and the cascade closes.
E050	3df6233	0.7552	5.206001658336997	True	yes	no	discard	I079	Explore diagnostic plus systems change, with identical math. Recent keep and discard decisions are noise-limited: E042, E045, E046 and E048 all landed between their thresholds, and the tip's seeds 0–2 mean has read 0.7532 / 0.7525 / 0.7497 / 0.7544 across four builds of the same commit. Before any further sub-0.15 pp comparison, find out whether that build-to-build spread can be removed. Run offline on the E036 tip (commit 60645dd) through the harness code path, seeds 0–2. (1) Build once, then run seeds 0–2 twice in the same process. Record whether per-seed accuracies are bit-identical, which tests for within-build nondeterminism such as cuDNN wgrad atomics. (2) Build twice in fresh processes with private inductor cache dirs, using mode='max-autotune-no-cudagraphs' for every step variant. Compare per-seed accuracies across the two builds and record mean time against the E036 build. (3) Keep max-autotune with cudagraphs, but pin kernel choice by persisting the inductor/autotune cache under submissions/arena/. Populate it from a synthetic-data build only, never real data. Do two fresh-process builds that read the pinned cache and compare per-seed accuracies. First check RULES.md and the submission contract to confirm that a shipped compile cache is allowed. If it is not, report arm (3) as diagnostic only. Commit only if arm (2) or arm (3) is bit-identical across rebuilds at ≤0.5% time cost versus E036. In that case it becomes the deterministic baseline, and every later idea compares seeds 0–2 and 13–32 against it exactly.
E051	36eb3ad	0.7446999999999999	4.908014092667145	True	no	no	discard	I080	Explore/exploit: remove the last full-resolution tensor from the stem. E047 measured g1.conv1 (24→128 at 31×31) at about 0.45× group-2 efficiency, and the 128-channel 31×31 activation feeding the max-pool is the largest memory-bound tensor in the net. E043/E028 showed the stem's 31×31 work costs far more than its FLOP share. On the E036 tip, replace group 1's 'conv1 (3×3, pad 1) → 2×2 max-pool' with a single 3×3 conv with stride 2 and padding 0 (31→15, the same 15×15 output as now, so groups 2/3 and their map sizes 15/7/3 are unchanged at 32 px). At 28/24/20 px it gives 13/11/9, which also matches the current pool outputs; verify this for each resolution in code. Keep the same channel counts, BN-GELU after it, init scheme and RNG draw order (same weight shape). The whitening detach (20%) and group-1 freeze (75%) stay unchanged. Recapture every resolution and variant in build, with error_on_recompile on. Judge on seeds 13–32 against a same-build E036 baseline, plus seeds 0–2. Record the per-step time at 32 px (full and frozen) for the H6 accounting.
E052	ce17ae7	0.7554666666666667	4.987386771666934	True	yes	yes	discard	I081	Exploit, combining two near-misses. Conditional: run only after I075 reports. Base: I075's recipe (group-2 freeze plus a +0.25 epoch top-up) if its 20-seed mean is within 0.03 pp of same-build E036 or above it; otherwise E036. Add E048's loss-based selection exactly as committed in 4ffd290: per-sample losses from the compiled step are scattered into a GPU buffer reset in prepare, and from epoch 2 on each epoch shuffles only the 95% highest-loss samples, with the ragged batch dropped. Also add a further +0.25 true epoch, so the net step count falls by only about 5 steps rather than E048's 11. Resolution, LR triangle, Lookahead, whitening detach and freeze points all stay as fractions of the new step count. Capture the modified variants in build, with error_on_recompile on. Judge on seeds 13–32 against the base and E036 in the same build session, plus seeds 0–2. This answers W3's crux in its stackable form: does selection beat the dial once the dial's top-up pays for it?
E053	f30d362	0.7561666666666667	5.07470796033158	True	yes	yes	discard	I083	Keep I082 as queued: the group-2 freeze dose test. Base: the E049 tip (237 steps; group-2 LR annealed 75%→0 at 90%; last 10% group-2-frozen). Move the group-2 freeze start from 90% to 85% of steps, with the group-2 LR annealed from 70% (the 32 px switch) to 0 by 85%. The frozen-group-2 32 px variant then covers about 36 steps instead of 24. Nothing else changes: step count, group-1 freeze at 75%, whitening detach at 20%, Lookahead and resolution all stay. No new shapes; error_on_recompile stays on. Judge on seeds 13–32 against a same-build E049 baseline, plus seeds 0–2. This settles the W2/W3/W5 crux on whether group 2 has a cliff like E037's.
E054	ecf36b9	0.7498666666666667	4.98940229100117	True	no	no	discard	I084	Explore, proposing a new H2.6 child: the stem needs a steady adaptation signal, not a gradient on every step. Intermittent stem backward in the 28 px phase, which is the most expensive phase (about 71 steps × ~26 ms ≈ 1.8 s). On the E049 tip, on every second step of the 28 px phase (40–70% of steps), use the group-1-detached 28 px step variant. That variant has no group-1 wgrad/dgrad and no BN/GELU backward on the stem maps, and group-1 params get no Muon/SGD update and no momentum-buffer change on those steps. The variant already existed in E037's commit 6293350. On the other steps, run the usual whitening-detached full step with the group-1 LR as scheduled. Do not rescale the LR: single factor. Group 1 still trains on every step at 20/24 px and from 70% to 75% at 32 px, so it still adapts through the 28→32 switch, which E037/E042 say it needs. Lookahead averages every param. Capture the variant in build with channels_last tensors, with error_on_recompile on. Judge on seeds 13–32 against a same-build E049 baseline, plus seeds 0–2.
E055	8795b07	0.7519	5.128265508993839	True	no	no	discard	I085	Decisive test of E037's mechanism: a 32 px adaptation cliff, or a linear freeze dose? On the E049 tip, move only the group-1 freeze start from 75% to 71% of steps, just after the 28→32 px switch at 70% (about step 168 of 237). Group 1 then sees about 2 steps at 32 px before its LR reaches 0. Anneal the group-1 LR from its peak to 0 by 71% instead of 75%. The group-2 freeze, whitening detach, step count, resolution, LR and Lookahead are unchanged. The truncated 32 px variant exists, so there are no new shapes; error_on_recompile stays on. Judge on seeds 13–32 against a same-build E049 baseline, plus seeds 0–2. The result also sets the prior for the intermittent-stem idea.
E056	e3500ad	0.752	4.952750553997855	True	no	no	discard	I086	Sharpened replacement for I078, gated on the committee's shared crux (do ReLU's saved bytes reach 3%?). Step 1 is offline, with no repo change. On the E049 tip code with synthetic channels_last batch-2000 data, compile the 32 px whitening-detached, group-1-frozen and group-1+2-frozen steps and the 28 px step twice: GELU vs ReLU in all conv groups. Measure GPU kernel time per step (torch.profiler, 20 steps each), and record whether Inductor's ReLU backward saves a bool mask or the fp16 output. Weight the per-step savings by the tip's step counts per phase. Step 2 runs only if the projected saving is ≥3% of train time: commit the ReLU swap, recapture every variant in build with error_on_recompile on, and judge on seeds 13–32 against a same-build E049 baseline plus seeds 0–2. If the projected saving is under 3%, close H6.5's activation branch with no run.
E057	3df6233	0.7536333333333334	5.222976842997014	True	yes	no	discard	I088	Diagnostic with no recipe change. It feeds the frozen keep gate (H4.6) and also settles H4.4.3. Build the E049 tip (commit 3df6233) three times, each in a fresh process with its own private TORCHINDUCTOR_CACHE_DIR. Run each build through the harness code path on fresh seeds 33–52 (benchmark.run --seed 33 --n 20) and on seeds 0–2. Record: per-seed accuracies for every build; the three 20-seed means; the per-seed differences between builds and their correlation across seeds; and mean time per build. Derive the rebuild SD σ_build of a 20-seed mean as the SD of the three means, after subtracting the expected per-seed-noise part (SD_seed/√20 × √2 for a difference). Also report E049's pooled fresh mean against its 0.7539 on reused seeds 13–32 (winner's curse, H4.4.3). Do not edit submissions/arena/. From now on, seeds 33–52 are the decision set and seeds 53–72 are reserved for one final confirmation per candidate.
