exp	commit	accuracy	time	complete	feasible	improved	status	tag	description
E058	d544408	0.7521666666666667	4.999844338002731	True	no	no	discard	I089	Exploit plus a gate test. It may re-keep a faster recipe that has already been measured. Before reading any number, freeze the keep gate. Let μ̂ be a candidate's 20-seed mean on seeds 33–52. Let σ_tot = sqrt(SE20² + SD_seed²/40 + σ_build² + 0.05²), with σ_build taken from the H4.5.1 idea and 0.05 pp as the PCIe judge-drift term. Gate: μ̂ − 1.64·σ_tot ≥ 0.7500 (P(official ≥0.75) ≥ 0.95), and seeds 0–2 ≥ 0.753 on the candidate's single committed build, with no rebuilding to chase a draw. Then build E052 (ce17ae7, 4.99 s) and E053 (f30d362, 5.07 s) once each in the same session as the H4.5.1 builds, and run each on seeds 33–52 and seeds 0–2. Pick the fastest candidate that passes. Confirm it once on reserved seeds 53–72, where it must pass the gate again, to undo the selection among candidates. Only then re-keep it, using its ar.py result from that one build. No recipe edits: both commits already exist.
E059	3df6233	0.7542666666666666	5.193452021335058	True	yes	yes	discard	I090	Re-measure the post-freeze epoch dial in the time-favourable direction, with no new code. E049 minus 0.25 true epoch is exactly E046 (commit 8a2452a: same group-2 freeze at 231 steps, all schedules as fractions). In the same session as the H4.5.1 builds, build E046 once and run it on seeds 33–52 and seeds 0–2. Compute dial = Δtime / Δacc against E049's builds on the same seeds, adding σ_build to the SE of the difference. Use the result to re-price every booster and cut, and to resolve the 0.7 vs 1.5 s/pp dispute in H4.2. E046 also enters the frozen gate as a candidate (it was feasible locally at 0.7540 / 5.08 s); if it is the fastest passing candidate, it goes through the 53–72 confirmation under the H4.6.1 idea's rule.
E060	12b52da	0.7533	5.177854930007015	True	yes	yes	keep	I093	Exploit, a near-free truncation. On the E049 tip, move the whitening-bias detach from 20% to 6% of steps (about step 14 of 237, inside the 20 px phase), with the whitening-bias LR annealed to 0 by 6% instead of 20%. The whitening-detached variants already exist at every resolution, so there are no new shapes; error_on_recompile stays on. Everything else is unchanged. Measure the saving with per-step CUDA-event timing (the expected effect is below the ~1% rebuild time spread) as well as wall time. Judge accuracy on seeds 33–52 against same-build E049, plus seeds 0–2. Consult the H7.1.1 curves if they are available first.
E061	376f231	0.7534	5.023500388672498	True	yes	yes	keep	I095	Exploit: re-test a near-miss that was discarded on biased seeds, now priced at the new dial. E041 (remove 12 early 20 px steps) read −0.20 pp on seeds 3–12 right after those seeds selected E036, and that was already about the new 0.77 s/pp dial. On the E049 tip, remove only 12 steps from the 20 px phase (237 → 225). The 28 px and 32 px phases keep their exact absolute step counts. The whitening detach stays at the same absolute step, and the group-1 and group-2 freezes cover the same last absolute steps. The LR triangle and Lookahead ramp are stretched to the new total as fractions, as in E041. No new shapes; error_on_recompile stays on. Judge on 2 fresh builds × seeds 33–52 (40 draws) against E049's 60 draws, then the frozen gate on the single committed build.
E062	cdfccca	0.7237	4.743637117329247	True	no	no	discard	I096	Explore, the largest untested optimizer axis. It is now cheap to judge because the break-even loss is about 0.25 pp at the 0.77 s/pp dial. On the E049 tip, replace Muon on every conv filter group (group 1, group 2 and group 3) with Nesterov SGD. Use momentum 0.85, airbench's value, as in E005's commit ac425fc. Use the E005 conv lr, scaled linearly from batch 1024 to 2000 the way the port's airbench lr normalization already does, and wd ×0.5 as in E016. Each filter group keeps its own LR schedule, including the anneal-to-0 at 75% for group 1 and the 75→90% anneal for group 2. The freeze, detach, resolution, step count, Lookahead, LS and SGD groups are all unchanged. Init RNG draw order is unchanged. Recapture every variant in build, with error_on_recompile on. Record per-step CUDA-event time to isolate the Newton–Schulz saving (about 0.8 ms per step × 237 steps, per E043). Judge on 2 fresh builds × seeds 33–52 against E049's 60 draws. PR #3 (CIFAR-100, airbench96) reports SGD beating Muon at every size. E006's +0.66 pp confounded Muon with the batch change from 1024 to 2000 and an RNG re-draw.
E063	4aac17b			False	no	no	crash	I099	Exploit: the second step of the early-trim dose curve. E061 removed 12 steps from the 20 px phase for −3.0% time at −0.02 pp on 40 fresh draws. On the E061 tip (225 steps; 20/24/28/32 px at about 59/24/71/71 steps), remove 12 more steps from the 20 px phase only (225 → 213; 20 px about 47 steps). The 24, 28 and 32 px phases keep their exact absolute step counts. The whitening detach, the group-1 freeze (last absolute steps) and the group-2 freeze (last absolute steps) keep the same absolute positions. The LR triangle and Lookahead ramp stretch to the new total as fractions, as in E041/E061. No new shapes; error_on_recompile stays on. Judge on 2 fresh builds × seeds 33–52 (40 draws) against E061's 40 draws, then apply the frozen gate (μ̂ − 1.64·σ_tot ≥ 0.75 and seeds 0–2 ≥ 0.753 on the single committed build, no rebuilds). Record per-step CUDA-event time. This settles W6's crux: do early 20 px steps stay nearly free beyond 225?
E064	98e319a	0.7512333333333333	4.838014391328518	True	no	no	discard	I099	Exploit: the second step of the early-trim dose curve. E061 removed 12 steps from the 20 px phase for −3.0% time at −0.02 pp on 40 fresh draws. On the E061 tip (225 steps; 20/24/28/32 px at about 59/24/71/71 steps), remove 12 more steps from the 20 px phase only (225 → 213; 20 px about 47 steps). The 24, 28 and 32 px phases keep their exact absolute step counts. The whitening detach, the group-1 freeze (last absolute steps) and the group-2 freeze (last absolute steps) keep the same absolute positions. The LR triangle and Lookahead ramp stretch to the new total as fractions, as in E041/E061. No new shapes; error_on_recompile stays on. Judge on 2 fresh builds × seeds 33–52 (40 draws) against E061's 40 draws, then apply the frozen gate (μ̂ − 1.64·σ_tot ≥ 0.75 and seeds 0–2 ≥ 0.753 on the single committed build, no rebuilds). Record per-step CUDA-event time. This settles W6's crux: do early 20 px steps stay nearly free beyond 225?
E065	2962393	0.7560666666666667	5.028791770998699	True	yes	no	discard	I104	Exploit: a time-neutral test that separates the two parts of the freeze-dose cost. On the E061 tip (225 steps), change only the end point of the group-1 LR anneal (conv filters on Muon; BN params on SGD): it moves from 75% to 80% of steps, so group 1's LR decays more slowly over the whole run. The group-1 detach stays at 75% (same absolute step), so the frozen variant covers exactly the same steps and time is unchanged. At the detach, the group-1 LR is then about 5/57 ≈ 9% of peak instead of 0. E009 and C0021 say the LR floor does not matter under Lookahead averaging. Whitening detach, group-2 freeze, resolution, step count, Lookahead and LS are unchanged. If the LR is a GPU tensor table, no recapture is needed; otherwise recapture every variant in build, with error_on_recompile on. Judge on 3 fresh builds × seeds 33–52 (60 draws) against E061's 40 draws, then the frozen gate. This is the time-neutral form of H2.6.13. E055's −0.29 pp moved the anneal end and the detach together; this moves only the anneal.
