exp	commit	accuracy	time	complete	feasible	improved	status	tag	description
E039	a4b84c7	0.7510333333333333	5.89889374133539	True	no	no	discard	I044	On the tip (E028 commit e95ff94: Muon NS3 batched and compiled, lr 0.16, momentum 0.8, lookahead 0.97^5, LS 0.2, SiLU, 6.5 epochs; or I037's successor if it is kept), make one change: halve the head (final linear layer) lr in the SGD group. If the code expresses the head lr as a multiple of the group's base lr, halve that multiple; otherwise halve the head param-group lr. Keep lr*wd constant for the head, which means doubling its wd so the decay per step is unchanged. BN-bias lr x64, the whitening-bias lr, Muon, lookahead, LS, augmentation and epochs all stay identical. Background: the head lr was inherited from CIFAR-10 SGD airbench (lr 9). That setting faced 10 outputs over ~10 epochs. Here the 100-way head trains against Muon-normalized features over 6.5 epochs, so the head may be overshooting. This is a pure hyperparameter change, so no new compiled shapes are needed. If the lr is passed as a 0-d tensor, nothing recompiles.
E040	18ce8ac	0.7559	5.718205952665206	True	yes	yes	keep	I046	Reallocate time from full-res epochs to cheap low-res epochs. The Muon epoch slope at the knee is now steep (~1.14 pp/epoch, ~0.15 pp per 1% time). E013 priced 24 px epochs at only ~0.058 pp per 1% on SGD, so low-res epochs should now be cheaper than full-res ones. On the tip (E034 commit f74c715: Muon NS3 batched, lr 0.16, mom 0.8, lookahead 0.97^5, LS 0.2, SiLU, whitening bias trained only in epoch 1, ~6.5 epochs), make one curriculum change. Train the first 1.5 epochs on whole images bilinearly downsampled to 24 px (F.interpolate, antialias=True, inside the compiled GPU augment, after flip/translate). Then train 5.25 epochs at 32 px, for 6.75 epochs total. Scale the lr, Muon and lookahead schedules to the new total step count; bs stays 1024. The frozen whitening conv is reused unchanged. In drafts/, first print the per-block spatial sizes at 24 px input. Set the final pool for each resolution graph to F.max_pool2d with a static kernel equal to that graph's final map size. Do NOT use amax or flatten().max (the E009 Inductor bug). Compile and warm up every variant in build() on synthetic data: 24 px with whitening-bias grad, 24 px without it, 32 px without it, plus each full and partial batch shape. Eval stays the 32 px graph. Run drafts/debug_nan.py on every graph under max-autotune-no-cudagraphs before launching.
E041	fbc845c	0.7533	5.421605435001159	True	yes	yes	keep	I042	On the tip, raise the batch size from 1024 to 1536 at 6.5 epochs (~212 steps instead of ~319), with all schedules scaled to the step count. The Muon lr stays at 0.16 (normalized updates). Scale the SGD group (BN biases, whitening bias, head) as batch size requires: if the code already uses airbench's per-example lr normalization (lr/bs), keep the configured values; otherwise scale the SGD lr x1.5 and keep lr*wd constant. Lookahead syncs every 5 steps as before. Warm up the new full and partial batch shapes in build().
E042	2b85e5e	0.7549333333333333	5.449109408330211	True	yes	no	keep	I043	On the tip, add per-image brightness and contrast jitter inside the compiled GPU augment, applied to the [0,1]-scaled images before normalization and whitening: x = (x - mean_img) * (1 + U(-1,1)*0.13) + mean_img + U(-1,1)*0.14, drawn independently per sample, with alternating flip and translate-2 kept. The RNG comes from the trial-seeded generator in prepare. Eval is unchanged. Warm up the new augment graph in build() on synthetic data.
E043	3d31e4b	0.7511333333333333	5.178028846336626	True	no	no	discard	I051	Move the resolution boundary later on the E040 tip (commit 18ce8ac: Muon NS3 batched, lr 0.16, mom 0.8, lookahead 0.97^5, LS 0.2, SiLU, whitening bias trained only in epoch 1, 24 px bilinear antialiased whole images for 1.5 epochs then 32 px for 5.25, 6.75 epochs total). Make one change: train at 24 px for the first 2.25 epochs and at 32 px for the last 4.5, keeping 6.75 epochs total, bs 1024 and the same step-indexed lr, Muon and lookahead schedules, which do not change because the total step count is unchanged. If the switch now falls mid-epoch, take the first part of that epoch's permutation at 24 px and the rest at 32 px, so the sample stream is unchanged. The whitening-bias freeze stays at the end of epoch 1. Before launching, check that every shape used in the timed path is warmed up in build(): 24 px with and without whitening-bias grad, 32 px without it, and any new partial-batch shape at the switch. Warm up with channels_last tensors of the exact timed layout (E035 lesson). Run debug_nan.py on any new graph, and compare trial-0 and later-trial train times. Risk to note: E040's 1.5 low-res epochs covered roughly the warmup phase (~23% of steps). This change pushes low-res into the peak-lr phase, where full-res steps may matter more.
E044	6eadb92	0.7526666666666667	5.2093691256668535	True	no	no	discard	I052	Add a middle 28 px stage to the E040 curriculum. On the E040 tip, make one change: 24 px for epochs 0-1.5 as now, then whole images bilinearly downsampled (antialias=True, inside the compiled GPU augment after flip/translate) to 28 px for 1.5 epochs, then 32 px for the last 3.75 epochs. Total stays 6.75 epochs, bs 1024, step-indexed schedules unchanged. In drafts/, print the per-block spatial sizes at 28 px input first (expect whitening 27 -> pools 13/6/3). Set the 28 px graph's final pool to F.max_pool2d with a static kernel equal to its final map size. Do NOT use amax or flatten().max (the E009 Inductor bug). Compile and warm up the 28 px train step without whitening-bias grad, plus any partial batch at the stage switches, in build() with channels_last tensors of the exact timed layout. Run debug_nan.py on the new graph, and compare trial-0 and later-trial train times to catch warmup gaps. Eval stays the 32 px graph.
E045	bfcff33	0.7567666666666667	5.463771669664614	True	yes	no	keep	I053	On the E040 tip, double the head (final linear layer) lr in the SGD group. Keep lr*wd constant for the head by halving its wd. If the code expresses the head lr as a multiple of the group base lr, double that multiple; otherwise double the head param-group lr. The BN-bias lr x64, whitening-bias lr, Muon, lookahead, LS, the resolution curriculum and the epochs stay identical. This is a pure hyperparameter change: the lr is passed as a 0-d tensor, so there are no new shapes and nothing recompiles. Pre-registered follow-up to E039, where halving the head lr cost 0.41 pp on the then-tip.
E046	82aa84e	0.7558	5.469641527335625	True	yes	no	discard	I056	Win back the bs-1536 accuracy loss through the Muon lr. This is the follow-up pre-registered in I042. At bs 1536 the run takes about 1/3 fewer fixed-magnitude, weight-norm-projected Muon rotations (~212 instead of ~319 steps), so the total rotation path of each filter shrank by about 33%. On the tip (the curriculum-stacked commit if the idea above is kept, else E042), change only the Muon lr for the conv filters, from 0.16 to 0.20. Momentum 0.8, NS3, projection, the schedule shape and floor, the SGD group, lookahead, augmentation and epochs all stay identical. The lr is a 0-d tensor, so nothing recompiles.
E047	3d6a396	0.7549666666666667	5.272802727665597	True	yes	yes	keep	I060	Make the warmup-phase resolution stage cheaper. On the current tip (E042 commit 2b85e5e: bs 1536, 24 px bilinear antialiased whole images for the first 1.5 epochs then 32 px, 6.75 epochs total, SGD-group lr x1.5, Muon lr 0.16 mom 0.8, lookahead 0.97^5, jitter, whitening bias trained in epoch 1 only; or I052's successor if it is kept, in which case change only its first stage), make one change: the first stage's resolution goes from 24 px to 20 px (F.interpolate, antialias=True, inside the compiled GPU augment after flip/translate/jitter). The stage boundary (1.5 epochs), total epochs, bs and every step-indexed schedule stay unchanged, so the sample stream and lr values are identical. Rationale: E040 vs E043 show low-res steps are roughly free during the warmup phase but cost accuracy after it, so the cheapest lever left in that phase is to make its steps cheaper rather than more numerous. In drafts/, first print the per-block spatial sizes at 20 px input (expected: whitening 19, block1 19 -> pool 9, block2 9 -> pool 4, block3 4 -> pool 2, final map 2x2) and set the 20 px graph's final pool to F.max_pool2d with a static kernel equal to that final map size. Do NOT use amax or flatten().max (E009 Inductor bug). In build(), warm up the 20 px train step with and without whitening-bias grad at bs 1536, plus every partial-batch shape at the 1.5-epoch switch, using channels_last tensors in the exact timed layout (E035 lesson). Run debug_nan.py on the new graphs under max-autotune-no-cudagraphs and compare trial-0 vs later-trial train times. Eval stays the 32 px graph.
E048	dc07126	0.7551666666666667	5.0003490616679	True	yes	yes	keep	I061	Stack E044's 28 px middle stage onto the E045 tip. This combines a near-miss with a margin that can absorb it. The tip is E045 (commit bfcff33): bs 1536, 24 px bilinear antialiased whole images for epochs 0-1.5 then 32 px, 6.75 epochs total, SGD-group lr x1.5, head lr x2 with wd halved, Muon lr 0.16 mom 0.8, lookahead 0.97^5, brightness/contrast jitter, whitening bias trained in epoch 1 only. Make one change, ported from E044 (drafts/E044_res3_submission.py): 24 px for epochs 0-1.5 as now, then 28 px whole images (F.interpolate, antialias=True, inside the compiled GPU augment after flip, translate and jitter) for epochs 1.5-3.0, then 32 px for the last 3.75 epochs. Total epochs, bs and every step-indexed schedule stay unchanged, so the sample stream and lr values are identical to E045. A switch that falls mid-epoch uses the first part of that epoch's permutation at the old resolution and the rest at the new one. The 28 px graph's final pool is F.max_pool2d with a static kernel equal to its final map (expect 3x3). Do NOT use amax or flatten().max (E009). In build(), warm up the 28 px train step without whitening-bias grad at bs 1536, plus every partial-batch shape at both switches, using channels_last tensors in the exact timed layout (E035). Check that total build time stays under ~450 s (E044 took 232 s for 6 variants). If I060's 20 px first stage was kept first, apply this change to that commit instead and leave its first stage alone. Run debug_nan.py on the new graph and compare trial-0 with later-trial train times.
E049	60045ce	0.7548333333333334	5.014965159663309	True	yes	no	discard	I066	Follow up E045 on the head lr axis. On the tip (E047 commit 3d6a396: bs 1536, 20 px bilinear antialiased whole images for epochs 0-1.5 then 32 px, 6.75 epochs, SGD-group lr x1.5, head lr x2 with wd halved, Muon lr 0.16 mom 0.8 NS3, lookahead 0.97^5, jitter, whitening bias trained in epoch 1 only; or I061's successor if it is kept), make one change: raise the head (final linear layer) lr multiplier from x2 to x3 relative to the original head lr. Keep lr*wd constant for the head by dividing its current wd by 1.5. BN-bias lr x64, whitening-bias lr, Muon, lookahead, LS, curriculum, jitter, bs and epochs stay identical. The lr is a 0-d tensor, so there are no new shapes and nothing recompiles. Background: head x0.5 cost 0.41 pp (E039) and x2 gained 0.18 pp (E045), so the head looks under-driven. This run checks whether the optimum lies above x2 before the head axis is closed.
E050	283aba5	0.7411	4.96180507333338	True	no	no	discard	I067	Make the warmup-phase stage cheaper again, the next step after E047 (24 -> 20 px saved 3.5% at -0.18 pp). On the tip (E047, or I061's successor if it is kept, in which case change only its first stage), make one change: the first stage's resolution drops from 20 px to 16 px (F.interpolate, antialias=True, inside the compiled GPU augment after flip/translate/jitter). The stage boundary (1.5 epochs, in samples), total epochs, bs 1536 and every step-indexed schedule stay unchanged, so the sample stream and lr values are identical. In drafts/, first print the per-block spatial sizes at 16 px input. Expected: whitening 15, block1 15 -> pool 7, block2 7 -> pool 3, block3 3 -> pool 1, final map 1x1. The 16 px graph's final pool can then be a reshape/flatten of the 1x1 map, or F.max_pool2d with a static kernel equal to the final map size. Do NOT use amax or flatten().max (E009 Inductor bug). In build(), warm up the 16 px train step with and without whitening-bias grad at bs 1536, plus every partial-batch shape at the 1.5-epoch switch, using channels_last tensors in the exact timed layout (E035 lesson). Check that total build time stays under ~450 s. Run debug_nan.py on the new graphs under max-autotune-no-cudagraphs, and compare trial-0 with later-trial train times. Eval stays the 32 px graph.
E051	9f17acf	0.7541333333333333	4.926264633667112	True	yes	yes	keep	I069	Lengthen the 28 px middle stage on the E048 tip. The tip is commit dc07126: bs 1536; 20 px bilinear antialiased whole images for epochs 0-1.5, 28 px for 1.5-3.0, 32 px for the last 3.75 epochs, 6.75 total; SGD-group lr x1.5; head lr x2 with wd halved; Muon lr 0.16, mom 0.8, NS3; lookahead 0.97^5; brightness/contrast jitter; whitening bias trained in epoch 1 only. If I066 (head x3) is kept first, use its commit instead. Make one change: move the 28 -> 32 px switch from 3.0 to 3.5 epochs, so 28 px runs for 2.0 epochs and 32 px for the last 3.25. Total epochs, bs, the sample stream and every step-indexed schedule stay unchanged. The switch now falls mid-epoch (sample 175000, inside a bs-1536 step). Train the first part of that epoch's permutation at 28 px and the rest at 32 px, splitting the straddling step into the two partial shapes, as the existing switches do. In build(), warm up every new partial-batch shape at the 3.5-epoch switch for the 28 px and 32 px graphs (no whitening-bias grad), using channels_last tensors in the exact timed layout (E035 lesson). Keep build under ~450 s. Run debug_nan.py on any new shape and compare trial-0 with later-trial train times. Rationale: E048 showed that 1.5 epochs at 28 px cost ~0.0-0.2 pp for -5.2%, an exchange rate of ~0.05 pp per 1%, cheaper than any other lever left. E043 warned that low-fidelity steps cost more past the lr peak, but 28 px keeps far more detail than 24 px. This run prices the next half-epoch.
E052	447a7db	0.7545666666666666	4.928187876665713	True	yes	no	keep	I070	Weaker augmentation only in the low-resolution stages, following D014 C0193: small images want weaker augmentation, as in EfficientNetV2's progressive learning. This replaces the all-stage translate removal, I063. On the tip (E048, or I066's successor if it is kept), make one change: turn off translate-2 during the 20 px and 28 px stages (epochs 0-3.0) and keep it in the 32 px stage. The alternating flip and brightness/contrast jitter stay in every stage. Translate is pad-and-random-crop inside the compiled augment, so use a separate augment variant for the low-res stages and pick it in Python by stage. Never put a data-dependent branch in the graph. Tensor shapes are unchanged. Warm up the new augment variant in build() with channels_last tensors of the exact timed layout. The RNG stream for flips and jitter should stay as is where possible; note in the run log whether the translate draws are skipped, since skipping them shifts the downstream RNG. Eval is unchanged.
E053	f9be5f5	0.7497	4.826594700331043	True	no	no	discard	I072	Raise the batch size only in the cheap low-res stages, as D016's 'cheaper variant' and C0235 suggest. The tip is E048, commit dc07126: bs 1536; 20 px bilinear antialiased whole images for epochs 0-1.5, 28 px for 1.5-3.0, then 32 px for the last 3.75; 6.75 epochs total; SGD-group lr x1.5; head lr x2 with wd halved; Muon lr 0.16, mom 0.8, NS3; lookahead 0.97^5; jitter; whitening bias trained in epoch 1 only. If I067 (16 px) or I069 is kept first, use that successor and leave its stage boundaries unchanged. Make one change: use bs 2048 for the first 3.0 epochs (150000 samples, the 20 px and 28 px stages) and keep bs 1536 for the 32 px stage. The stage boundaries in samples (75000, 150000) and the whitening-bias freeze at 50000 samples stay where they are. Index every schedule by samples seen, not by step index: the lr warmup/decay, the Muon lr multiplier and the lookahead (t/T)^3 ramp. The lr multiplier at a given progress fraction is then unchanged. Per-step lrs in the bs-2048 stages: - Muon lr stays 0.16 and momentum stays 0.8. C0218 says don't rescale at switches; C0210/C0212 say never raise momentum at a switch. - The SGD group's per-step lr is multiplied by 2048/1536 with wd unchanged, the noise-scale rule used in E041. Lookahead still syncs every 5 steps. Where a switch falls inside a step, split the straddling step into the two partial shapes, as the existing switches do. In build(), warm up with channels_last tensors in the exact timed layout (E035): - the bs-2048 20 px graph with and without whitening-bias grad; - the bs-2048 28 px graph; - every new partial-batch shape at the 50000, 75000 and 150000 boundaries. Keep build under ~450 s. Run debug_nan.py on the new shapes under max-autotune-no-cudagraphs, and compare trial-0 with later-trial train times. Eval is unchanged.
E054	81c1232	0.7524	4.81566614399829	True	no	no	discard	I074	Lengthen the 28 px stage again and price the next half-epoch of the 32 px tail. The tip is E052 (commit 447a7db): bs 1536; 20 px bilinear antialiased whole images for epochs 0-1.5 and 28 px for 1.5-3.5, both without translate; 32 px with translate-2 for 3.5-6.75; jitter in every stage; SGD-group lr x1.5; head lr x2 with wd halved; Muon lr 0.16, mom 0.8, NS3; lookahead 0.97^5; whitening bias trained in epoch 1 only. If I072 (bs 2048 in the low-res stages) is kept, use its commit and keep its batch sizes per stage. Make one change: move the 28 -> 32 px switch from 3.5 to 4.0 epochs (sample 200000), so 28 px runs for 2.5 epochs and 32 px for the last 2.75. The low-res augment variant (no translate) covers the longer 28 px stage. Total epochs, bs, the sample stream and every step-indexed schedule stay unchanged. Where the switch falls inside a step, split that step into the two partial shapes, as the existing switches do. In build(), warm up every new partial-batch shape at the 4.0-epoch switch for the 28 px and 32 px graphs, with channels_last tensors in the exact timed layout (E035). Keep build under ~450 s. Run debug_nan.py on new shapes and compare trial-0 with later-trial train times.
E055	bb1c66a	0.7500666666666667	4.75466302666852	True	no	no	discard	I057	Push the batch-size axis one step further, as D012 suggests, after the curriculum stack is settled. On the tip, change only the batch size, from 1536 to 2048, at the same epoch count (~159 steps at 6.5 epochs). Scale every schedule (warmup fraction, decay, Muon lr multiplier, lookahead (t/T)^3 ramp, the whitening-bias freeze at the end of epoch 1 in samples, and the curriculum switch in samples) to the new step count. The Muon lr stays at 0.16 and momentum at 0.8. Scale the SGD group (BN biases, whitening bias, head) per-step lr by x(2048/1536) and keep wd unchanged, the same noise-scale rule E041 used. Lookahead keeps syncing every 5 steps. In build(), warm up the 2048 full batch and the new partial batch (50000 mod 2048 = 848) for every train-graph variant and resolution, with channels_last tensors in the exact timed layout. Run debug_nan.py on the new shapes and compare trial-0 with later trial times.
E056	7ad71f3	0.7496666666666667	4.941696578665869	True	no	no	discard	I064	Test the SGD group's other untested lever, which I048 deferred until the head axis was read. Head x0.5 cost 0.41 pp (E039) and head x2 gained 0.18 pp (E045), so the SGD group looks under-driven rather than over-driven. On the tip, change only the BatchNorm-bias lr multiplier from x64 to x128, and keep lr*wd constant for the BN biases by halving their wd. The head lr (x2), whitening-bias lr, Muon, lookahead, LS, curriculum, jitter and epochs stay identical. The lr is a 0-d tensor, so nothing recompiles and no new shapes are needed.
E057	fcf9469	0.7550333333333333	4.931250012001935	True	yes	no	discard	I068	Measure the paired re-draw noise on the current base directly, without changing any math. On the tip (E047, or I061's successor if it is kept), make one change: in prepare(), right after seeding the trial generator and before the epoch permutations and augmentation draws, consume one dummy draw from that same trial-seeded generator (e.g. torch.randn(1, generator=g, device=g.device)). Every permutation, flip, translate and jitter value then shifts while the recipe stays identical. Nothing else changes, so no new compiled shapes are needed. Report per-seed accuracies next to the tip's. Discard the run regardless of outcome: keeping a lucky RNG shift would select on seeds 0-2 and would not transfer to the 40-seed judge.
