exp	commit	accuracy	time	complete	feasible	improved	status	tag	description
E000	4f4d29b	0.012166666666666668	0.10931955100143871	True	no	yes	keep	-	baseline
E001	866d2a2	0.7583666666666666	9.280933287334241	True	yes	yes	keep	I001	Build the first real recipe in submissions/arena/: an airbench96-style net without TTA. Settings: frozen patch-whitening conv (2x2, fit in prepare on real train images), dirac init, widths 128/384/576, depth 3 per block, BatchNorm-bias lr x64, Nesterov SGD lr 9 / wd 0.012 / bs 1024, label smoothing 0.3, lookahead, alternating flip plus translate-2 on GPU. The whole train set lives on the GPU as uint8 and is loaded in prepare. Use channels_last with bf16/fp16 autocast. torch.compile and warmup run in build() on synthetic data, covering the full batch, the final partial batch and eval shapes. Train for 10 epochs. Eval is a plain forward with no TTA and must handle any B from 1 to 1024.
E002	479b9a3	0.7552333333333333	8.338780419665758	True	yes	yes	keep	I003	Third point of the epoch sweep on the base recipe: 9 epochs, or 11 if the 10-epoch run missed 0.753. Fit accuracy against epochs with the 8.5 and 10 points and find the knee at 0.753 to within 0.5 epochs.
E003	479b9a3	0.7552333333333333	8.413640601332494	True	yes	no	discard	I004	rerun E002 unchanged (noise floor)
E004	b4e9bbb	0.7559666666666667	8.34989483400083	True	yes	no	keep	I005	Base recipe at its knee epoch count, with label smoothing 0.2 instead of 0.3. Nothing else changes.
E005	4e36ee3	0.7541666666666667	8.347034433667432	True	yes	yes	discard	I009	Built on the first feasible airbench96-style base (I001/I003 knee). Make one systems change and leave the recipe alone. Move the whole training step into one torch.compile'd function: forward, backward, Nesterov SGD update and lookahead blend. Apply the update with torch._foreach_* ops (or SGD foreach/fused=True) so there is no per-parameter Python loop. Pass lr and the lookahead schedule as 0-d GPU tensors so changing them never triggers a recompile. Compile and warm up this function in build() on synthetic data, covering the full batch and the final partial batch. Keep the epoch count, seeds, lr, wd, LS and widths identical to the base.
E006	7854250	0.7509666666666667	7.916349128667207	True	no	no	discard	I010	Change one thing in the E002 recipe: the epoch count, from 9 to 8.5. Scale the lr/lookahead schedule to the new total step count, so the shape stays the same over fewer steps. The last half-epoch uses the first half of that epoch's permutation. The final partial batch is still the shape that was compiled in build(). Everything else stays bit-identical to E002 (commit 479b9a3).
E007	52204ad	0.7541666666666667	8.257354511333688	True	yes	yes	keep	I011	Target conv throughput: cuDNN conv kernels are about 75% of GPU time but run at only about 30% of bf16 peak. On the E002 recipe at 9 epochs, set torch.backends.cudnn.benchmark=True before warmup in build() and compile the model step with mode='max-autotune-no-cudagraphs', so Inductor benchmarks its Triton conv/GEMM templates against cuDNN for every shape (full batch, partial batch, eval) on synthetic inputs. All autotuning stays in untimed build(). If the base already has one of these settings, add only the missing one.
E008	0b47865	0.7443333333333333	8.334861549999914	True	no	no	discard	I006	Base recipe at its knee epoch count with lookahead removed: plain Nesterov SGD, no weight averaging. Same lr, wd and schedule.
E009	fb47e35			False	no	no	crash	I014	One systems change on the tip recipe (E007 commit 52204ad: 9 epochs, LS 0.2, cudnn.benchmark plus max-autotune-no-cudagraphs). Replace the final global adaptive_max_pool2d (and any other adaptive pool in the net) with an equivalent reduction, x.amax(dim=(2,3)), or F.max_pool2d with a fixed kernel equal to the spatial size. Its backward then becomes a dense masked/eq kernel that Inductor can fuse, instead of the atomic scatter kernel that took 0.48 ms/step (~2.5% of GPU time) in the E003 profile. The forward math is identical. Recompile and warm up in build() for the full batch, the partial batch and eval shapes. Nothing else changes.
E010	5aa9aa5	0.7551333333333333	8.091988340665315	True	yes	yes	keep	I014	One systems change on the tip recipe (E007 commit 52204ad: 9 epochs, LS 0.2, cudnn.benchmark plus max-autotune-no-cudagraphs). Replace the final global adaptive_max_pool2d (and any other adaptive pool in the net) with an equivalent reduction, x.amax(dim=(2,3)), or F.max_pool2d with a fixed kernel equal to the spatial size. Its backward then becomes a dense masked/eq kernel that Inductor can fuse, instead of the atomic scatter kernel that took 0.48 ms/step (~2.5% of GPU time) in the E003 profile. The forward math is identical. Recompile and warm up in build() for the full batch, the partial batch and eval shapes. Nothing else changes.
E011	c232dcd	0.7497333333333334	7.767010870333858	True	no	no	discard	I015	Test the width claim in the direction that saves time. On the tip recipe (E007, 9 epochs), shrink the last block from 576 to 512 channels and keep everything else, head input included, consistent. Block 3 is roughly a third of the network's FLOPs (conv1 at 8x8 plus two convs at 4x4), so this cuts about 5-6% of FLOPs. Record per-epoch time and per-seed accuracy.
E012	c0b7655	0.7528333333333334	8.125049773999004	True	no	no	discard	I016	Schedule shape (D001 flagged that the tree has no node for it). On the tip recipe (E007, 9 epochs), change only the lr schedule's warmup: halve the warmup fraction (for example from ~23% of steps to ~12%), keep the same peak lr 9, and decay linearly to exactly zero at the final step. If the base already decays to zero, change only the warmup fraction. The lookahead schedule stays tied to step count as before.
E013	6908a52	0.7470666666666667	6.966748373997689	True	no	no	discard	I008	Explore: on the feasible base, run the first ~35% of epochs on 24 px random crops and the rest at full 32 px. Compile both resolutions in build(). Same epoch count as the knee.
E014	c68743c	0.7680666666666667	9.178059158999531	True	yes	no	discard	I012	Corrected version of I007 that changes only one thing. On the E002 recipe (bs 1024, 9 epochs, same schedule shape), optimize the 4D conv filters (all except the frozen whitening conv) with Muon: Nesterov momentum 0.6, lr about 0.24, 5 Newton-Schulz quintic steps in bf16, with the update scaled by sqrt(max(1, out/in)) on the flattened [out, in*k*k] matrix. BatchNorm biases and the head stay on the existing Nesterov SGD with the same lr/wd. Keep lookahead. Compile the NS loop in build(). Log the optimizer step time separately.
E015	a47bdee	0.7510666666666667	7.483529160999751	True	no	no	discard	I017	Explore where capacity sits. On the tip recipe (E007, 9 epochs), cut the first block's depth from 3 convs to 2: drop one 128->128 3x3 conv at 16x16 and leave blocks 2 and 3 at depth 3. This removes about 6% of the FLOPs, the cheapest-per-accuracy capacity if H1.5 is right that the late layers matter most for a 100-way head. Dirac init, widths and everything else stay unchanged.
E016	59dac7e	0.7619	8.11424579766996	True	yes	no	keep	I018	Exploit E014. Port the E014 Muon optimizer exactly as it was onto the tip E010 commit (5aa9aa5: LS 0.2, cudnn.benchmark, max-autotune-no-cudagraphs, F.max_pool2d head). Muon settings: conv filters except the frozen whitening conv, Nesterov momentum 0.6, lr 0.24, 5 quintic NS steps in bf16, update scaled by sqrt(max(1,out/in)) on the flattened [out,in*k*k] matrix. BN biases and the head stay on the existing SGD, and lookahead is kept. Make ONE recipe change: epochs 9 -> 8, with the lr, Muon and lookahead schedules scaled to the new step count. The final partial batch shape is compiled in build(). Before launching, run the one-step finite-gradient check (drafts/debug_nan.py), because the compiled NS and Muon graph is new to the tip's compile mode. Log the optimizer step time separately.
E017	eff75ec	0.7639	7.886601234997215	True	yes	yes	keep	I019	Cut Muon's per-step overhead. E014 added ~10% time, or ~1.9 ms/step, for NS. Take the Muon 8-epoch recipe above and change only the Newton-Schulz iteration count from 5 to 3 quintic steps, keeping the same coefficients (airbench94_muon uses 3; D002 C0013-C0015 show final quality is insensitive to exact orthogonalization). Keep everything else identical. Report the optimizer step time per step against the 5-step run.
E018	d634e3b	0.7595999999999999	7.3900071763346205	True	yes	yes	keep	I020	Find the Muon knee below 8 epochs. Run this after the Muon 8-epoch run, and only if it scores >=0.758. Take the better of the 5-step and 3-step NS variants and change only the epoch count, from 8 to 7.5. Scale all schedules to the step count. The last half-epoch uses the first half of that epoch's permutation, as in E006.
E019	eb627d7	0.7491666666666666	7.380769707335276	True	no	no	discard	I021	Tune Muon's lr, which was inherited untuned from CIFAR-10 airbench94_muon. On the Muon 8-epoch recipe (or 7.5 epochs if that becomes the tip), change only the Muon lr from 0.24 to 0.36. The SGD lr for BN biases and the head stays the same. If it falls by more than 0.25 pp, the follow-up direction is 0.16.
E020	0cfa54d	0.7510333333333333	7.3676665856692125	True	no	no	discard	I022	Test whether Muon's update normalization replaces averaging. On the Muon 8-epoch recipe, remove lookahead (plain Muon + Nesterov SGD, no weight averaging) and change nothing else. Compare it paired against the Muon 8-epoch run with lookahead. This is purely informative about the H4.2/H1.2 interaction: it decides whether averaging tuning (H1.6) is still worth runs on the Muon base.
E021	c33cae8	0.7620333333333333	7.231062975001502	True	yes	yes	keep	I023	Systems change that transfers to any recipe. On the current tip (the Muon successor if one is kept, else E010), replace GELU with SiLU everywhere and change nothing else. SiLU's sigmoid is cheaper than GELU's erf, and Inductor may fuse its BN+act backward with less recompute. Run the one-step finite-gradient check under max-autotune-no-cudagraphs first (E009 lesson), and re-profile the Triton elementwise share.
E022	44f6372	0.7582333333333333	6.740357899664862	True	yes	yes	keep	I025	Find the Muon knee below 7.5 epochs. On the tip E018 (commit d634e3b: Muon NS3, lr 0.24, momentum 0.6, lookahead, LS 0.2, 7.5 epochs), change only the epoch count from 7.5 to 7.0. Scale the lr, Muon and lookahead schedules to the new total step count. 7 epochs is a whole number, so the half-epoch permutation trick is not needed. The final partial batch shape stays the one compiled in build(). Nothing else changes.
E023	9c08ac0	0.7568333333333334	6.558853191667974	True	yes	yes	keep	I026	Systems change to the Muon optimizer step only; the recipe math stays the same. Muon currently costs 1.93 ms/step of GPU time (about 10% of the step), mostly as many small kernels: 9 per-param calls, each with momentum, norm and projection ops plus per-iteration NS elementwise work. Replace them with one torch.compile'd Muon step over all conv filters. Do the momentum and Nesterov update with torch._foreach_* ops. Stack same-shape flattened filters within each block (128x1152, 384x3456, 576x5184 pairs) and run the 3 quintic NS iterations as one bmm per shape group. Apply the sqrt(max(1,out/in)) scaling and the weight-norm projection inside the same compiled function. Pass the Muon lr as a 0-d GPU tensor so schedule changes do not recompile. Compile and warm up in build() on synthetic tensors. Run the drafts/debug_nan.py one-step finite-gradient check under max-autotune-no-cudagraphs before launching (E009 lesson). Measure the Muon step GPU time with drafts/time_muon.py before and after.
E024	a4bb8fb	0.7585333333333334	6.531138708000071	True	yes	yes	keep	I027	Pre-registered follow-up to E019 (Muon lr 0.36 cost 1.04 pp on every seed). On the current tip (the 7.0-epoch Muon run if it is kept, else E018 at 7.5 epochs), change only the Muon lr for the conv filters from 0.24 to 0.16. The SGD lr for BN biases, whitening bias and head, the schedule shape, lookahead and NS3 all stay unchanged.
E025	2c50588	0.7534666666666667	6.573776529665338	True	yes	no	discard	I028	Lower the end-of-schedule floor for the Muon group only. E019's post-mortem says the Muon lr is an unbuffered per-step relative rotation, and the 0.07x terminal floor leaves end-of-training noise that lookahead cannot average out. On the current tip, change only the Muon group's lr multiplier so it decays linearly to 0 at the final step instead of to 0.07x. The warmup and the rest of the decay keep the same shape. The SGD group (BN biases, head) keeps its existing schedule, including its 0.07x floor. Lookahead is unchanged.
E026	6b89d6f	0.7603333333333333	6.548330743333888	True	yes	no	keep	I029	Explore Muon momentum, inherited untuned from CIFAR-10 airbench94_muon at bs ~2000. On the current tip, change only the Muon Nesterov momentum from 0.6 to 0.8. Muon lr, NS3, lookahead and the SGD group stay the same. Rationale: at bs 1024 with a 100-way head, per-step gradients are noisier than in the bs-2000 CIFAR-10 setting. Heavier momentum averages more before orthogonalization, which normalizes away gradient magnitude, so momentum is the only knob that filters direction noise.
E027	3a8eb92	0.7545999999999999	6.093930100330908	True	yes	yes	keep	I031	Trim the Muon knee by a quarter epoch. On the current tip (E023 commit 9c08ac0: Muon NS3 batched and compiled, lr 0.24, momentum 0.6, lookahead, LS 0.2, SiLU, 7.0 epochs; or the I027/I028 successor if either is kept), change only the epoch count from 7.0 to 6.75. Scale the lr, Muon and lookahead schedules to the new total step count. The last quarter-epoch uses the first quarter of that epoch's permutation, as in E006/E018. The final partial batch must be a shape compiled in build(); add it to the warmup if it is new. Nothing else changes. If I027 or I028 is kept with a gain of 0.2 pp or more, use 6.5 epochs instead (one epoch-count change from that tip).
E028	e95ff94	0.7546333333333334	6.077495828998508	True	yes	yes	keep	I032	Lengthen the lookahead averaging window on the Muon base. E020 shows averaging is worth ~0.9 pp with Muon, and the schedule (decay 0.95^5 x (t/T)^3, sync every 5 steps) was inherited untuned from CIFAR-10. On the current tip, change only the lookahead base decay from 0.95^5 (~0.774 per sync) to 0.97^5 (~0.859 per sync). That roughly doubles the effective averaging horizon late in training. The (t/T)^3 ramp, the sync interval of 5 steps, the final-weights handling and everything else stay unchanged.
E029	1d38759	0.7580333333333333	6.411832326331933	True	yes	no	discard	I033	Combine the E011 near-miss with the epoch exchange rate. E011 priced block-3 width at ~0.13 pp per 1% of time, while cutting Muon epochs costs only ~0.056 pp per 1% (E022: 0.38 pp for 6.8%). So extra block-3 width paid for by fewer epochs should be a net win. On the current tip, widen only block 3 from 576 to 640 channels (a multiple of 64 for tensor-core tiling), keeping the head input and Muon groups consistent; the 640-wide filters stay batched as a same-shape pair in the compiled NS. Epochs stay at the tip's count. Run the one-step finite-gradient check under max-autotune-no-cudagraphs first, and warm up the new shapes in build().
E030	a255916	0.7426	6.303244266334029	True	no	no	discard	I030	Explore the D003 mechanism (C0016/C0017): how a 4D kernel is split before orthogonalization. Replace the flattened [out, in*9] orthogonalization with a real frequency-wise variant of Muon-C. Project each 3x3 kernel momentum onto an orthonormal real 3x3 basis (the tensor product of the 3-point orthonormal DCT-II), which gives 9 [out, in] matrices per layer. Orthogonalize them with one batched 3-step NS (bmm over the 9 frequencies), then transform back to the spatial domain. The output scaling uses sqrt(max(1,out/in)) on the [out,in] shape. Keep the weight-norm projection, lr 0.24, momentum 0.6, lookahead and the epoch count of the current tip. Compile in build() and run the one-step finite-gradient check first.
E031	9b2f012	0.7540666666666667	6.1029981713315165	True	yes	no	discard	I034	Muon's updates have a fixed magnitude (an orthogonalized step against a weight-norm projection), so the SGD-style warmup (23% of steps ramping from 0.2x) may waste early steps for the conv filters. On the current tip, change only the Muon group's lr multiplier during warmup: hold it at 1.0x from step 0, and keep the existing decay shape and floor after the warmup point. The SGD group (BN biases, whitening bias, head) keeps its full warmup schedule. Lookahead, NS3, momentum and epochs are unchanged. Check finite gradients for the first ~20 steps on synthetic data in drafts/ before launching.
E032	eba1609	0.7543666666666666	6.072660868997143	True	yes	yes	discard	I035	Systems change to the conv shapes, with the learning recipe unchanged. First, in drafts/, print the activation spatial sizes per block and run a per-layer profile of the tip (untimed, not an experiment). If the unpadded 2x2 whitening conv outputs 31x31, block 1's first conv runs at 31x31, and max-pool(2) then floors that to 15x15, so its last row and column are computed and discarded. Make one change: slice the whitening output to [..., :30, :30] in the model's forward, identically in train and eval. This is a fixed architecture step, not TTA, and eval still accepts 32x32 inputs for any B. Every downstream pooled shape is unchanged (15/7/3); the only math change is that row and column 29 see zero padding instead of row and column 30. Warm up the new shapes in build() and run the finite-gradient check. If the profile shows the net already runs at even sizes (32/16/8/4), skip this idea and mark H2.5.2 not applicable.
E033	5497bac	0.7529	6.118057614333035	True	no	no	discard	I036	On the current tip (E028 commit e95ff94: Muon NS3 batched and compiled, lr 0.16, momentum 0.8, lookahead 0.97^5, LS 0.2, SiLU, 6.5 epochs), make one change: the Muon group's terminal lr floor goes from 0.07x to 0.15x. Shift the linear decay after warmup so it ends at 0.15x at the final step. Warmup shape, peak, the SGD group's schedule (floor stays 0.07x), lookahead, epochs and everything else stay unchanged. This is the untested direction opposite E025, where decay-to-0 cost 0.51 pp on the Muon group.
E034	f74c715	0.7551	5.894344831666483	True	yes	yes	keep	I037	Systems change; the recipe is unchanged during the first epoch. On the tip, train the whitening-conv bias only for the first epoch (~49 of ~319 steps), as airbench94_muon/Hiverge do. After that, call a second compiled train-step variant where whiten.bias is detached / requires_grad=False. The whitening output then needs no grad, and the backward skips the input-gradient (dgrad) of block 1's first 24->128 conv at 31x31 plus the whitening-bias reduction. Compile and warm up BOTH variants in build() on synthetic data (full and partial batch) so the switch never recompiles in the timed region. Lookahead still blends the frozen bias (a no-op once it is fixed). Run drafts/debug_nan.py on both graphs under max-autotune-no-cudagraphs first.
E035	6f7d490	0.7554333333333333	6.176477517998137	True	yes	no	discard	I038	On the tip, after training ends and the final lookahead-averaged weights are in place (inside train(), so it is timed), recompute the BN running statistics. Reset running_mean/var, set BN momentum=None (cumulative average), and run a no-grad train-mode forward over 12 batches of 1024 training images: un-augmented, normalized as in training, bf16 autocast, channels_last. Restore the momentum afterwards. Compile and warm up this train-mode no-grad forward in build() on synthetic data. Before launching, check in drafts/ whether lookahead currently blends BN buffers; recalibration replaces them either way. The learning recipe is otherwise unchanged.
E036	6442694	0.7548666666666667	5.898714751999553	True	yes	no	discard	I039	On the tip at 6.5 epochs, change only the label smoothing, from 0.2 to 0.1. E004 tested LS only between 0.2 and 0.3, and only on SGD at 9 epochs. Hiverge uses 0.09 at ~7.65 epochs. Everything else (Muon, SGD group, lookahead, augmentation, epochs) stays identical.
E037	d54f788	0.7527	5.8078868969969335	True	no	no	discard	I040	Test whether reallocating FLOPs from block-1 depth to epochs pays now that the Muon epoch slope is steep (1.14 pp/epoch for 7.5% time between 6.5 and 7). On the tip, cut block 1 from 3 convs to 2 (drop one 128->128 3x3 conv) and raise epochs from 6.5 to 7.0, with all schedules scaled to the new step count. These are the two halves of one time-matched reallocation. The Muon NS group for 128x1152 now has one matrix instead of a pair; warm up the new shapes, including the 7-epoch final partial batch, in build(), and run the finite-gradient check.
E038	0aef1a5	0.7551666666666667	5.885562021666071	True	yes	yes	discard	I041	Systems change, math unchanged. Gate it first in drafts/: compare the batched Muon step's wall span (cuda events around it) with the sum of its kernel times from the profiler. Launch only if the gap is 0.4 ms/step or more. If so, capture the compiled Muon step (foreach Nesterov momentum, NS3 bmm per shape group, sqrt(out/in) scaling, weight-norm projection) in a torch.cuda.CUDAGraph during build() on synthetic tensors. Use static .grad buffers (zero_grad(set_to_none=False)), a 0-d lr tensor updated with fill_, and parameters and momentum buffers that prepare() resets IN PLACE (copy_/zero_), so the captured addresses stay valid across trials. Replay the graph each step. Everything else stays unchanged.
