exp	commit	accuracy	time	complete	feasible	improved	status	tag	description
E078	d32643f	0.7516999999999999	4.561103781001293	True	no	no	discard	I107	Trial-level re-profile of E069, then one bit-identical cut to the per-epoch data pipeline. All previous profiles were per step (E003/E016/I101). None covers per-epoch work: augmentation (flip, translate, jitter, antialiased interpolate to 20/28 px), randperm and gather. In E003 that work was ~11 ms/epoch at 32 px, and it now also includes jitter and resizing. Gate in drafts/: profile one full E069 trial with the torch profiler. Report GPU time for (a) per-epoch augment, resize, permute and gather; (b) the split straddling steps at the 50k/75k/175k/270k-sample switches; (c) lookahead syncs; (d) the train and Muon steps. Launch only if (a) totals >=0.05 s per trial. If it does, make one change. Rewrite the per-epoch augment as a single compiled pass that computes exactly the same per-sample ops in the same precision and order. It consumes the same RNG draws, generated for all 50k samples so the stream is unchanged, and writes only the samples the epoch will actually consume: the first 0.75 of the permutation in the final partial epoch, and the per-stage halves of epochs that straddle a resolution switch. Warm it up in build() on synthetic channels_last uint8 inputs. Before launching, require offline seeds-0-2 per-seed accuracy bit-identical to E069. If the fused version is not bit-identical (Inductor rounding), apply only the consumed-samples restriction to the existing kernels.
E079	e90a336	0.7515333333333334	4.636737627331361	True	no	no	discard	I111	Price an intermediate block-1 freeze point on the true-mean scale. Freezing at 0.8 is the tip; at 0.7 it costs -0.11 pp paired over 13 seeds on E058 (E061/E073). The E073 config's seeds-0-2 score is fixed by determinism (I102), so only a new config can be tested. Base: E069. Make one change: switch to the existing block-1-frozen graph pair (Polar Express Muon variant without the block-1 groups, block-1 BN biases skipped in SGD) at sample 253125 (0.75 of samples) instead of 270000. Split the straddling step into the two partial shapes and warm them up in build() with channels_last tensors (E035). Run debug_nan.py. Gate offline first: on seeds 3-12 paired against E069 (mean 0.75258), launch on seeds 0-2 only if the paired delta is >=-0.08 pp and offline train time is <=-0.9%. This keeps the 40-seed official mean safely above 0.752 (H4.3) whatever seeds 0-2 draw.
E080	6c57b49	0.7523	4.6641797843331005	True	no	no	discard	I112	Mechanism test for the E050 16 px collapse, with a small time saving. Base: E069. Make one change: the first-stage resolution goes from 20 px to 18 px (F.interpolate, antialias=True, inside the compiled augment). This should keep a 2x2 final map. In drafts/, print the per-block sizes first; expect whitening 17, then pools 8/4/2. If the final map is not 2x2, abort and record why. Use a static-kernel F.max_pool2d for the final pool (no amax). Stage boundaries in samples, the whitening-bias freeze at 50000, and all schedules stay unchanged. Warm up the 18 px graphs, with and without whitening-bias grad, plus every partial shape at 50000 and 75000 in build() with channels_last tensors. Run debug_nan.py. Gate offline: on seeds 3-12 paired against E069, launch on seeds 0-2 only if the paired delta is >=-0.05 pp and offline train time is <=-0.5%.
E081	fde0cdf	0.7525333333333333	4.5062113153350465	True	no	no	discard	I116	Fallback: the pure math-preserving systems bundle. Run it only if the cut-stack idea fails its offline gate. Base: E069. Apply both verified bit-identical savings together and nothing else: E078's fused per-epoch augment, which writes only consumed samples with an unchanged RNG stream (max diff 2.4e-7), and E077's build()-time warmups (synthetic cuSOLVER/cuBLAS whitening-fit warmup, allocator pre-reservation for the data and augment buffers, pinned staging buffer with non_blocking H2D). Offline, require seeds 0-2 per-seed accuracy bit-identical to E069 (0.7578/0.7535/0.7569) and seeds 3-12 equal to E069's stored results, then launch once. Do not re-roll if it misses: the true mean equals E069's (~0.753), so the local gate is a coin flip, and selecting on reruns would select on noise. If it misses, carry this code into every later candidate as the base.
E082	f703dcc	0.7555999999999999	4.583510030332643	True	yes	yes	keep	I124	Run one offline screen of a few configs, then launch the best one exactly once. Base is the I119 code: the E081 bundle (E069 + fused per-epoch augment + build-time prepare warmups) plus the paired_gate.py config switch. Run everything in ONE process with one build, seeds 3-32 (30 seeds), configs alternating per seed so they share autotuned kernels, as in I119. Configs: - c0 = E081 bundle as is (20 px first stage, 6.75 epochs). Control. - c1 = I119 cfg1: 18 px first stage, 6.875 epochs, block-1 freeze at 0.8 of total samples (275000). - c2 = 18 px first stage, 6.9375 epochs (346875 samples). The extra 0.1875 epoch goes into the 32 px stage, the block-1 freeze moves to 277500, and every schedule is indexed by samples seen. The final partial epoch uses the first 0.9375 of its permutation, and the fused augment writes only the consumed samples. - If the I123 warmup screen promotes an arm, or the outside-step cut (next idea) passes its gate first, add it to c1 and c2. Never add it to c0. Warm up every new partial shape (277500, the run end) in build() with channels_last tensors (E035), and run debug_nan.py. Pre-registered launch rule. For each config compute: - m = 30-seed mean; - t = offline train+prepare time × (4.506/4.515), the E081 harness/offline calibration; - P = Φ((m − 0.7530)/0.16), using a 3-seed-mean sd of 0.16 pp from the per-seed sd of ~0.28; - EV = P × (4.678 − t). Launch the argmax-EV config once on seeds 0-2 only if P ≥ 0.60 and t ≤ 4.63 s. Do not re-roll. Report seeds 23-32 separately: they are fresh, while seeds 3-22 of c1 already informed I119.
E083	69a0351	0.7555999999999999	4.56676784500208	True	yes	yes	keep	I136	Exploit: launch the math-preserving I131 base once on seeds 0-2. drafts/I131_base.py is the E082 tip (18 px first stage, 6.875 epochs, block-1 freeze at 0.8, PE-NS3, fused augment, vectorised dirac) plus two additions. (a) I125: a compiled foreach lookahead blend with a 0-d decay tensor, plus a whole-epoch low-res resize for epochs that sit entirely inside one stage. (b) I131: persistent GPU and pinned-host train-set buffers allocated in build(), plus build-time warmups of prepare()'s first-use ops on synthetic data. Both additions were checked bit-identical in unit tests, and neither touches real data or seeds in build(). Before launching, re-run debug_nan.py and check offline that seeds 0-2 per-seed accuracy in one process matches the I131 screen's base config, and that prepare is ~0.02 s on every trial. Launch once and do not re-roll. If it misses, I131_base stays the code base for every later candidate. The recipe's true mean is unchanged, so a miss says nothing about H2.
