exp	commit	accuracy	time	complete	feasible	improved	status	tag	description
E000	8b4d3d7	0.012166666666666668	0.13976113633058654	True	no	yes	keep	-	baseline
E001	2998e35	0.7429666666666667	9.431919813000908	True	no	yes	keep	I001	Replace the template recipe in submissions/arena/ with an airbench96-style port. Architecture: a frozen 2x2 patch-whitening first conv, with whitening computed in prepare from training patches; Dirac init; 3 residual groups of 3 convs at widths 128/384/576; BatchNorm-GELU. Optimizer: Nesterov SGD, lr 9.0 (airbench scaling), wd 0.012, batch size 1024, triangular LR schedule, 9 epochs, label smoothing 0.3. Data: the dataset stays on the GPU in fp16/channels_last; random crop (pad 2) runs on the GPU; derandomized alternating flip. No TTA and no torch.compile yet. Eval is a plain forward pass with no state changes. Build warms up eager kernels and cuDNN on synthetic tensors for train batch 1024 and eval B in {1, 1024}. This is the base recipe every other idea builds on.
E002	e3299ac	0.7495333333333334	10.545667999336729	True	no	yes	keep	I002	On the E-port recipe, change only the epoch count: 9 → 8.5 if the port clears 0.753 with at least 0.3 pp margin, otherwise 9 → 10. Everything else stays identical, so this measures the local accuracy-vs-time slope that sets how far epochs can be cut.
E003	b7a93cd	0.7486333333333334	12.067211381334346	True	no	no	discard	I003	On the port, compile the model's forward+backward with torch.compile (mode='max-autotune-no-cudagraphs') in build. Compile and warm up on synthetic inputs for the train batch shape and the ragged last-batch shape, and in eval mode for B in {1, 7, 512, 1024} (mark the batch dimension dynamic for eval, or fall back to the eager model for eval). Also replace the per-param SGD loop with a foreach/fused SGD. Math stays unchanged.
E004	3f008be	0.7486333333333334	9.040086971333949	True	no	no	keep	-	I003 re-run: compile+fused SGD with channels_last warmup (stride-guard fix)
E005	ac425fc	0.7583000000000001	9.097539043003053	True	yes	yes	keep	I004	On the port at 9 epochs, add Lookahead/EMA of weights in the airbench96_faster style: update every 5 steps, alpha ramping as in the reference, final weights set to the EMA copy. All EMA state is created and reset in prepare. The forward pass is unchanged.
E006	3b2e228	0.7649	9.44608330266783	True	yes	no	keep	I007	Explore. On the port backbone, switch the conv filters to Muon: Newton-Schulz-orthogonalized Nesterov momentum, lr about 0.24, momentum 0.6. Keep SGD for BatchNorm params, whitening bias and the head. Batch size 2000 with the same epoch count. Newton-Schulz runs in bf16 with a foreach-style batched implementation.
E007	62b4b12	0.7590333333333333	7.328381033667635	True	yes	yes	keep	I008	Explore. On the port, apply progressive resizing: the first about 40% of epochs at 24 px, the next 30% at 28 px, the rest at 32 px (random-resized-crop on the GPU via F.interpolate). Warm up every resolution in build on synthetic data. Epoch count unchanged.
E008	7df727a	0.7572333333333333	6.977379820668527	True	yes	yes	keep	I009	Exploit. On the E007 recipe (Muon + Lookahead/EMA + progressive resizing 24→28→32 px, 9 epochs), change only the epoch count from 9 to 8.5. Keep the resolution split as fractions of total steps (about 40/30/30%) and stretch the LR and EMA schedules to the new step count. Warm up every resolution in build with channels_last tensors from the training code path. Set torch._dynamo.config.error_on_recompile=True after build so a leak fails loudly. This spends part of E007's 0.60 pp margin and measures the slope with EMA and Muon on.
E009	52f5cae	0.7564333333333333	6.993527450666686	True	yes	no	discard	I010	Exploit. On the E007 recipe at 9 epochs, change only the end of the LR schedule: decay linearly to exactly 0 instead of 0.07 of peak, for both the Muon group and the SGD groups (BN, whitening bias, head). The warm-up, peak and Lookahead/EMA schedule stay unchanged. This tests whether EMA and a lower final LR are only partly redundant, which the E005 post-mortem predicts.
E010	4fac4d2	0.7547666666666667	6.639434386001085	True	yes	yes	keep	I012	Exploit. On the E007 recipe, narrow only the last residual group from 576 to 512 channels (the airbench96_faster width). Keep everything else the same, including the Muon lr, epochs and resizing schedule. Re-warm-up all compiled shapes in build.
E011	74ebda7	0.7451	5.703121792665722	True	no	no	discard	I011	Exploit, building on E007's finding that time scales with pixel count. On the E007 recipe at 9 epochs, use a more aggressive resolution schedule: the first 30% of steps at 20 px, then 30% at 24 px, 20% at 28 px, and the last 20% at 32 px. Each resolution is compiled and warmed up in build with channels_last synthetic batches of the exact training shape. Use error_on_recompile after build. Keep the global max-pool head so the network works at every size.
E012	4fac4d2	0.7547666666666667	6.646141453333257	True	yes	no	discard	I016	Diagnostic that sharpens I013 for the current tip; it makes no recipe change. Run the E010 recipe exactly as committed (Muon, Lookahead/EMA, 24→28→32 px, 9 epochs, last group 512) offline on held-out seeds 3-12 through the same harness code path. Record per-seed accuracy, the 10-seed mean, the std and the offset from the seeds 0-2 mean (0.7548). In the same pass, record per-epoch CUDA-event times to settle H3.3.1. Do not edit submissions/arena/.
E013	5cbba79	0.7551333333333333	6.629994306999531	True	yes	yes	discard	I017	Exploit, as a near-free accuracy lever (W1 and W3 crux). On the E010 recipe, change only the label smoothing from 0.3 to 0.2 (the airbench96_faster value) in the training loss. Epochs, resizing, Muon/SGD settings and Lookahead/EMA stay the same, and so do the compiled shapes. Since the loss changes only by a constant, no extra warm-up is needed beyond the usual error_on_recompile check.
E014	2c7e4e2	0.7557333333333334	6.63116790066609	True	yes	yes	discard	I018	Exploit. On the E010 recipe, change only the Muon learning rate for the conv filters from 0.24 to 0.36 (×1.5). The SGD groups (BN, whitening bias, head), momentum 0.6, batch size 2000, schedule shape, epochs and Lookahead/EMA stay the same. The 0.24 value comes from CIFAR-10 airbench94_muon, and E006's surprise gain (+0.66 pp, outside every member's range) suggests the CIFAR-100 optimum has not been explored.
E015	a6d754b	0.7574333333333333	6.577778801666379	True	yes	yes	keep	I014	Explore. On the E007 recipe, capture the train step (forward, backward, Muon Newton-Schulz plus SGD update, and the EMA update on steps where it applies) in CUDA graphs. Use torch.compile mode='max-autotune' (cudagraphs on) or a manual torch.cuda.graph per resolution with static input buffers that the GPU augmentation writes into. Capture every resolution in build on synthetic data. Math stays identical.
E016	d360673	0.7607333333333334	6.579923757000263	True	yes	no	keep	I019	Exploit, as the second point of the coarse grid. On the E010 recipe, halve only the weight decay for all parameter groups (Muon conv filters and SGD groups), keeping the same decoupled or coupled form the code uses now. Everything else stays identical. Short runs with EMA may need less regularization than the 0.012 CIFAR-10 value.
E017	dddcf96	0.7537333333333334	6.54794617266695	True	yes	yes	keep	I021	Explore, settling the W2/W4 crux about launch versus compute. Run torch._dynamo.explain and a short torch.profiler trace offline on the E010 train step on synthetic data: GPU augmentation, forward/backward, Muon+SGD step, Lookahead/EMA update and LR schedule. If there are graph breaks or host syncs (for example .item(), Python-scalar LR, or tensor-to-bool checks), remove them: keep LR as a GPU tensor, fold augmentation into the compiled region, and keep the math identical. Commit only the break-free version and record the measured GPU idle fraction in the notebook.
E018	2adcedf	0.7502	5.993199579002976	True	no	no	discard	I023	Exploit. Tests a proposed new child of H2.3: accuracy is set mainly in the final 32 px phase, so the 28 px middle phase can be dropped cheaply. On the E015 recipe (Muon, Lookahead/EMA, CUDA graphs, 9 epochs, last group 512), change only the resolution schedule from 24/28/32 px at 40/30/30% of steps to 24/32 px at 70/30% of steps. The 32 px tail keeps exactly its current step count and position, so the LR and EMA schedules stay the same. Build no longer needs the 28 px graph; keep the 24 and 32 px warm-up and capture, and keep error_on_recompile on after build.
E019	dddcf96	0.7540666666666667	6.5404667533342336	True	yes	yes	discard	I030	Diagnostic, making no recipe change. It replaces I025, which pointed at E015, and answers the main crux of W1, W2, W3 and W5: is E016's 0.7607 real margin or a reshuffle? (1) Run the committed E016 recipe offline on held-out seeds 3-12 through the harness code path (benchmark.run --seed 3 --n 10). Record per-seed accuracy, the 10-seed mean, the std and the offset from 0.7607. (2) Secondary, for H4.3.1: clear the inductor cache and rebuild E016 in a fresh process, run seeds 0-2 again, and record whether the per-seed accuracies are bit-identical and how far the 3-seed mean shifts. (3) While doing this, read the true optimizer step count from the code for H4.2.3. E012's per-epoch timing listed 10 epoch loops, the last about half length, which suggests about 9.5 true epochs. Do not edit submissions/arena/.
E020	4d00086	0.7527666666666667	5.861187173000265	True	no	no	discard	I031	Exploit: spend the margin on the epoch dial. On the current tip, cut 1.0 true epoch uniformly. That is E016, about 9.5 → 8.5 true epochs (verify the step count in code first; H4.2.3). If the 24/32 swap idea was kept first, cut only 0.5 true epoch from it instead. Resolution phases stay fixed fractions of the total steps (so the 32 px tail keeps its 30% share), and the LR and Lookahead/EMA schedules stretch to the new step count, as in E008. Compiled shapes are unchanged, and error_on_recompile stays on.
E021	259343c	0.7529666666666667	6.035123381334415	True	no	no	discard	I032	Explore/exploit on the biggest FLOP block. This replaces I028, rebased on E016. Group 2 (128→384 at 15×15, then two 384→384 convs at 7×7) is about 51% of conv MACs, and its width also feeds group 3's first conv. On the E016 recipe, narrow only group 2 from 384 to 320 channels (a multiple of 64, so tensor-core tiles stay aligned). Group 1 (128), group 3 (512), Muon lr and wd, epochs, the resizing schedule and Lookahead/EMA stay unchanged. Recapture every resolution's graph in build, with error_on_recompile on.
E022	3439d82	0.7545333333333334	6.5475437376687	True	yes	yes	discard	I033	Exploit, as a time-neutral accuracy booster that would fund the trims. E016's post-mortem points to the BN-bias wd (bias lr = 64 × lr) as the active part. On the E016 recipe, cut weight decay to ×0.25 of the original on the SGD groups only (BN biases, whitening bias, head), leaving the Muon conv-filter wd at E016's ×0.5. First check in code whether the filters are renormalized; if they are, filter wd is inert and this is equivalent to a global cut. Nothing else changes. Recapture the graphs if wd is baked in as a constant.
E023	f438dbb	0.7538	6.198454349333285	True	yes	yes	keep	I036	Exploit: test the untested −0.5 point of the epoch dial. Apply it to the current tip: E017, or I033's recipe if I033 is kept. Cut 0.5 true epoch uniformly, for example about 9.5 → 9.0 true epochs; read the exact step count from the code first (H4.2.3). Resolution phases stay fixed fractions of total steps (40/30/30, so the 32 px tail keeps its 30% share). The LR and Lookahead/EMA schedules stretch to the new step count, as in E008/E020. Compiled shapes are unchanged and error_on_recompile stays on. Changing the step count also changes RNG consumption, so seeds 0–2 get re-rolled. So in the same session, run the recipe offline on held-out seeds 3–12 (benchmark.run --seed 3 --n 10). Base keep or discard on both numbers, not on the 3-seed mean alone. Do not re-roll RNG streams to chase a lucky seeds-0–2 draw.
E024	5add498	0.7510333333333333	6.0724223483315045	True	no	no	discard	I037	Explore W5's crux (proposed H2.3 child): the accuracy cost of the low-res phases depends on the final feature-map regime (3×3 vs 2×2 after group 3), not on pixel count. Feature-map sizes: 32→31/15/7/3, 28→27/13/6/3, 26→25/12/6/3, 24→23/11/5/2. E018 replaced the 28 px phase (3×3 regime) with 24 px (2×2 regime) and lost 0.68 pp. On the E017 recipe (or I033's if kept), change only the middle phase from 28 px to 26 px, keeping the 40/30/30% step split. The 26 px phase stays in the 3×3 regime with about 14% fewer pixels. Warm up and capture the 26 px graph in build with channels_last tensors from the training code path, and keep error_on_recompile on. Judge accuracy on held-out seeds 3–12 as well as on seeds 0–2.
E025	1223459	0.7556666666666667	6.201652335997399	True	yes	no	discard	I038	Exploit, as a time-neutral accuracy booster to fund trims (W1 crux: does a stronger or longer EMA add 0.3 pp?). E005 showed end-of-run averaging is worth about 1 pp on CIFAR-100, and E009 showed a lower final LR adds nothing on top of it, so averaging strength is the untuned part. On the E017 recipe (or I033's if kept), change only the Lookahead alpha ramp exponent from 3 to 2: alpha = 0.95**5 * (step/total)**2 instead of **3. The averaging then pulls harder from about mid-run on. Update frequency (every 5 steps), the final full copy, LR schedule, epochs and resolution all stay unchanged. Alpha is a per-step tensor or constant, so recapture the graphs if it is baked in. Judge on held-out seeds 3–12 as well as seeds 0–2. This proposes a new H1.3 child: the airbench96 averaging schedule is under-tuned for CIFAR-100 short runs.
E026	ac32d27	0.754	6.01723682666731	True	yes	yes	keep	I035	Explore. This is the single-factor version of E011, separating its two confounded changes. On the E016 recipe, change only the first phase: the first 15% of steps run at 20 px, followed by 24 px for 25%, 28 px for 30% and 32 px for 30%. The 32 px tail keeps its exact step count and position, and the LR and EMA schedules are unchanged. Warm up and capture the 20 px graph in build with channels_last tensors from the training code path, with error_on_recompile on.
E027	3735f58	0.7547	5.878078434667259	True	yes	yes	keep	I042	Exploit: spend the margin on the epoch dial, with a branch that depends on I038, which is still running. Base: the current tip E023 (9.0 true epochs), or I038's recipe if I038 is kept. Branch (a): if I038 is kept with a held-out seeds 3–12 gain of at least 0.15 pp, cut 0.5 true epoch to 8.5 true epochs (212 steps at batch 2000). This is E020's step count plus I038's averaging. Branch (b): otherwise, cut 0.25 true epoch to 8.75 true epochs (219 steps). In both branches the resolution phases stay fixed fractions of total steps (40/30/30, so the 32 px tail keeps its 30% share), and the LR and Lookahead/EMA schedules stretch to the new step count, as in E008/E020/E023. Compiled shapes are unchanged and error_on_recompile stays on. The step count changes RNG use, so in the same session also run held-out seeds 3–12 (benchmark.run --seed 3 --n 10). Keep only if seeds 0–2 clear 0.753 and the held-out mean is at least 0.7535. Do not re-roll RNG streams to chase a lucky seeds 0–2 draw.
E028	fcacfc6	0.7516666666666667	5.358429700664904	True	no	no	discard	I043	Explore/exploit: a FreezeOut-style backward truncation, a mechanism not yet tried in this loop. On the E023 tip, put group-1 conv filters (Muon) and the whitening bias plus group-1 BN params (SGD) in their own param groups. Their LR schedule follows the global triangle up to its peak, then decays linearly to 0 at 75% of total steps. The other groups keep their schedules. For the last 25% of steps, all of them at 32 px, detach group 1's output before group 2, and use a second compiled train step that does no group-1 or whitening backward and leaves group-1 params out of the Muon/SGD update. Group-1 BN still runs in train mode, and Lookahead still averages every param. Capture both 32 px step variants (full and truncated) in build with channels_last synthetic tensors, with error_on_recompile on. Back-of-envelope: group 1 is about 20% of conv MACs at the largest maps, so skipping its weight-grad and input-grad work saves about 14–18% of a 32 px step (including memory-bound BN/GELU backward), applied to about 2.0 s of tail time. Judge on held-out seeds 3–12 as well as seeds 0–2.
E029	a5370fb	0.7526	5.857741231331602	True	no	no	discard	I047	Exploit, a time-neutral accuracy booster. The tip's population mean is now below the bar (held-out 0.7526), so the next time cut needs one first. On the E027 tip (8.75 true epochs, 219 steps at batch 2000, 20/24/28/32 px at 15/25/30/30%), change only the LR warm-up length. First read the current warm-up and peak fraction from the code (airbench96 uses a peak at about 0.23 of steps). Halve it so the peak comes earlier, with the same peak value and a linear decay to the same 0.07 floor, for both the Muon group and the SGD groups. The Lookahead/EMA ramp, resolution phases, epochs, wd and LS all stay unchanged. If LR is a GPU tensor, no recapture is needed; otherwise recapture every resolution in build, with error_on_recompile on. Judge on held-out seeds 3–12 as well as seeds 0–2. Keep only if the held-out gain is at least 0.15 pp and seeds 0–2 clear 0.753.
E030	4782696	0.7492333333333333	5.857556962667634	True	no	no	discard	I048	Exploit, a time-neutral averaging booster in the direction opposite to E025 (which pulled harder and hurt by 0.27 pp held-out). D003 (C0024/C0025) points to the reset interval as the untuned Lookahead knob. On the E027 tip, change only the Lookahead update interval from every 5 to every 10 steps. Rescale the per-update retention so the total pull per step is unchanged (alpha_10 = alpha_5**2 at each ramp point, same exponent 3), and keep the final full copy. LR, epochs, resolution, wd and LS stay unchanged. Recapture the step graphs if the interval or alpha is baked in, with error_on_recompile on. Judge on held-out seeds 3–12 as well as seeds 0–2.
E031	4c9a872	0.7490333333333333	5.249974399999094	True	no	no	discard	I044	Explore: proposes a new H2.4 child. Drop easy examples using free per-sample losses from the main net, with no proxy. The committee vetoed I041 for the proxy's cost; this version adds no extra forward passes. On the E023 tip, change the compiled train step to return the per-sample loss (reduction='none', then mean for backward) and scatter it into a GPU loss buffer indexed by sample id. The buffer is created and reset in prepare. From epoch 2 onward, each epoch's shuffled order uses only the 90% of samples with the highest loss in the previous pass (torch.topk on the GPU, then the usual GPU shuffle). The batch stays at 2000 and the ragged remainder is dropped. Total steps fall from 225 to about 205 (1 + 8×0.9 epoch-equivalents). The resolution phases (40/30/30), LR and Lookahead/EMA schedules are fractions of the new total step count. Alternating flip still uses each sample's own pass parity. Warm up the modified step in build with channels_last tensors, with error_on_recompile on. Judge on held-out seeds 3–12 as well as seeds 0–2.
E032	eae7f1c	0.7483	5.872904692664936	True	no	no	discard	I049	Exploit, a time-neutral booster that targets the end-point, where averaging forms (E005 showed the late phase is worth about 1 pp). On the E027 tip, keep label smoothing at 0.3 for the first 85% of steps and set it to 0 for the final 15%, which lies entirely inside the 32 px phase. Pass LS as a GPU scalar into the compiled loss, or capture a second 32 px step variant in build, with error_on_recompile on. Nothing else changes. Judge on held-out seeds 3–12 as well as seeds 0–2.
E033	6dfaa6d	0.7536333333333334	5.691157987666277	True	yes	yes	keep	I050	Exploit and crux test (W1/W5: is early low resolution close to free?). Run it on the E027 tip, or on the tip plus any booster above that was kept with at least +0.15 pp held-out. Change only the resolution split from 20/24/28/32 px at 15/25/30/30% of steps to 30/10/30/30%. The 28 px and 32 px phases keep their exact step counts and positions, and the LR and Lookahead schedules are unchanged. The 20 px graph is already captured in build, and error_on_recompile stays on. Judge on held-out seeds 3–12 as well as seeds 0–2. Keep only if seeds 0–2 clear 0.753 and the held-out mean stays at or above 0.752 (the 40-seed official bar of 0.75 then has at least 0.2 pp of headroom).
E034	fa10c0e	0.7539	5.480649318664898	True	yes	yes	keep	I052	Exploit: stack the free lever (the freeze) with the cheapest accuracy booster (epochs). Start from the E027 tip and apply E028's freeze exactly as committed in fcacfc6. Group-1 conv filters, the whitening bias and group-1 BN params get their own param groups. Their LR follows the global triangle to its peak, then decays linearly to 0 at 75% of total steps. For the last 25% of steps, use the truncated compiled 32 px step: group-1 output detached, and no group-1 or whitening backward or update. Group-1 BN stays in train mode and Lookahead averages every param. Then change only the step count: 8.75 to 9.25 true epochs (about 231 steps at batch 2000). Read the exact count from the code. The resolution phases (20/24/28/32 at 15/25/30/30%), the freeze point (75%), and the LR and Lookahead schedules stay fixed fractions of the new total. Capture full and truncated 32 px variants in build with channels_last synthetic tensors, with error_on_recompile on. In the same session, run held-out seeds 3–12. Keep if seeds 0–2 ≥ 0.753 and held-out ≥ 0.7545. Do not re-roll RNG streams to chase seeds 0–2.
