exp	commit	accuracy	time	complete	feasible	improved	status	tag	description
E045	a129e7a	0.7574	5.208782923333881	True	yes	yes	discard	I040	Observational, on the E026 tip with no recipe change (replacing the stale I033, which assumed eager Muon on E021). During one scored run, sample board power and SM clock via NVML at >=10 Hz in a separate monitoring process launched outside the submission (no sleeps in submission code). Tag samples by phase (16 px, 24 px, 32 px) using logged CUDA-event timestamps. Report, per phase, the fraction of time at >=95% of the 400 W cap and the mean SM clock.
E046	2fda094	0.7552666666666666	4.955016229000951	True	yes	yes	keep	I054	On the E044 tip (bs 1536, compiled batched Muon on the 9 group convs plus the 576->100 head, renorm every 2+int(15*progress) steps, 2@16 + 2@24 + 4@32 px, 8.0 epochs), change only the schedule to 3@16 + 1@24 + 4@32 px, so epoch 2 moves from 24 px to 16 px. This is the E029/E040 near-miss moved onto the base that has margin. Keep the operator the same: flip + translate-2 at 32 px, then antialiased bilinear downsample, with AdaptiveMaxPool2d(1). The step count is unchanged, so LR, EMA, lookahead and renorm are unchanged. The 1536-batch 16 px shape is already warmed up in build. New tip only under the H4 rule.
E047	4cc3ae2	0.7558	4.962924929665557	True	yes	no	discard	I055	On the E044 tip, cut half of the 24 px phase using a step-indexed switch: 2@16 + 1.5@24 + 4@32 px, 7.5 total epochs. Rescale the LR warmup/decay, EMA, lookahead and renorm schedules to the new total step count, the same way the recipe already does for epoch changes. Change nothing else, and use only shapes that are already warmed up. This tests whether a fractional removal of a cheap mid-resolution epoch, which also removes Muon steps, trades better than swapping 24 px for 16 px.
E048	e6c8e93	0.7543	4.970598959667162	True	yes	no	discard	I056	Margin check on the E044 tip (head on Muon), with no recipe change. For the scored row, rerun E044 unchanged; this is the second variance sample on the current tip. In an untimed side script, import the arena submission and run it through the benchmark's own trial code (do not edit benchmark/) on seeds 3-10. Record per-seed accuracy and time. This calibrates whether E044's +0.32 pp is real before it gets spent on schedule cuts.
E049	cf3dec9	0.7557666666666666	4.94380181300221	True	yes	yes	discard	I057	On the E044 tip, change only the Muon learning rate of the classifier head group (the [100, 576] weight added in E044) from 0.24x to 0.5x of the filter Muon LR, i.e. 0.12 peak on the same schedule shape. Pass it as a separate 0-d GPU tensor so nothing recompiles. Keep the conv-filter Muon LR, momentum, NS steps and the head bias on SGD unchanged. The head's spectral-norm step size was copied from the conv filters untuned. Output layers usually want smaller normalized updates (muP-style), and the head has no renorm or wd to bound it.
E050	4cf6753	0.7525666666666667	4.827446718331582	True	no	no	discard	I058	On the E044 tip, narrow group 2 from 384 to 352 channels, which also shrinks group 3's first conv input. Muon handles the new filter shapes (re-batch the same-shape stacks). Recompile and warm up every train/eval shape and the Muon update in build. Change nothing else. This lever cuts FLOPs, so it should transfer to the 300 W PCIe judge better than per-step levers. Under SGD, 384->320 cost 0.115 pp per 1% (E017). Muon halved the epoch slope, so it may now trade at <=0.06 pp per 1%.
E051	867d10c	0.7527666666666667	4.949476163999255	True	no	no	discard	I059	On the E044 tip, change only the LR warmup length, halving it in steps for both the SGD and Muon groups, with the same peak and the same decay end point. Everything else is unchanged. With bs 1536 the run has only ~256 steps, and the warmup was rescaled from a schedule tuned for ~408 SGD steps. Muon's normalized updates need less warmup than high-LR SGD.
E052	4fd9ea5	0.7518	4.948155810333749	True	no	no	discard	I060	Observational, on the E044 tip, with no recipe change in the scored path. In an untimed side script (same build, one trial, seed 0), wrap each phase (16/24/32 px) with CUDA events. Using torch.profiler on ~20 steps per phase, split per-step time into data augmentation (flip + translate at 32 px + antialiased downsample), net fwd/bwd, SGD foreach step, compiled Muon update, lookahead/EMA, and GPU-idle gaps. Report wall time vs GPU-busy time per phase. For the scored row, rerun E044 unchanged; it doubles as a variance sample. This gates CUDA graphs (H2.12.1) and a low-res pre-downsampled data path.
E053	5a77f89	0.7524	4.857648593999329	True	no	no	discard	I062	On the E046 tip (bs 1536, 3@16 + 1@24 + 4@32 px, compiled Muon on 9 convs plus head), set torch._dynamo.config.automatic_dynamic_shapes=False and raise torch._dynamo.config.cache_size_limit (e.g. 64) so that each (resolution, batch) train shape (16/24/32 px at bs 1536, plus any partial last-batch shapes) compiles as its own static graph. Warm all of them up in build on synthetic data. Keep eval on a separate compiled function that is dynamic in the batch dimension (torch._dynamo.mark_dynamic on dim 0, or the existing eval path unchanged), so any B from 1 to 1024 never recompiles. In an untimed side check, verify eval for B in {1, 7, 1000, 1024} returns finite [B,100] logits in under 5 s with no recompile. Change no math, hyperparameters or schedule. Log per-phase epoch times.
E054	8f15cec	0.7519333333333333	4.732899295001213	True	no	no	discard	I063	On the static-shape tip (or on E046 if H2.14.1 fails), trim a quarter of the remaining 24 px bridge with a step-indexed switch: 3@16 + 0.75@24 + 4@32 px (7.75 epochs). Rescale the LR warmup/decay, EMA, lookahead and renorm schedules to the new total step count, exactly as E047 did. Change nothing else, and use only shapes already warmed up in build. This trim is half the size of H2.10.2's arm A on purpose: at ~0.03 pp per 1%, the ~0.15 pp margin only covers a ~2-3% trim, while arm A (-0.26 s) would be expected to land at ~0.7532, right on the gate.
E055	bb207dc			False	no	no	crash	I064	On the static-shape tip (or on E046 if that fails), replace AdaptiveMaxPool2d(1) with x.flatten(2).amax(dim=2), which is mathematically identical (Fable: it avoids slow atomic kernels). Recompile and warm up every train and eval shape in build. Change nothing else.
E056	6262ecd	0.7525333333333333	4.718397090332776	True	no	no	discard	I064	On the static-shape tip (or on E046 if that fails), replace AdaptiveMaxPool2d(1) with x.flatten(2).amax(dim=2), which is mathematically identical (Fable: it avoids slow atomic kernels). Recompile and warm up every train and eval shape in build. Change nothing else.
E057	625c132	0.7534333333333333	4.716619396664707	True	yes	yes	keep	I065	On the E046 tip (or on the static-shape tip if it is banked first), lower the LR floor of the Muon groups only (9 conv filter groups plus the head) from 0.07x to 0.05x of peak. Keep the SGD groups' floor, the warmup, the peak LR and the EMA/lookahead unchanged. Pass the value as the existing 0-d tensor schedule so nothing recompiles.
E058	09d6668	0.7522666666666666	4.747323206667109	True	no	no	discard	-	confirm rerun of E057 (H4 rule)
E059	d5d853a	0.7520666666666667	4.760971072331206	True	no	no	discard	I066	On the E046 tip, double the LR warmup length (0.23 -> 0.46 of the warmup fraction in steps) for both the SGD and Muon groups, keeping the same peak and the same decay end point. Change nothing else. This is the untested direction after E051, where halving the warmup cost ~0.2 pp.
E060	026a301	0.7526666666666667	4.674812873667785	True	no	no	discard	I061	On the E044 tip, cut only fixed timed overhead in prepare. Vectorize the dirac init over all 3x3 convs, and do the uint8->normalized conversion in one fused fp16 GPU op. Keep the whitening statistics on the same 5000 images, so the learned function is unchanged apart from numerics. Make sure all lazy CUDA/cuBLAS/cuDNN handles used in prepare are already initialized in build. Log the prepare and train split per trial. E004 tried this under the SGD power cap, where hidden CPU work cost nothing. In the current 5.2 s run, prepare's ~60 ms fixed cost is ~1% of time and is not overlapped with GPU-bound training.
E061	5a4e7e6	0.7523	4.70098303166742	True	no	no	discard	I068	On the E046 tip, train the whitening-stem bias only for the first 20% of steps and freeze it after that (as in hiverge and Fable). Set its LR to 0 from step 0.2*total, either through its own 0-d LR tensor or by masking it in the SGD foreach step, so nothing recompiles. Everything else is unchanged. This tests whether the 64x-LR bias groups add late-phase noise in the ~256-step regime.
E062	8d69aa4	0.7532666666666666	4.680445058669041	True	yes	yes	keep	I069	Base: E060 code, which is the E057 tip (static shapes, max(dim).values pool, Muon floor 0.05) plus E060's vectorized dirac init and fused fp16 normalization in prepare. Both prepare changes are math-neutral, so the result still belongs to the pooled family, which E060 brings to 8 runs with a mean of 0.7531. Change only the head's Muon learning rate: set it to 0.5x the filter Muon LR (0.12 peak, same schedule shape and floor) as its own 0-d GPU tensor, so nothing recompiles. Leave everything else unchanged. Score it twice. Instrumentation only: log the submission source hash and a per-seed checksum of the final weights and BN buffers (for H4.4.1).
E063	6a85266	0.7545666666666667	4.668809619334449	True	yes	yes	keep	-	I069 second scoring (E062 code)
E064	a1aef09	0.7553333333333333	4.7132659449998755	True	yes	no	discard	I071	Base: E060 code. Change only the schedule to E047's 2@16 + 1.5@24 + 4@32 px: 7.5 total epochs with step-indexed resolution switches, and LR warmup/decay, the Muon floor, EMA, lookahead and the renorm cadence all rescaled to the new total step count, as E047 did. All three bs-1536 static shapes are already warmed up in build. Score it twice. This is the equal-time reshuffle against the 3@16 + 1@24 swap that the current tip uses.
E065	0f786de	0.7551	4.709483802667819	True	yes	no	discard	-	I071 second scoring (E064 code a1aef09)
E066	83c1fc1	0.757	4.6644082026662845	True	yes	yes	discard	I072	Base: E060 code. The change is Inductor kernel tuning only, aimed at the fused BN/GELU/elementwise Triton kernels, which take about 30% of GPU time (E052). Set torch._inductor.config.coordinate_descent_tuning=True and torch._inductor.config.max_autotune_pointwise=True (the net already compiles with max-autotune) before compiling the net, then recompile and warm up every static train shape plus the eval path in build. Log build time; it must stay under 600 s, and if tuning would exceed that, drop max_autotune_pointwise first. The math is unchanged apart from reduction order. Smoke-test that the loss stays finite for 10 steps before scoring.
E067	8146343	0.7532666666666666	4.674721518997103	True	yes	no	discard	I073	Observational. Run an untimed side script on the E060 code with the same build and one trial on seed 0. Use torch.profiler for about 20 steps of the 32 px phase at bs 1536, and also for 20 steps at 24 px. Per conv layer, record the forward and backward kernel list, the time share of Triton elementwise/reduction kernels against cuDNN conv kernels, and the bytes read and written per BN/GELU kernel relative to the fp16 activation size, i.e. the number of passes over the activation. In the same profile, record per-layer conv time for group 2 (input for H2.13.2). For the scored row, rerun the E060 code unchanged as an extra family variance sample. Log the per-seed weight checksums (H4.4.1) and the cuDNN kernel names per layer and shape (H4.5.1).
E068	766d5bf	0.7578666666666667	4.669751325670707	True	yes	no	keep	I074	Base: E060 code. Apply Fable's tail at equal total steps. The Muon and SGD LR decay reaches its floor (0.05x for Muon, unchanged for SGD) about 4% of steps early and holds there until the end. Over the last ~8 steps, update a light final EMA every 4 steps (ema = 0.7*ema + 0.3*net with torch._foreach_lerp_, buffers allocated in build and reset in prepare). It replaces the end of the lookahead-EMA ramp, and evaluation uses those EMA weights, with BN buffers copied from the net. Change nothing else, and score it twice.
E069	7e85b84	0.7544	4.708412266333956	True	yes	no	discard	-	I074 second scoring (E068 code 766d5bf)
E070	e945ed5	0.7542	4.584103510331867	True	yes	yes	keep	I076	Base: E064 code (a1aef09), which is the E062 tip (static shapes, max(dim).values pool, Muon floor 0.05, vectorized dirac, fused fp16 normalization, head Muon lr 0.5x) running E047's 2@16 + 1.5@24 + 4@32 schedule. Change only the length of the 24 px phase, from 1.5 to 1.25 epochs: 2@16 + 1.25@24 + 4@32 px, 7.25 total epochs, with step-indexed switches. Rescale the LR warmup/decay, Muon floor, EMA, lookahead and renorm cadence to the new total step count, the same way E047/E064 did. All shapes are already warmed up in build. Score it twice and log the source hash.
E071	59f3ec6	0.7532333333333333	4.58175478533182	True	yes	yes	keep	-	I076 second scoring (E070 code e945ed5)
E072	89fb0ce	0.7541666666666667	4.593888425998254	True	yes	no	discard	I077	Base: E064 code (a1aef09; 2@16 + 1.5@24 + 4@32 on the E062 tip). Trim the 16 px phase instead of the bridge: 1.5@16 + 1.5@24 + 4@32 px, 7.0 total epochs, with step-indexed switches. Rescale LR warmup/decay, Muon floor, EMA, lookahead and renorm to the new total step count as in E064. The warmup stays the same fraction of steps. Change nothing else and score it twice. This is the sister arm of the 24 px trim at about equal time. E064/E065 versus the tip showed that 24 px time buys accuracy at ~0.13 pp per 1% and 16 px time does not, so the 16 px phase may be the cheapest one to cut.
E073	9796cfb	0.7523	4.584952502669087	True	no	no	discard	-	I077 second scoring (E072 code 89fb0ce)
E074	0ddd61b	0.7557	4.606903849332109	True	yes	no	discard	I079	Base: E062 code (head Muon lr 0.5x). Add decoupled weight decay to the Muon head weight [100, 576] only, at hiverge's bs-1536 scale: each step w -= lr_head_t * wd * w, with wd chosen so that wd*lr is about 1.6e-3 at peak, applied inside the compiled Muon update through a 0-d tensor so nothing recompiles. Leave the head bias, the filters and all schedules unchanged. Score it twice.
E075	02af2e8	0.7531666666666667	4.594112662998668	True	yes	no	discard	-	I079 second scoring (E074 code 0ddd61b)
E076	52dc644	0.7532333333333333	4.588309487667478	True	yes	no	discard	I085	Math-neutral. On the current tip code (the tail variant if banked, otherwise E070), add a full synthetic dress-rehearsal trial to build. Run prepare + the complete train loop on random uint8 data of the real shape: every phase, the resolution switches, the renorm on/off variants, the tail's floor-hold, the lookahead stop, the final-EMA foreach_lerp, the BN buffer copy, and eval at B=1024 and B=1. Then discard all state; prepare still resets everything. This warms the allocator pool, cuBLAS workspaces, cuDNN plans and any lazily compiled tail or EMA kernels that may currently first run inside timed trial 1. Log per-trial prepare/train times. Build stays well under 600 s (one synthetic trial is ~5 s). Score once.
E077	772c536	0.7505666666666666	4.583444958664283	True	no	no	discard	I086	On the verified tail tip, change only the head's Muon lr multiplier from 0.5x to 0.4x of the filter lr. This is close to the spectral-condition value sqrt(100/576) ≈ 0.42. Set it through the head's own 0-d tensor so nothing recompiles. Decide with an untimed off-seed A/B on seeds 3-10 (tip vs 0.4x) plus two scored runs.
E078	bc2ffe6	0.7502333333333333	4.588437731334125	True	no	no	discard	I087	Explore. On the verified tail tip, replace label smoothing 0.3 with MaxSup: loss = CE(z, y) + 0.3*(max_k z_k - mean_k z_k), one fused op on the fp32-cast [B,100] logits inside the compiled train graph. Before scoring, smoke-test 10 steps for a finite loss under compile at every resolution. Change nothing else. Decide with an untimed off-seed run on seeds 3-10 plus two scored runs.
E079	3d7548e	0.7521666666666667	4.628613853000085	True	no	no	discard	I088	Tail ablation on the verified tail tip, arm (a) only: remove the final EMA, so eval uses the net weights. Keep the floor-hold and the lookahead stop exactly as they are. Change nothing else. Run one scored run plus an untimed off-seed run of seeds 3-10, compared against the tip's off-seed mean. Arm (b), removing only the floor-hold, is queued only if arm (a) costs less than 0.05 pp.
E080	7657845	0.7542	4.583989864001826	True	yes	no	discard	I081	Observational, untimed. On the E062 tip code, build three variants with group-2 widths 384, 352 and 320 (recompiled and warmed up in a side script). Use CUDA events and torch.profiler on 20 steps each at 32 px and 24 px, bs 1536. Record per-layer conv fwd/bwd time, elementwise time for group 2 and group 3's conv1, and total step time and energy (NVML). For the scored row, rerun the E062 code unchanged as a fourth tip-family variance sample (log weight checksums and source hash).
E081	2940f3c	0.7506666666666667	4.608474010667123	True	no	no	discard	I089	Base: the current tip, E070 code (e945ed5). It is 2@16 + 1.25@24 + 4@32 px at 7.25 ep and already contains the Fable tail, as the I083 drop note confirms. Precondition, untimed: log the source hash and a one-line diff against e945ed5, so this run joins the right family (H4.2.4). Change only the final-EMA window. Start the final EMA 20 steps before the end instead of 8. Keep the cadence (every 4 steps) and the lerp (ema = 0.7*ema + 0.3*net via foreach_lerp), so there are ~5 updates instead of ~2. Initialize the EMA from the net weights at the window start, using buffers allocated in build and reset in prepare. Leave the floor-hold point (~96% of steps), the lookahead stop point, eval on the EMA weights and the BN buffers copied from the net all unchanged. This is a host-side step-index change only, so nothing new compiles. Decide with an untimed off-seed run on seeds 3-10. In the same session, rerun the tip off-seed so the baseline (0.7530) gets a second sample. Add two scored runs. Instrumentation for H4.4.1/H4.5.1: log per-seed final-weight checksums and the cuDNN conv kernel names per (layer, shape).
E082	8297be7	0.48736666666666667	4.5899804606645676	True	no	no	discard	I091	Step 1 is free: read the filter-renorm code in the tip (E070 code) and log whether the target norm is constant or already decays. If it already decays, retire H9.1.1 and do not run this. Otherwise, change only the renorm target so it decays linearly from the tip's current value c to 0.157c over training, matching hiverge's 0.5012->0.0786 ratio. Compute it from progress inside the compiled Muon update as a 0-d GPU tensor, so nothing recompiles, and apply it on the existing renorm cadence (every 2+int(15*progress) steps). LR, floor, tail and everything else stay unchanged. Decide with an off-seed run on seeds 3-10 plus two scored runs.
E083	f610c4c	0.7521333333333333	4.58503004200126	True	no	no	discard	I090	Sibling arm of the EMA-window idea, sharing its off-seed tip baseline. Base: E070 code. Replace the final exponential EMA with a LAWA-style uniform average: take a snapshot of the net weights every 4 steps over the last 20 steps (5 snapshots), keep them as a running mean via foreach_lerp with weight 1/k for the k-th snapshot, and evaluate on the mean with the BN buffers copied from the net. The floor-hold and lookahead stop stay unchanged. Buffers are allocated in build and reset in prepare, and nothing recompiles. Change nothing else. Decide with an off-seed run on seeds 3-10 plus two scored runs, against the same tip off-seed baseline as the EMA-window idea.
E084	3e30852	0.7560333333333333	4.699097051331289	True	yes	no	discard	I092	Base: E070 code. Keep bs 1536 for the 16 and 24 px phases, and run the 32 px phase (4 epochs) at bs 1024. Index LR warmup/decay, the floor-hold, the final-EMA window, lookahead and the renorm cadence by samples seen. The final-EMA window and lookahead stop stay at the same sample count as in the tip. Scale the SGD groups (BN biases, whitening bias, head bias) per phase by the E010 kilostep rule, and leave Muon lr and momentum unchanged. Compile the bs-1024 32 px train shape as a static graph and warm it up in build on synthetic data. Change nothing else. Pre-register the time cost: about +66 steps at 32 px. Decide with an off-seed run on seeds 3-10 plus two scored runs.
E085	e5b6566	0.7550333333333333	4.703471908998229	True	yes	no	discard	-	I092 second scoring (E084 code 3e30852)
E086	749bdce	0.7532333333333333	4.561229282332836	True	yes	yes	keep	I093	Math-neutral. Base: E070 code. In build, allocate an empty pinned host buffer (torch.empty(..., dtype=uint8, pin_memory=True)) and a GPU destination tensor of the training set's shape, with no real data. In prepare, copy the uint8 training array into the pinned buffer, upload it with non_blocking=True into the preallocated GPU tensor, and sync once before normalization. Change nothing else. Log per-trial prepare and train times. Score twice; decide on the per-trial prepare logs, not on the totals.
E087	934169c	0.7532333333333333	4.567785453664935	True	yes	no	discard	-	I093 second scoring (E086 code 749bdce)
