exp	commit	accuracy	time	complete	feasible	improved	status	tag	description
E118	28bd7c8	0.7520333333333333	4.264140286667195	True	no	no	discard	I129	Bank the E116 late freeze under the H4.9 acceptance rule. The code is E116 unchanged (82e6219: stem and group 1 detached from 85% of samples, all renorm x freeze variants warmed in build). Step 1, untimed: run E116 through the benchmark's own trial code on seeds 103-202 in one fresh process, which brings E116 to ~198 distinct trajectories. Compare its pooled mean with the pooled 200-trajectory E100 baseline (E113 arms A+B, H4.6.2; SE ~0.026 pp). Step 2: score E116 code up to 3 times. Stop at the first scored row >= 0.753. Log per-trial prepare/train times in every scored run to explain the 4.306 s scored vs 4.263 s dev gap (e.g. trial-1 first use of the frozen variant). Bank E116 as the tip only if its population mean is >= 0.7518 and a scored row >= 0.753 appears within 3 attempts. Otherwise E100 stays the tip and the freeze needs funding (I_b / H10.1.2).
E119	cf3304b	0.7530666666666667	4.261854620667388	True	yes	yes	keep	-	I129 attempt 2 (E116 code 82e6219)
E120	aa84ed5	0.7545	4.354074129000462	True	yes	no	discard	I130	Dose-response point at a later freeze. Base: E116 code. Change only the freeze point of stem + group 1, from 85% to 92% of samples. That point is still inside the 32 px / bs-1024 phase and covers the floor-hold and the final 8-step EMA. Keep every graph and Muon-stack variant as in E116, warmed in build. Before scoring, verify with TORCH_LOGS=recompiles on a 2-trial dev run that nothing recompiles after build. Accuracy is decided untimed on seeds 3-102 in one fresh process against the pooled 200-trajectory E100 baseline. Add two distinct scored samples with per-trial time logs.
E121	c826528	0.7516333333333334	4.2540823923336575	True	no	no	discard	I131	Measure the update-count rate before using it to fund the freeze. Untimed, through the benchmark trial code: run E104 code (594b48e: bs 1024 in the 16/24 px phases as well, ~+53 steps, everything else as E100) on seeds 3-102 in one fresh process. Compare it with the pooled 200-trajectory E100 baseline (SE ~0.032). No scored change is needed for the decision. For the scored row, rerun the current tip unchanged; if E116 is banked, that rerun adds a distinct E116 gate sample.
E122	d9a997f	0.7505000000000001	4.260942006001035	True	no	no	discard	I132	Untimed per-group backward energy profile on E100 at 32 px / bs 1024 (static graphs, warmed in build), with no change to the scored path. Use CUDA events plus torch.profiler over 20 steps for the full step and for the E116 detached variant. Attribute backward kernel time to stem, group 1, group 2, group 3 and the head (conv dgrad/wgrad, BN/GELU backward reductions and applies). Record bytes read and written per BN/GELU backward kernel and NVML energy per step. Also read the logged cuDNN kernel tile shapes for the group-1 convs, which is the free first step of H2.21.2. For the scored row, rerun the current tip unchanged (an extra distinct gate sample).
E123	9d4242a	0.7516333333333334	4.257923471998462	True	no	no	discard	I114	Explore depth cuts, untimed first. In a side script on E090 code, build two variants with recompile and warm-up: (a) group-1 conv3 removed and (b) group-3 conv3 removed. Muon stacks are re-batched for the changed filter counts. Measure per-step time with CUDA events and NVML energy over 20 steps each at 32 px bs 1024, 28 px bs 1024, 24 px bs 1536 and 16 px bs 1536, then project total run time over the E090 schedule. For the scored row, rerun E090 unchanged (another distinct tip sample). Score a depth variant later only if its projection shows >=6%.
E124	f581844	0.744	4.264321459665855	True	no	no	discard	I124	Multi-sample augmentation in the 32 px phase, at equal compute. Base: E100 code. In the 2.75-epoch 32 px phase only (bs 1024), build each batch from 512 unique images, drawn as the next 512 of the epoch permutation, times 2 augmentation draws. Copy A keeps the existing alternating-flip state and its own translate offsets. Copy B gets the opposite flip and independently drawn translate offsets. Batch shape, step count, LR/EMA/tail indexing and the compiled graphs are unchanged; only the gather indices and the augmentation parameters differ. The 32 px phase then covers ~1.375 unique epochs instead of 2.75. The 16/24/28 px phases are unchanged. Smoke-test that the duplicated indices and the flip parity are correct on one batch. Decide on off-seed seeds 3-26 in >=3 fresh processes against E106, plus one scored sample, and a second only if off-seed >= +0.05 pp.
E125	774342a	0.7513	4.118631916998614	True	no	no	discard	I133	Deeper late freeze. Base: E116 code (stem + group 1 detached from 85%). Change only one thing: from 92% of samples, also detach group 2's output, so there is no backward into stem, group 1 or group 2, and group-2 filters/BN params drop out of the Muon stacks and the SGD foreach. Add this as a third static 32 px / bs-1024 graph variant plus a matching Muon-update variant. Warm every renorm x freeze-level combination in build, and verify with TORCH_LOGS=recompiles on a 2-trial dev run. Accuracy is decided untimed on seeds 3-102 in one fresh process against the E116 large-seed vector, pooled with the I_a extension if it has run. Add one scored sample, and a second only if the loss is <= 0.06 pp.
E126	135904c	0.7474333333333334	4.172597230009463	True	no	no	discard	I135	Revert the tip's bs-1024 late phases. Base: E116 code (82e6219). Precondition, free (H4.2.4): log the source hash and a one-line diff against 82e6219. Change only the batch size of the 28 px and 32 px phases, from 1024 to 1536. Keep the sample-indexed schedule (LR warmup/decay, floor-hold, renorm cadence and the 85% freeze point all in samples). Rescale the SGD groups (BN biases, whitening bias, head bias) in those phases by the kilostep rule. Keep the Muon lr x1.25 at 32 px and momentum 0.6. Keep the final-EMA window and lookahead stop pinned to the last 8 steps. Compile static bs-1536 28/32 px graphs and warm every freeze x renorm x whiten-bias-grad variant for the new shapes in build. Verify on a 2-trial dev run with TORCH_LOGS=recompiles that nothing compiles after build. Accuracy is decided untimed through the benchmark trial code on seeds 3-102 in one fresh process, against the pooled ~198-trajectory E116 baseline (SE ~0.032). Add one scored run with per-trial prepare/train logs to measure the real time.
E127	4e9d1fd	0.7484666666666666	3.964941650662998	True	no	no	discard	I136	Depth cut arm (a), 2/3/3. Base: E116 code. Remove group-1 conv3 (with its BN and GELU) so group 1 is conv1 plus a single-conv residual branch. Re-batch the Muon filter stacks for the changed counts, including the frozen-group-1 update variant. Rebuild the dirac init over the remaining convs. Warm every (resolution, batch) x freeze x renorm x whiten-bias-grad variant in build, and check on a 2-trial dev run with TORCH_LOGS=recompiles that nothing compiles after build. Change nothing else: schedule, 85% freeze, tail. Before deciding, run an untimed per-step profile of the modified net at all four shapes (with the frozen 32 px variant) and project total time over the E116 schedule, because E123's -7.6% was measured with the freeze off. Accuracy is decided untimed on seeds 3-102 in one fresh process against the pooled ~198-trajectory E116 baseline. Score once only if the loss is <= 0.35 pp.
E128	2d66d4b	0.7533333333333333	4.265292513669313	True	yes	no	discard	I137	Measure the local yardstick on the tip. Base: E116 code. Two untimed arms through the benchmark trial code, each on seeds 3-102 in its own fresh process: (A) 32 px phase -0.25 epoch (2.5 instead of 2.75), (B) 32 px phase +0.25 epoch (3.0). Index everything by samples (LR warmup/decay, floor-hold, renorm cadence, Muon x1.25 phase factor). Keep the freeze at 85% of the new total samples and the final-EMA/lookahead window pinned to the last 8 steps. All shapes are already static and warmed. Compare each arm with the pooled ~198-trajectory E116 baseline. For the scored row, rerun the E116 tip unchanged, which adds another distinct gate sample (H4.9.1).
E129	71f50ae	0.7532666666666666	4.263891366664514	True	yes	no	discard	I138	FreezeOut-style anneal before the 85% freeze, arm (a) only. Base: E116 code. Over 75%-85% of samples, ramp the LR multiplier of the group-1 filters (Muon) and the stem/group-1 BN params (SGD) linearly from 1 to 0, then detach at 85% exactly as now. Use separate 0-d LR tensors for the group-1 Muon stack and the group-1 SGD group, written host-side so nothing recompiles; if the group-1 filters currently share a stacked Muon update with others, scale their slice by a 0-d per-stack factor. All other groups, the schedule and the tail are unchanged. Time is unchanged. Accuracy is decided untimed on seeds 3-102 in one fresh process against the pooled ~198-trajectory E116 baseline.
E130	f9b5b7d	0.7456333333333334	3.994926608997048	True	no	no	discard	I139	Depth cut arm (b), 3/3/2. Base: E116 code. Remove group-3 conv3 (with its BN and GELU) so group 3 is conv1 plus a single-conv residual branch. Re-batch the Muon stacks, rebuild the dirac init, warm every shape x freeze x renorm variant in build, and check with a TORCH_LOGS=recompiles dev run. Change nothing else. Run an untimed per-step profile with the freeze on and project total time over the E116 schedule. Accuracy is decided untimed on seeds 3-102 in one fresh process against the pooled E116 baseline. Run this after arm (a), so that if both arms qualify they can be compared at equal projected saving.
E131	2add8b4	0.7492	4.299654272331584	True	no	no	discard	I134	Augmentation strength under Muon. Base: E100 code. In the 28 and 32 px phases only, raise the translate magnitude from 2 to 4 px (same reflect padding and the same fused GPU op; the pad width is a host-side constant per phase). If the augment op is compiled, warm both pad variants in build. The 16/24 px phases, flip, LS and everything else stay unchanged. Smoke-test that one batch of translated images is in range and shape-correct. Decide untimed on seeds 3-102 in one fresh process against the pooled 200-trajectory E100 baseline. Add one scored sample, and a second only if the gain is >= +0.05 pp.
E132	fe9a884	0.7512666666666666	4.129220121336402	True	no	no	discard	I141	Trim the 16 px phase on the tip. Base: E116 code (82e6219). Precondition, free: log the source hash and a one-line diff against 82e6219. Change only the schedule, from 2@16 + 1.25@24 + 1.25@28 + 2.75@32 to 1.5@16 + 1.25@24 + 1.25@28 + 2.75@32 (6.75 epochs), with switches indexed by samples. Rescale LR warmup/decay, the floor-hold and the renorm cadence to the new total, as the earlier trims (E070/E088) did. Two anchors stay where they are instead of being rescaled: (a) the whitening-bias detach keeps its position inside the 24 px phase, ~0.97 epoch after the 24 px switch. Plain 41% rescaling would push it into the 28 px phase, where the grad variant is not warmed. (b) The stem + group-1 freeze keeps the same number of frozen samples before the end (~1.09 epochs), so the time saving comes only from the 16 px trim. The final-EMA/lookahead window stays pinned to the last 8 steps. All shapes and variants are already warmed; check with TORCH_LOGS=recompiles on a 2-trial dev run. Accuracy is decided untimed on seeds 3-102 in one fresh process against the pooled ~198-trajectory E116 baseline (SE ~0.032). Add one scored run with per-trial prepare/train logs.
E133	ee8a1f7	0.755	4.190465800997724	True	yes	yes	discard	I142	Dose-response of the stem + group-1 freeze at 80% of samples. Base: E116 code. Precondition, free: source hash plus a diff against 82e6219. Change only the freeze point, from 85% to 80% of samples. It stays inside the 32 px / bs-1024 phase, which starts at ~62%. Every freeze x renorm graph and Muon-stack variant is reused unchanged from E116 (already warmed); confirm no recompiles on a 2-trial TORCH_LOGS=recompiles dev run. Accuracy is decided untimed on seeds 3-102 in one fresh process against the pooled ~198-trajectory E116 baseline. Add one scored run with per-trial logs to measure the real saving. Run a 75% arm only if the 85->80 marginal rate comes in at ≤0.04 pp per 1%.
E134	e87b135	0.7494999999999999	4.20788672833199	True	no	no	discard	I143	Early bs 2048 with the warmup fixed in steps. Base: E116 code. Run the 16 px and 24 px phases at bs 2048 instead of 1536. Keep the LR warmup at the tip's step count, not its sample count, which removes E043's warmup confound. Decay, floor-hold, renorm cadence, whitening-bias detach (~41%) and the 85% freeze stay sample-indexed. Scale the SGD groups (BN biases, whitening bias, head bias) in those phases by the kilostep rule; Muon lr and momentum are unchanged. The 28/32 px phases and the tail are untouched. Compile static bs-2048 16/24 px graphs plus both whiten-bias-grad variants, warm them in build, and verify no recompiles on a 2-trial dev run. Accuracy is decided untimed on seeds 3-102 in one fresh process against the pooled E116 baseline. Add one scored run with per-trial logs.
E135	fff8046	0.7506333333333334	4.23890251367023	True	no	no	discard	I140	Lookahead removal re-measured on the large-seed instrument, which gates H9.2.1. Base: E116 code. Remove the lookahead-EMA entirely: the net trains on its own weights; its buffers and foreach kernels are dropped from build and the step loop. Keep the floor-hold, the final 8-step EMA (lerp 0.3 every 4 steps), eval on the EMA weights with BN buffers from the net, and the 85% freeze. Change nothing else. Accuracy is decided untimed on seeds 3-102 in one fresh process against the pooled ~198-trajectory E116 baseline. Add one scored run with per-trial logs, because the expected time saving is inside single-run noise.
E136	a21b318	0.7525666666666667	4.16090989333073	True	no	no	discard	I147	Confound ablation of E126, which may also turn up a -2% time lever. Base: E116 code (82e6219). Precondition, free: log the source hash and a diff against 82e6219. Run the 28 and 32 px phases at bs 1536 instead of 1024, with two differences from E126: (1) the SGD groups (BN biases, whitening bias, head bias) keep their bs-1024 per-step values in those phases, with no kilostep rescale; (2) the final-EMA window and the lookahead stop are pinned to the tip's sample count (~8192 samples, i.e. the last ~5 steps at bs 1536, final EMA ~2 updates spaced to cover the same samples). LR warmup/decay, the floor-hold, the renorm cadence, the 85% freeze and Muon x1.25 at 32 px stay sample-indexed; Muon lr and momentum are unchanged. Reuse E126's warmed bs-1536 28/32 px graphs (every freeze x renorm variant) and verify no recompiles on a 2-trial TORCH_LOGS=recompiles dev run. Accuracy is decided untimed on seeds 3-102 in one fresh process against the pooled ~198-trajectory E116 baseline (SE ~0.032), with an E126 same-seed comparison. Add one scored run with per-trial logs.
E137	0ee6466	0.7534	4.267492322333662	True	yes	no	keep	I148	Weaker late augmentation. Base: E116 code. In the 28 and 32 px phases only, reduce the translate magnitude from 2 to 1 px. Keep the same reflect-pad fused GPU op with the pad width as a host-side per-phase constant, and keep the alternating flip. The 16/24 px phases, LS, the schedule, the freeze and the tail are unchanged. If the augment op is compiled, warm the pad-1 variant in build and check on a 2-trial dev run that nothing recompiles. Smoke-test one batch for range and shape. Accuracy is decided untimed on seeds 3-102 in one fresh process against the pooled E116 baseline. Add one scored run. Translate 0 is a follow-up only if translate 1 gains ≥+0.04 pp.
E138	d5b98bd	0.7525333333333333	4.2637230380011415	True	no	no	discard	I149	Re-screen label smoothing at population level under Muon. Base: E116 code. Change only the label-smoothing constant from 0.3 to 0.2, a loss constant inside the compiled train graph. Re-warm the graphs in build if the constant is baked in, and verify no recompiles on a dev run. Nothing else changes. Accuracy is decided untimed on seeds 3-102 in one fresh process against the pooled E116 baseline. Add one scored run. E037 (LS 0.2, 3 seeds, SE ~0.2 pp) could not exclude ±0.3 pp; tuned Muon CIFAR recipes use LS ~0.09.
E139	f3d0daa	0.7539	4.266807200328913	True	yes	yes	keep	I150	The SGD multiplier on the BN biases was inherited from the SGD era and never re-tested under Muon. Base: E116 code. Change only the LR multiplier of the BN-bias SGD group from 64x to 32x, through its 0-d LR tensor or a host constant so nothing recompiles. The whitening-stem bias (E093 showed it is fragile), the head bias, the warmup and the Muon groups are unchanged. Accuracy is decided untimed on seeds 3-102 in one fresh process against the pooled E116 baseline. Add one scored run.
E140	4f70e20	0.7255	3.7855611666697464	True	no	no	discard	I151	Structural early-stage redesign, profiled untimed before any accuracy run. Base: E116 code. Build three variants in a side script: (a) group 1's max-pool moved from after conv3 to after conv1, so the residual conv2/conv3 run at 15x15x128 instead of 31x31x128; (b) group-1 width 96 instead of 128, with group-2 conv1 input 96 and Muon stacks plus dirac init re-batched; (c) both. Compile and warm every (resolution, batch) x freeze x renorm x whiten-bias-grad shape. Measure ms/step and NVML energy over 20 steps per shape (16/24 px bs 1536, 28/32 px bs 1024, frozen 32 px variant), and project total time over the E116 schedule. Score at 100 seeds against the pooled E116 baseline only the variants projecting ≥8% saving, best projected first. Bar: loss ≤0.044 pp per 1% (fundable by 32 px re-spend). For the scored row, rerun E116 unchanged unless a variant qualifies.
