exp	commit	accuracy	time	complete	feasible	improved	status	tag	description
E058	fb3f626	0.7537333333333334	4.696067019664042	True	yes	yes	keep	I076	FreezeOut-style late freeze of block 1. On the tip (E052, or I072's successor if kept), make one change. For the last 20% of training samples, from 5.4 epochs on, use a third 32 px train-step graph variant in which block 1's output is detached. Its conv filters and BN affine params get no gradient, but block 1 still runs in train mode, so BN running stats keep updating. Pair it with a second compiled Muon-step variant that excludes the 128x1152 block-1 shape group. The backward then skips block 1's wgrad and dgrad and block 2's first-conv dgrad. Pick the variant in Python by sample count, with no data-dependent branch in the graph. Lookahead still blends block 1 as now: the slow weights keep converging to the frozen fast weights. The SGD group skips block-1 BN biases (zero grad) through the same variant flag. In build(), warm up the new train variant and the new Muon variant, including every partial-batch shape at the 5.4-epoch switch, with channels_last tensors in the exact timed layout (E035). Run debug_nan.py on the new graph and compare trial-0 with later-trial train times.
E059	23aca65	0.7476333333333334	4.664716400334631	True	no	no	discard	I077	Give the 100-way head an orthogonalized update. On the tip (E052, or I072's successor if kept), make one change: move the [100, 576] head weight out of the SGD group into Muon. Add it as its own shape group in the batched compiled Muon step: Nesterov momentum 0.8, NS3 with the same coefficients, sqrt(max(1,out/in)) = 1. Do NOT apply the weight-norm projection to the head, because row norms set the logit scale. Keep the head's current decoupled per-step decay (the same lr*wd product as now). Set its Muon lr so that the first-step update RMS matches the current SGD head's (x2) first-step update RMS, measured in drafts/ on real batch 0 of seed 0, and log that number. Use the same schedule multiplier as the Muon group. The head bias, if present, stays in SGD. In build(), warm up the new Muon graph on synthetic tensors and run debug_nan.py under max-autotune-no-cudagraphs.
E060	10c865e	0.7523333333333333	4.718076077998073	True	no	no	discard	I078	Test whether the early whitening-bias freeze limits the cheap curriculum. On the tip (E052, or I072's successor if kept), make one change: keep training the whitening-conv bias until the end of the 28 px stage (3.5 epochs, sample 175000) instead of until the end of epoch 1. This needs a 28 px train-step variant WITH whitening-bias grad, compiled and warmed up in build() (full batch and every partial shape at the 1.5- and 3.5-epoch switches), with channels_last tensors in the exact timed layout (E035). The 32 px stage keeps the frozen-bias graph. Lr for the whitening bias follows its existing schedule. Run debug_nan.py on the new graph and compare trial-0 with later-trial train times.
E061	77e1f60	0.7526333333333334	4.56531021566722	True	no	no	discard	I079	Move the block-1 freeze earlier, from 0.8 to 0.7 of training samples. The tip is E058 (commit fb3f626): bs 1536; 20 px for epochs 0-1.5 and 28 px for 1.5-3.5, both without translate; 32 px with translate-2 for 3.5-6.75; jitter in every stage; SGD-group lr x1.5; head lr x2 with wd halved; Muon lr 0.16, mom 0.8, NS3; lookahead 0.97^5; whitening bias trained in epoch 1 only; block 1 frozen from 5.4 epochs. If I077 or I078 is kept first, use that successor. Make one change: switch to the existing block-1-frozen graph pair 0.675 epoch earlier, at sample 236250 (4.725 epochs) instead of 270000. That pair is the 32 px train step with block 1's output detached, plus the Muon variant without the 128x1152 group, with block-1 BN biases skipped in the SGD group. Block 1 still runs forward in train mode, so its BN running stats keep updating, and lookahead keeps blending it. Total epochs, stage boundaries, bs, the sample stream and every schedule stay unchanged. The switch falls inside step ~153, so split that straddling step into the two partial shapes, as the existing switches do. In build(), warm up both new partial shapes (unfrozen and frozen 32 px graphs) with channels_last tensors in the exact timed layout (E035). Run debug_nan.py on the new shapes and compare trial-0 with later-trial train times. Rationale: E058 priced the last 20% at ~0.02 pp per 1% of time, the cheapest lever found so far (D025 C0237/C0246: early layers converge first). This run prices the next 10%.
E062	53eb8c7	0.7488666666666667	4.491066042001573	True	no	no	discard	I080	FreezeOut cascade: freeze block 2 for the last 10% of samples, following D025 (b) and C0239. Block 2 is frozen only after block 1, because in a skip-free net detaching block 2 cuts all gradient to block 1. On the tip (E058, or the successor of the block-1-at-0.7 idea, I077 or I078 if one is kept), make one change: from sample 303750 (6.075 epochs, 0.9 of samples) to the end, use a fourth 32 px train-step graph variant in which block 2's output is detached. Blocks 1 and 2 still run forward in train mode, so their BN running stats keep updating. Pair it with a third compiled Muon-step variant that contains only the 576-wide block-3 shape group, and skip block-1 and block-2 BN biases in the SGD group through the same variant flag. The backward then skips block 2's wgrad and dgrad and block 3's first-conv dgrad. Conv FLOPs per step fall from ~0.81x to ~0.49x of an unfrozen 32 px step. Lookahead still blends blocks 1 and 2. Pick the variant in Python by sample count, with no data-dependent branch in the graph. Split the straddling step at 303750 into the two partial shapes. In build(), warm up the new train and Muon variants plus every partial shape at the 0.9 switch and at the run end, with channels_last tensors in the exact timed layout (E035). Keep build under ~450 s. Run debug_nan.py on the new graph and compare trial-0 with later-trial train times.
E063	3a94ad6	0.7532666666666666	4.751105472333923	True	yes	no	discard	I081	Cash in the freeze exchange rate as margin. Freezing costs ~0.02-0.05 pp per 1% of time, while 32 px epochs buy ~0.08-0.15 pp per 1%, so freeze-more plus more epochs should net time at equal accuracy. Run this only after the block-1-at-0.7 and block-2-cascade ideas have been read. Base: the faster feasible commit among them if one was kept. Otherwise stack every freeze change that was infeasible by <=0.15 pp onto E058; if neither qualifies, skip this idea. Make one change: total epochs 6.75 -> 7.0, with the extra 0.25 epoch added to the 32 px stage (stage boundaries at 1.5 and 3.5 epochs stay in samples). Scale the lr warmup and decay, the Muon multiplier and the lookahead (t/T)^3 ramp to samples seen. Keep the freeze points as fractions of total samples (for example 0.7 and 0.9), so they move proportionally. The last quarter-epoch uses the first quarter of that epoch's permutation, as in E027. In build(), warm up every new partial shape at the moved freeze switches and at the new run end for each graph variant, with channels_last tensors in the exact timed layout (E035). Run debug_nan.py on new shapes and compare trial-0 with later-trial times.
E064	acc857e	0.7483	4.496233194666274	True	no	no	discard	I082	Partial freezing by update thinning, as an explore against a hard earlier freeze. On the tip (E058 or its successor), make one change: during the 32 px stage before the existing freeze (samples 175000-270000, epochs 3.5-5.4), run the existing block-1-frozen graph pair (detached block-1 output, and the Muon variant without the 128x1152 group) on every odd step, and the normal graph pair on even steps. On frozen steps block 1 gets no gradient: its Muon momentum buffer is not updated and its BN biases are skipped in SGD, while its BN running stats still update. The lr schedules are unchanged, so block 1 takes half as many rotations in that window, each from a full-batch gradient. Pick the variant in Python by step parity, with no data-dependent branch. No new graphs are needed, since both variants already exist at 32 px. Warm up any new partial shape at the 3.5-epoch and 5.4-epoch switches with both variants in the exact timed layout (E035). Compare trial-0 with later-trial times.
E065	c93c5ea	0.7386333333333334	4.704673618999853	True	no	no	discard	I083	RMS-matched test of scheduled orthogonalization strength. This is the form requested when I054 was dropped, so that a result is not confounded with a lower effective Muon lr (H1.2.4). On the tip (E058 or its successor), make one change inside the batched compiled Muon step. Today each momentum matrix is scaled to Frobenius norm 1 before NS3. Instead, scale it to s_t, which decays linearly from 0.50 at step 0 to 0.08 at the final step (Hiverge's CIFAR-10 schedule). Run the same 3 quintic iterations, then rescale each NS output matrix so its Frobenius norm equals that of the tip's NS output for that shape group (or, more simply, sqrt(min(out,in)) times the existing sqrt(max(1,out/in)) factor). The per-step update magnitude is therefore unchanged, and only how strongly the small singular directions are flattened changes. Pass s_t as a 0-d GPU tensor updated with fill_, so nothing recompiles. Weight-norm projection, Muon lr 0.16, momentum 0.8, lookahead, the curriculum, freeze points and epochs stay unchanged. In drafts/, log the per-group update Frobenius norm and the fraction of singular values above 0.5 at steps 0, 100 and the end, against the tip, to confirm the norms match and the spectrum is less whitened late in training. Run debug_nan.py under max-autotune-no-cudagraphs and re-warm the Muon variants in build().
E066	fb4c95c	0.7511333333333333	4.706918195333856	True	no	no	discard	I084	NorMuon on the conv filters. On the tip (E058 or its successor), make one change inside the batched compiled Muon step: after NS3 and before the sqrt(max(1,out/in)) scaling, apply per-row (per output filter) second-moment normalization. Keep a buffer v per group of shape [n_mats, out, 1], initialised to zero in prepare() (reset per trial). Update v = 0.95*v + 0.05*mean_over_cols(O^2) and set O' = O / sqrt(v_hat + 1e-8), with bias correction v_hat = v / (1 - 0.95^t). Then rescale O' to the Frobenius norm O had, so the per-step update magnitude is unchanged and only its distribution across filters changes. The weight-norm projection, Muon lr 0.16, momentum 0.8, lookahead, curriculum, freeze variants and epochs stay unchanged. The frozen-block Muon variants must update v only for the groups they contain. Pass the step count as a 0-d tensor. Re-warm all Muon variants in build() on synthetic tensors, and run debug_nan.py under max-autotune-no-cudagraphs.
E067	ef13cec	0.7528	4.5502423699993715	True	no	no	discard	I086	Anneal block 1 before an earlier freeze, combining with E061's near-miss (freeze at 0.7, -0.11 pp, infeasible by 0.04). Base: E058 (fb3f626). Make one change: between samples 0.6 and 0.7 of training (162000 → 236250), multiply block 1's per-step lr by a factor that falls linearly from 1 to 0. This applies to both block-1 Muon lrs (the 128x1152 and 128x216 shape groups) and to block-1 BN-bias lrs in the SGD group. Then, from sample 236250, switch to the existing block-1-frozen graph pair (E061's switch point, with the same straddling-step split). Pass the block-1 multiplier as its own 0-d GPU tensor, filled each step, into the batched Muon step and the SGD param group, so nothing recompiles. Every other group keeps its schedule, and momentum buffers keep accumulating. Lookahead is unchanged, so the slow block-1 weights converge onto the now-still fast weights. Reuse E061's partial-shape warmups (channels_last, exact timed layout). Run debug_nan.py on the modified Muon step and compare trial-0 with later-trial times.
E068	c5c5dc0	0.7513333333333333	4.688112749999466	True	no	no	discard	I088	Online Label Smoothing replaces uniform LS 0.2. Base: E058. Make one change to the loss. Keep a 100x100 fp32 GPU matrix S (column c = soft target for class c), reset in prepare() to the LS-0.4 matrix (0.6 on the diagonal + 0.4/100 everywhere), plus an accumulator S_acc and counts, zeroed. Training target for a sample of class y: t = 0.5*onehot(y) + 0.5*S[:, y]. At initialization this is exactly LS 0.2, so behaviour is unchanged until the first swap. Inside the compiled step, with no data-dependent branch, add softmax(logits.detach().float()) * correct_mask into S_acc's column y with index_add_ / scatter_add, and add correct_mask to counts. At every half-epoch boundary (picked in Python by samples seen, between steps), set S = S_acc / counts.clamp_min(1). Keep the old column for any class with count 0, then zero S_acc and counts. Pass S, S_acc and counts as tensor inputs, so nothing recompiles. Accumulation runs in every resolution stage and freeze variant. Re-warm all train variants in build() on synthetic data and run debug_nan.py. Eval is unchanged.
E069	5ed8687	0.7560666666666667	4.677514302001025	True	yes	yes	keep	I089	Stronger whitening at the same update norm and no extra cost: swap the fixed quintic coefficients (3.4445, -4.7750, 2.0315) used in all 3 NS iterations for three per-iteration Polar Express triples. Compute them with optimal_composition(num_iters=3, l=ℓ) from arxiv 2505.16932, where ℓ is the 5th-percentile smallest-singular-value ratio measured in drafts/ on the tip's real normalized momentum matrices (seed 0, steps 0/100/end, all groups). Apply the published safety scaling and do not truncate a longer list. After NS, rescale each group's output to the Frobenius norm the current NS3 output would have. Compute this cheaply as a per-group constant measured in drafts/, or online as the ratio of norms if that is cheap, so only the spectrum shape changes and the step size does not. Base: E058; everything else is unchanged. Gate in drafts/: the fraction of singular values >0.5 after the new NS must be >= NS3's, and the max singular value must be <= 1.3. Re-warm both Muon variants and run debug_nan.py under max-autotune-no-cudagraphs.
E070	54ae25e	0.7498	4.469767665999825	True	no	no	discard	I090	Cash in E063's shallow epoch slope. Run only if the H4.1.2 extra-seed mean is >= 0.7535, or after a keep that banks >= +0.1 pp (H7.1.1, OLS, Polar Express). Base: the then-tip, else E058. Make one change: total epochs 6.75 → 6.5, with the 0.25 epoch removed from the 32 px stage. The 20 px (0-1.5) and 28 px (1.5-3.5) boundaries stay fixed in samples. The block-1 freeze stays at 0.8 of the new total samples (260000), and the lr warmup/decay, Muon multiplier and lookahead (t/T)^3 ramp are scaled to samples seen. The final half-epoch uses the first half of that epoch's permutation (E006/E018 practice). Warm up every new partial shape at the moved freeze switch and the new run end for each graph variant, with channels_last tensors in the exact timed layout (E035). Run debug_nan.py on new shapes and compare trial-0 with later-trial times.
E071	5769443	0.7551	4.6363921493345215	True	yes	yes	discard	I091	Partial block-2 freeze. Base: E058 (or the H7.1.1 successor). For the last 10% of samples (from 303750, i.e. 6.075 epochs), use a new 32 px train variant that is the block-1-frozen graph plus a detached weight for block 2's first conv only (conv(x, w.detach()) behind a Python flag fixed at trace time). Block 2's later convs, all of block 3 and block-2 BN biases keep training. Pair it with a Muon variant that excludes the 128x1152 block-1 groups and block 2's 384x1152 first-conv group (its own shape group, so it drops out cleanly). Block 2's first-conv dgrad is already skipped once block 1 is frozen, so this removes its wgrad (~300 GFLOP fwd-equivalent at 15x15, bs 1536) plus one NS group. Split the straddling step at 303750 into the two partial shapes. Warm up the new train and Muon variants and every partial shape in build() with channels_last tensors (E035). Run debug_nan.py and compare trial-0 with later-trial times.
E072	c34db04	0.7548333333333334	4.682082936667332	True	yes	no	discard	I092	Margin-recovery probe on the last untested SGD-group setting. Base: E058. Change only the BatchNorm-bias lr multiplier, from x64 to x32 (relative to the current x1.5-scaled SGD base lr), and double the BN-bias wd so lr*wd stays constant. The head (x2, wd halved), whitening bias, Muon, lookahead, curriculum, freeze, jitter and epochs are all unchanged. The lr is a 0-d tensor / eager param-group value, so there are no new shapes and nothing recompiles.
E073	5c3c556	0.7523	4.575955434998225	True	no	no	discard	I093	Spend part of E069's banked margin on the cheapest time cut found so far: freeze block 1 earlier. Base: E069 (commit 5ed8687; Polar Express NS3 coefficients with output rescaled to NS3's Frobenius norm, bs 1536, 20/28/32 px curriculum at 0-1.5/1.5-3.5/3.5-6.75 epochs, head x2, Muon lr 0.16 mom 0.8, lookahead 0.97^5, jitter, whitening bias trained in epoch 1 only, block 1 frozen from 0.8). Make one change: switch to the existing block-1-frozen graph pair at sample 236250 (0.7 of samples, E061's point) instead of 270000. That pair is the detached block-1 output with the Muon variant without the block-1 groups (now running the Polar Express coefficients), with block-1 BN biases skipped in SGD. Split the straddling step into the two partial shapes, as E061 did. Reuse E061's partial-shape warmups with channels_last tensors in the exact timed layout (E035), and confirm that the Polar Express Muon variant without block 1 is warmed at those shapes. Run debug_nan.py and compare trial-0 with later-trial times. Do not anneal block 1 first: E067 showed the anneal adds nothing.
E074	a9bf7d5	0.7513333333333333	4.601042431330522	True	no	no	discard	I094	Retry E054's near-miss on the margin E069 banked. Base: E069 (commit 5ed8687). Make one change: move the 28 -> 32 px switch from 3.5 to 4.0 epochs (sample 200000), so 28 px runs epochs 1.5-4.0 (still without translate) and 32 px with translate-2 runs 4.0-6.75. Total epochs, bs, the sample stream, the block-1 freeze at 0.8 (sample 270000) and every sample-indexed schedule stay unchanged. Port the switch logic from E054 (commit 81c1232) and split the straddling step into the two partial shapes. In build(), warm up the new partial shapes at sample 200000 for the 28 px and 32 px graphs with channels_last tensors in the exact timed layout (E035). Keep build under ~450 s. Run debug_nan.py on the new shapes and compare trial-0 with later-trial times.
E075	0ab21a9	0.7472	4.806341284665298	True	no	no	discard	I099	Explore the low side of the Muon lr on the new whitening. Polar Express lifts ~95% of singular directions against ~86% for the old NS3, and the output is rescaled to the old Frobenius norm, so the per-direction rotation is smaller and spread more evenly. The lr optimum may have moved. Base: E069. Make one change: Muon lr 0.16 -> 0.12 for the conv filters, with schedule shape, floor, momentum, SGD group, lookahead, curriculum, freeze and epochs all unchanged. The lr is fill_'ed into a 0-d tensor every step, so nothing recompiles.
E076	bd590c1	0.7507	4.666763829998672	True	no	no	discard	I100	Cheaper frozen block 1. Run only after the freeze-at-0.7 idea is read: apply this to its commit if it was kept (a 30% frozen window makes the saving gradable), else to E069. Make one change inside the existing block-1-frozen 32 px train graph: run block 1's BatchNorms in eval mode, using the running stats as of the freeze switch, with no further stat updates. The forward then skips the batch-stat reductions and running-stat writes. Use a Python flag fixed at trace time, with no data-dependent branch. Lookahead keeps blending block 1's buffers, now constant. Re-warm the frozen graph and its partial shapes in build() with channels_last tensors in the exact timed layout (E035). Run debug_nan.py and compare trial-0 with later-trial times.
E077	d47faa3	0.7529	4.617331202663384	True	no	no	discard	I106	Cut the fixed prepare() overhead without touching training numerics. Base: E069 (commit 5ed8687). Background: I102 showed that reruns of E069 are bit-identical on seeds 0-2. Prepare took 0.152/0.146/0.062 s on trials 0/1/2 (mean ~0.12 s, ~2.5% of the score), so trials 0-1 pay ~0.09 s of first-use cost. Gate in drafts/, untimed. Instrument prepare() per component on each of 3 consecutive trials in one process, using cuda-synchronized timers: file read/unpickle, label conversion, H2D copy, uint8 buffer setup, whitening fit (covariance, then eigh or whatever the code uses), parameter/buffer/optimizer/lookahead/Muon-buffer reset, and generator seeding. Launch only if the trial-0/1 excess plus any removable steady-state cost is >=0.05 s per trial on average. Change (all in build() on synthetic inputs, never real data or seeds): (1) Run the whitening-fit linear algebra once on a synthetic covariance of the exact shape, dtype and device. This initializes the cuSOLVER/cuBLAS handles and workspaces before the timed region. (2) Allocate and free synthetic tensors of the exact sizes prepare() and train() create: the on-GPU uint8 train set, labels, the per-epoch augmented and resized buffers at 20/28/32 px, and the permutation. The caching allocator then already holds those blocks. (3) Allocate an empty pinned host staging buffer of the train-set size. prepare() reads the real data into it and does a non_blocking H2D copy, with a sync before the whitening fit. Leave every arithmetic op, the RNG order and the data order unchanged. Before launching, rerun offline on seeds 0-2 and require per-seed accuracy bit-identical to E069 (0.7578/0.7535/0.7569). Also log per-trial prepare times.
