exp	commit	accuracy	time	complete	feasible	improved	status	tag	description
E088	e7f81c7	0.7529	4.457496755666701	True	no	no	discard	I095	Combine two near-misses: E084's bs-1024 32 px phase (+0.18 pp scored, +0.11 pp off-seed, +2.5% time) pays for the first fractional 32 px trim on a Muon base. Base: E084 code (3e30852, samples-indexed _fit, bs 1536 at 16/24 px, bs 1024 at 32 px) with E086's pinned staging buffer ported unchanged. The staging change is math-neutral and was confirmed bit-identical in E086/E087. Change only the length of the 32 px phase, from 4 to 3.75 epochs: 2@16 + 1.25@24 + 3.75@32 px (7.0 ep). The switch is indexed by samples seen. LR warmup/decay, the floor-hold, the final-EMA window, the lookahead stop and the renorm cadence are rescaled by samples, exactly as E084 did. All shapes are already warmed up in build. Precondition, untimed: log the source hash and a diff against 3e30852 plus 749bdce, so the run joins the right family (H4.2.4). Decide with an untimed off-seed run on seeds 3-10 plus two scored runs.
E089	18b2ebd	0.7515	4.451192977663595	True	no	no	discard	-	I095 second scoring (E088 code e7f81c7)
E090	48b13a7	0.7530666666666667	4.458946407331193	True	yes	yes	keep	I096	Equal-time sibling of the bs-1024 32 px trim idea, on the same base: E084 code plus the E086 pinned staging. Step 1, untimed: measure the compiled cost of a 28 px epoch at bs 1024 against a 32 px epoch at bs 1024 (2 epochs each, static shapes). If the ratio is >0.85x, drop the idea without a scored run. Step 2: replace the first 1.25 epochs of the 32 px phase with 28 px, using the same operator (flip + translate-2 at 32 px, then antialiased bilinear to 28 px; maps 27/13/6/3, max(dim).values pool). The schedule is 2@16 + 1.25@24 + 1.25@28 + 2.75@32 px. Samples seen are unchanged, so the step count is unchanged and LR/EMA/tail/renorm are untouched. Compile the bs-1024 28 px shape as a static graph and warm it up in build. Decide with an off-seed run on seeds 3-10 plus two scored runs, and compare against the trim arm.
E091	367cac1	0.7530666666666667	4.462180578331754	True	yes	no	discard	-	I096 second scoring (E090 code 48b13a7)
E092	a47c48c	0.7499333333333333	4.438997104669397	True	no	no	discard	I097	Base: the current tip (E086 code 749bdce: E070 schedule, Fable tail, pinned staging). Remove the SGD-era lookahead-EMA entirely, so the net trains on its own weights throughout. Drop its buffers and its foreach kernels from build and from the step loop. Keep the floor-hold, the final 8-step EMA (0.3 lerp every 4 steps), eval on the EMA weights and the BN buffers copied from the net. Change nothing else. Decide with an untimed off-seed run on seeds 3-10 against the tip's 0.7530, plus two scored runs; read the per-trial train-time logs.
E093	4aa8dc7	0.7475	4.426199502668169	True	no	no	discard	I098	Base: the tip (E086 code). Precondition, free: log the current whiten_bias_epochs value in step terms. Then verify, in an untimed compiled-graph dump, that the steps after the detach have no stem dgrad or bias-reduction kernels. This was the H2.15.1 premise, and code reading says it is already present. Change only the freeze point. Train the whitening bias for the first 0.2 epoch (~7 steps at bs 1536), with its own LR tensor decaying linearly to 0 over that window (hiverge), then switch to the existing whiten_bias_grad=False graph for the rest of training. Both graph variants already exist and are warmed up for 16 px; the 24/32 px shapes need only the detached variant. Decide with an off-seed run on seeds 3-10 plus two scored runs.
E094	711438d	0.7517	4.469204426667905	True	no	no	discard	I099	Instrument calibration, with no recipe change. Rerun the unchanged tip (E086 code) on seeds 3-10 in at least 3 fresh processes through the benchmark's trial code. Each process rebuilds, so cuDNN benchmark picks are resampled. Continue until there are >=2 off-seed samples that are not bit-identical. Log the per-seed final-weight checksums (H4.4.1) and the cuDNN conv kernel names per (layer, shape) (H4.5.1). Report the sd of the 8-seed off-seed mean across the non-identical samples, and check whether the run means cluster by algorithm set. For the scored row, rerun the tip once; it adds a non-bit-identical tip sample if one occurs.
E095	0503e38	0.7537333333333334	4.696623133332953	True	yes	no	discard	I100	Ablation of E084's EMA-window confound. Base: E084 code plus the E086 pinned staging. Pin the final-EMA window and the lookahead stop to the tip's step counts (the last 8 steps, indexed from the end) instead of to equal sample counts, which gave ~12 steps at bs 1024. Change nothing else. Run one scored run and an off-seed run on seeds 3-10, compared against E084's off-seed 0.7541 and the tip's 0.7530. If the result is >= E084, use this window in the 32 px trim and 28 px arms that follow.
E096	545b6d0	0.7539333333333333	4.4671269899990875	True	yes	no	keep	I102	I100 rebased onto the current tip. Base: E090 code (48b13a7): 2@16 + 1.25@24 at bs 1536, then 1.25@28 + 2.75@32 at bs 1024, with pinned staging and the Fable tail. Because the tip indexes by samples, the final-EMA window and the lookahead stop cover the same sample count as the bs-1536 tip, which is ~12 steps at bs 1024 (~3 EMA updates). Change only this: pin both to step counts measured from the end, so the final EMA covers the last 8 steps (lerp 0.3 every 4 steps, ~2 updates) and lookahead stops 8 steps before the end. The floor-hold point stays sample-indexed and unchanged. This is a host-side step-index change only and nothing recompiles. Precondition, untimed: log the source hash and a one-line diff against 48b13a7. Decide with an off-seed run on seeds 3-10 against the tip off-seed distinct mean (~0.7526, sd ~0.09 pp, E094), plus two scored runs. If it is accepted, use the pinned window in every later bs-1024-tail arm.
E097	fb1429a	0.7539333333333333	4.464765309329475	True	yes	yes	discard	-	I102 second scoring (E096 code 545b6d0)
E098	26919b6	0.7496	4.469796770664591	True	no	no	discard	I109	Instrument and tip decision, with no recipe change. In untimed side scripts, run the unchanged E090 code (48b13a7) and the unchanged E095 code (0503e38) through the benchmark's own trial code on seeds 3-26: 24 seeds each, one fresh process per config so the cuDNN picks are resampled. Do not edit benchmark/. Log per-seed accuracy, per-seed final-weight checksums, and the cuDNN conv kernel names per (layer, shape) from the profiler in build and the first steps; this is the free by-product for H4.5.1. For the scored row, rerun E090 unchanged; a non-bit-identical result adds a third distinct tip sample. Store both 24-seed per-seed vectors as the paired baselines for every later off-seed A/B on seeds 3-26.
E099	3a3c031	0.7533666666666666	4.476680288333834	True	yes	no	discard	I110	Math-neutral FLOP-free time lever. Base: E090 code. At the very start of build, before any conv runs, set torch.backends.cudnn.benchmark_limit = 0 so that cuDNN v8 tries every available algorithm for each static train shape (16/24 px at bs 1536, 28/32 px at bs 1024, both whitening-bias-grad variants) and for the eval path, instead of the default 10. Change nothing else. Log the build time, which must stay <600 s, the per-phase epoch times, and the conv kernel names per (layer, shape), and diff the kernel names against the E090 defaults logged by the H4.2.7 run. Score twice and compare distinct samples against the E090 family.
E100	176e5ec	0.7560666666666667	4.466691244000685	True	yes	yes	keep	I111	Path-length test, run directly on the tip so a positive result is immediately bankable. Deviation from the H10.2.1 text: it uses the E090 base instead of E086, so it reuses the seeds 3-26 E090 baseline from the H4.2.7 run and needs no new control. Base: E090 code. In the 32 px phase only (the final 2.75 epochs at bs 1024, floor-hold included), multiply the conv-filter Muon lr schedule by 1.25 (0.24 -> 0.30 at the same schedule position). The head keeps its 0.5x multiplier and scales along. The 16/24/28 px phases are unchanged. Implement it as a phase-keyed host-side factor written into the existing 0-d lr tensor, so nothing recompiles. Decide on off-seed seeds 3-26, paired against the E090 baseline, plus two distinct scored samples.
E101	bac6afb	0.7515666666666666	4.4616292640009005	True	no	no	discard	-	I111 second scoring (E100 code 176e5ec)
E102	905df4f	0.7520666666666667	4.5189461129994015	True	no	no	discard	I112	Resolution-statistics adaptation test (the 70% arm). Base: E090 code. Move the whitening-bias detach point from ~41% of samples (inside the 24 px phase) to ~70% of samples (inside the 32 px phase, after both the 28 and 32 px switches). Keep the bias LR schedule otherwise unchanged. Warm up the whiten_bias_grad=True graph variants for the 24 px bs-1536, 28 px bs-1024 and 32 px bs-1024 shapes in build on synthetic data. Change nothing else. Log the whitening-bias vector norm and its relative change across each resolution switch. Decide on off-seed seeds 3-26, paired against the E090 baseline, plus two distinct scored samples.
E103	1318a69	0.7535333333333333	4.457322438667082	True	yes	yes	discard	I113	Discriminating test for end-of-run averaging, matching the H6.5.4 spec on the current tip. Base: E090 code. Replace the 8-step final EMA with E081's 20-step window (lerp 0.3 every 4 steps from 20 steps before the end, initialized from the net at the window start). Also lerp every BN running_mean/running_var buffer with the same weights, in the same foreach_lerp, instead of copying the buffers from the final net. EMA buffer copies are allocated in build and reset in prepare. The lookahead stop and floor-hold are unchanged, and nothing recompiles. Decide on off-seed seeds 3-26, paired against the E090 baseline. Add one scored run, and a second only if off-seed is >= +0.05 pp.
E104	594b48e	0.7524666666666667	4.590177353665543	True	no	no	discard	I104	I101 rebased onto the current tip (its old base, E086, is superseded). Base: E090 code, which already has the samples-indexed _fit. Run the 16 and 24 px phases at bs 1024 instead of 1536, which adds ~53 steps. The 28/32 px phases and the whole tail stay as on the tip. LR warmup/decay, the floor-hold and the renorm cadence are indexed by samples. Scale the SGD groups per phase by the kilostep rule and leave Muon lr and momentum unchanged. Compile static bs-1024 16/24 px shapes, including the whitening-bias-grad variant at 16 px, and warm them up in build. Decide with an off-seed run on seeds 3-10 plus one scored run. Compare the gain per added step with E084 (+0.11 pp off-seed for ~65 tail steps).
E105	5733628	0.7524666666666666	4.469324076999328	True	no	no	discard	I105	On the current tip (E090 code), change only the conv-filter Muon peak lr from 0.24 to 0.28 through its 0-d tensor. The head keeps its 0.5x multiplier, so its lr scales along, and nothing recompiles. The schedule shape, floor and tail are unchanged. Muon lr was only ever tuned at bs 1024 with ~384 steps on a pre-tail base (E034). The tip now has ~280 steps, mixed batch sizes and a floor-hold tail, so the optimum may have moved up. Decide with an off-seed run on seeds 3-10 against the tip's distinct mean, plus two scored runs.
E106	c8d5714	0.7550666666666667	4.469218753001769	True	yes	no	discard	I115	Instrument run with no recipe change, and the baseline for every following idea. The tip is E100 code (176e5ec). Its two distinct scored samples are 0.7561 and 0.7516, and its only off-seed sample is one process (22 seeds, 0.7523). E098 showed that one process per arm cannot resolve 0.1 pp. In an untimed side script, run the unchanged E100 code through the benchmark's own trial code on seeds 3-26 in 2 more fresh processes, so cuDNN picks are resampled. Do not edit benchmark/. Log per-seed accuracy, per-seed final-weight checksums and the cuDNN conv kernel names per (layer, shape); the kernel names are the free by-product for H4.5.1. For the scored row, rerun E100 unchanged; a non-bit-identical result adds a third distinct scored sample. Store the pooled 24-seed vectors (>=2 distinct processes) as the paired baseline for every later off-seed A/B.
E107	29c7505	0.7521333333333333	4.47609497733356	True	no	no	discard	I116	Placement-paired test of the path-length mechanism in the low-res phases. E104 bought ~+0.12 pp off-seed by running the 16/24 px phases at bs 1024, i.e. ~1.5x more Muon steps there, at +2.8% time. If the gain is Muon path length (lr × steps) rather than update count, a 1.5x larger Muon lr in those phases should reproduce it at zero time. Base: E100 code. In the 16 and 24 px phases only (bs 1536, warmup included), multiply the conv-filter Muon lr schedule by 1.5 (0.24 -> 0.36 at the same schedule position). The head keeps its 0.5x multiplier and scales along. The SGD groups, the 28/32 px phases (32 px keeps its 1.25x) and the tail are unchanged. Implement it as a phase-keyed host-side factor written into the existing 0-d lr tensor, so nothing recompiles. Before scoring, smoke-test that the 16 px loss stays finite over the first 30 steps. Decide on off-seed seeds 3-26 in >=2 fresh processes, paired against the E100 baseline, plus two distinct scored samples.
E108	340ecc1	0.7527333333333333	4.481092582665345	True	no	no	discard	I121	Equal-time reallocation from the 32 px phase into the 24 px bridge. This is the direct discriminating test between H8.2 (the bridge is worth ~0.13 pp per 1%) and H11 (late full-resolution training is what binds). Base: E100 code (176e5ec). If I116 (low-res Muon lr x1.5) is banked first, rebase onto it and say so in the log. Change only the schedule: 2@16 + 1.75@24 at bs 1536, then 1.25@28 + 2.5@32 at bs 1024 (was 1.25@24 and 2.75@32). Total samples stay at 7.5 epochs. Resolution switches, LR warmup/decay, the floor-hold, the renorm cadence and the 32 px-phase Muon factor (1.25x) are indexed by samples, as in E100. The final-EMA window and lookahead stop stay pinned to the last 8 steps. All shapes are already static and warmed up in build. Precondition, untimed: log the source hash and a one-line diff against 176e5ec. Pre-registered time: +0.5 epoch at 24 px (~+0.26 s) minus 0.25 epoch at 32 px/bs 1024 (~-0.23 s) gives +0.3 to +0.9%. Decide on off-seed seeds 3-26 in >=3 fresh processes, paired against the pooled E106 baseline, plus two distinct scored samples.
E109	ba982f9	0.7527333333333333	4.486173920997923	True	no	no	discard	-	I121 second scoring (E108 code 340ecc1)
E110	77889b2	0.7564	4.454934563999511	True	yes	yes	discard	I117	Dose-response on the one weakly supported zero-time lever. E100 multiplied the 32 px-phase filter Muon lr by 1.25 (+0.09 pp off-seed, distinct scored mean 0.7538). Base: E100 code. Change only that 32 px-phase factor, from 1.25 to 1.5 (0.36 at the same schedule position; the floor-hold covers the same samples, at 1.5x). The head keeps 0.5x and scales along. Nothing else changes, and the phase-keyed 0-d tensor means nothing recompiles. Decide on off-seed seeds 3-26 in >=2 fresh processes against the E100 baseline, plus two distinct scored samples.
E111	d472c44	0.7546666666666667	4.468147310998272	True	yes	no	discard	I118	Extend E100's path-length factor to the other bs-1024 phase. In E100 only the 32 px phase got the 1.25x Muon lr. The 1.25-epoch 28 px phase also runs at bs 1024 and is part of the late, test-adjacent training that H11 calls binding. Base: E100 code. In the 28 px phase only, multiply the conv-filter Muon lr schedule by 1.25. The head scales along. The 16/24 px phases, the 32 px factor (1.25) and the tail are unchanged. This is a phase-keyed host-side factor, so nothing recompiles. Decide on off-seed seeds 3-26 in >=2 fresh processes against the E100 baseline, plus two distinct scored samples. If the low-res-lr idea (H10.2) passes first, rebase onto it.
E112	00ced7f	0.753	4.467791045666672	True	yes	no	discard	I122	Class-balanced (stratified) minibatches at zero compute. Base: E100 code. Inside train, at the start of each epoch, build the permutation on the GPU from the global RNG, which the harness seeds per trial. Nothing is built at import or in build. Steps: (1) for each of the 100 classes, shuffle its 500 indices into a [500, 100] (rank, class) index matrix, using one argsort of random keys within class-sorted labels; (2) independently permute the class order within each rank row; (3) flatten row-major. Every consecutive block of 100 then contains each class exactly once, so a bs-1536 batch holds 15-16 images per class and a bs-1024 batch holds 10-11. The class-sorted label index is computed in prepare, which is timed. Samples, steps, shapes and augmentation are unchanged, and the net graph is untouched. Untimed check: the per-batch class-count max-min is <=1 and the epoch covers all 50,000 images exactly once. Decide on off-seed seeds 3-26 in >=3 fresh processes, paired against the E106 pooled baseline, plus two distinct scored samples.
E113	5e0f9ed	0.7532333333333333	4.461653423333094	True	yes	yes	discard	I125	Calibrate the large-seed paired instrument. Nothing changes in the scored path. In an untimed side script, run the benchmark's own trial code (benchmark/ is not edited) on seeds 3-102 for two arms, one fresh process each. Arm A is unchanged E100 code (176e5ec). Arm B is E100 plus one math-neutral perturbation that does change fp bits: in prepare, compute the normalization as x*inv_std - mean*inv_std instead of (x-mean)*inv_std, which re-draws every seed's trajectory. Log per-seed accuracy, per-seed final-weight checksums and the cuDNN conv kernel names per (layer, shape). Free by-product for H4.5.1: in the same session, cluster the kernel-name sets already logged in E094/E098/E099/E106 against their process means. Store arm A's 100-seed vector as the paired baseline for every later large-seed A/B, so H8.2.2 needs only its treatment arm. Scored row: rerun E100 unchanged, which adds a 4th distinct scored sample.
E114	9a1a4ea	0.7553333333333333	4.45976223366597	True	yes	yes	discard	I126	Decisive test of bridge versus tail on the large-seed instrument. Run E108 code (340ecc1: 2@16 + 1.75@24 at bs 1536, then 1.25@28 + 2.5@32 at bs 1024, everything else as E100) untimed through the benchmark trial code on seeds 3-102, one fresh process. Pair it per seed against the E100 vector from the H4.6.1 calibration run. Gate: run only after H4.6.1 has produced its baseline and SE. Precondition, untimed: log the source hash and a one-line diff against 176e5ec. Scored row: rerun E100 unchanged, which adds another distinct gate sample (also useful to H4.8).
E115	657f310	0.7553666666666666	6.972298407999915	True	yes	no	crash	I127	Late freeze of group 1 plus the stem as a FLOP/byte time lever, profiled untimed first. Step 1, untimed side script on E100 code: build a second static 32 px / bs-1024 train graph in which group 1's output is detached (no backward into group 1 or the stem; group-1 BN still runs in train mode). Warm it up in build. Measure ms/step and NVML energy over 20 steps for each variant, and project total run time for freezes over the last 15% and last 30% of samples. Step 2, only if the detached step is >=8% cheaper: score a freeze from 85% of samples, which lies inside the 32 px phase and covers the floor-hold and final EMA. From then on, group-1 filters drop out of the compiled Muon stacks (a second warmed variant of the update, with momentum untouched) and group-1 BN params drop out of the SGD foreach. Lookahead and the final EMA stay unchanged. Selection is a host-side flag, so nothing recompiles in timed code. Decide accuracy on the large-seed paired instrument (H4.6.1) against E100, plus two distinct scored samples.
E116	82e6219	0.7500666666666667	4.305568195666031	True	no	no	discard	I127	Late freeze of group 1 plus the stem as a FLOP/byte time lever, profiled untimed first. Step 1, untimed side script on E100 code: build a second static 32 px / bs-1024 train graph in which group 1's output is detached (no backward into group 1 or the stem; group-1 BN still runs in train mode). Warm it up in build. Measure ms/step and NVML energy over 20 steps for each variant, and project total run time for freezes over the last 15% and last 30% of samples. Step 2, only if the detached step is >=8% cheaper: score a freeze from 85% of samples, which lies inside the 32 px phase and covers the floor-hold and final EMA. From then on, group-1 filters drop out of the compiled Muon stacks (a second warmed variant of the update, with momentum untouched) and group-1 BN params drop out of the SGD foreach. Lookahead and the final EMA stay unchanged. Selection is a host-side flag, so nothing recompiles in timed code. Decide accuracy on the large-seed paired instrument (H4.6.1) against E100, plus two distinct scored samples.
E117	dc7657b	0.7534333333333333	4.49349159666599	True	yes	no	discard	I123	Group-3 width set by tile alignment, decided cheaply first. Step 1, free: read the cuDNN/cutlass kernel names already logged for the group-3 convs at 28/32 px bs 1024 and 24 px bs 1536 (E094/E098/E099/E106 profiler logs). If every group-3 GEMM uses a tile width dividing 576 (64-wide N/M tiles), close H2.19 with no run. Step 2, untimed, only if 128/256-wide tiles appear: in a side script on E100 code, build group-3 widths 512, 576 and 640. Group-3 conv1 input stays 384, the head becomes [100, W], and the Muon stacks are re-batched. Compile and warm up all shapes. Measure ms/step and NVML energy over 20 steps per (resolution, batch) shape, and project total run time over the E100 schedule. Step 3: score 640 on E100 only if it projects <=+1.5% total time. Decide on off-seed seeds 3-26 in >=3 fresh processes against E106, plus two distinct scored samples. If no scored arm is justified, the scored row reruns E100 unchanged as an extra distinct tip sample.
